"fromsite", "positionType", "positionName", "salary", "education", "city", "workYear", "jobDes", "company", "companySize", "financeStage", "industryField", "rate", "number"
"智联", "Node.js", "Node.JS后台工程师", "15001-20000", "大专", "郑州", "3-5年", "...Node.js），对移动端后端接口开发熟练；  3、 参与过大型互联网项目设计、具备架构选型经验，熟悉服务器管理，系统部署；  4、 至少精通一种数据库开发、配置、维护、性能优化（如Oracle, Sqlserver, Mysql, MongoDB），MongoDB优先", "郑州好玩软件科技有限公司", "20-99人", "民营", "计算机软件,互联网", "", "5"
"智联", "Node.js", "银科控股直招  Node.js研发工程师  双休 15W-35W", "15001-20000", "本科", "上海", "1-3年", " 岗位职责:   1、负责聊天系统后台的开发和维护；  2、负责移动端后台接口的开发和维护；  任职要求：  1、本科及以上学历，计算机相关专业；  2、2年以上后端开发工作经验，熟练运用Node.js，了解PHP、Python、Puby以及任何后端语言一年以上的经验；  3、熟悉Ja...", "天津融金汇银贵金属经营有限公司上海分公司", "1000-9999人", "民营", "计算机软件", "", "7"
"智联", "Node.js", "Node.js", "10001-15000", "不限", "青岛", "3-5年", " 1.参与node.js产品的框架设计、开发工作。  2.参与公司node.js相关代码标准的制定与提升。  3.参与对项目需求分析、设计。  4.参与公司对初中级node.js开发人员的培训和审核，帮助其快速成长、适应工作环境。  5.配合市场与产品设计团...", "青岛易迈进信息技术有限公司", "20-99人", "外商独资", "计算机软件    ", "", "12"
"智联", "Node.js", "node.js", "15000-20000", "大专", "北京 - 海淀区", "3-5年", " node.js高级工程师   任职要求：  1、 熟练掌握Javascript编程语言，对组件化开发模式有较深入的理解  2、 熟悉服务器/页面端MVC，对复杂工程有很强的组织能力,熟悉mongo数据库优先  3、 有良好的代码编写习惯，具有编写技术文档的能力与习惯  4、 有其他后...", "APICloud", "20-99人", "外商独资", "计算机硬件    ", "", "5"
"智联", "Node.js", "node.js全栈工程师", "6000-12000", "不限", "北京", "", " 岗位职责：  （1）\\t负责公司网页版应用的设计与实现；  （2）\\t负责公司网站建设、更新与维护；  （3）\\t负责验证和修正测试中发现的问题；  （4）\\t负责根据开发过程中的体验对产品提出改进建议；  任职要求：  (1)\\t计算机相关专业，熟悉网站开发流程，具有网站开发经验。  (2)\\t精通至少两种...", "北京赛四达科技股份有限公司", "20-99人", "股份制企业", "计算机软件,互联网", "", "12"
"智联", "Node.js", "技术开发岗（node.js方向）", "8000-15000", "大专", "深圳", "3-5年", "...Node.js开发, 熟悉服务端技术，例如Redis、MongoDB、MySQL、Nginx等。具有IT系统维护经验；对信息系统架构有一定了解；  4、有较强学习能力，能承担一定工作压力与出差压力；有较强沟通协调能力、应变能力。", "华润电力控股有限公司", "10000人以上", "国企", "互联网/电子商务    ", "", "9"
"智联", "Node.js", "Node.js 软件开发工程师", "8001-10000", "大专", "大连", "", " 职位描述： 1、负责使用node.js和mongodb开发项目的后台功能； 2、需求分析、技术设计、参与协调开发； 3、建立系统的开发文档； 4、项目的日常维护及质量控制； 1.职位要求： 2、一年以上node.js开发经验 3、熟悉使用mongodb或radis 4、...", "上海亿迈广告传播有限公司大连办事处", "100-499人", "民营", "通信/电信/网络设备    ", "", "8"
"智联", "Node.js", "中高级软件工程师（Node.js、Java）", "12000-22000", "本科", "杭州", "3-5年", " 任职资格：     1.   具备   3   年以上服务器程序相关开发经验   ,   了解基本的网络协议和应用     2.   熟练使用   Linux   服务器    (Debian/Ubuntu   优先   )       3.   熟练使用   Java, Javascript, ...", "北京匡恩网络科技有限责任公司", "500-999人", "民营", "计算机软件,互联网", "", "2"
"智联", "Node.js", "node.js后端工程师", "15001-20000", "不限", "广州", "", " 岗位职责：  1、负责后端业务逻辑开发及优化；  2、与产品前端和app开发团队合作，保证前后端模块的协同工作；  3、服务器部署与日常维护，持续优化运行效率；  4、数据汇总与分析，提供数据呈现和运营决策支持。     任职要求：  1、1年以上node.js后端或全栈开发经验； ...", "深圳多新哆技术有限责任公司", "20-99人", "民营", "互联网/电子商务    ", "", "11"
"智联", "Node.js", "node.js开发工程师/javascript开发工程师", "8000-15000", "本科", "深圳", "1-3年", " 岗位职责： 1、LED屏业务服务端及相关开发工作。 任职要求： 1、计算机或相关专业本科或以上学历； 2、熟悉网络服务器设计和开发技术，至少参与过一款已上线产品的开发； 3、熟练掌握Nodejs开发技术，并有具体项目开发经验； 4、熟练使用linux开发环境； 5、熟悉TCP/IP协议，以及pro...", "深圳市研色科技有限公司", "20-99人", "民营", "计算机软件,互联网", "", "5"
"智联", "Node.js", "Node.js服务端开发工程师-杭州研究院043", "面议", "本科", "杭州", "无经验", " 职位描述: 职责描述： 1、参与网易蜂巢消息中间件的架构设计与系统开发； 任职资格： 职位要求： 1、扎实的计算机专业基础，熟悉常用的数据结构与算法； 2、熟悉Linux系统，熟悉网络编程、多线程编程； 3、熟悉Nodejs语言，有两年以上使用Nodejs语言开发的项目经验； 4、熟悉分布式系统，...", "网易集团", "1000-9999人", "上市公司", "计算机服务(系统、数据服务、维修)", "", "1"
"智联", "Node.js", "Node.js开发工程师", "10001-15000", "本科", "广州 - 天河区", "3-5年", "...Node.js语言，理解异步原理；了解C/C++加分，开源社区活跃加分；  4.欢迎有情怀无节操，喜欢运动、音乐、美术等，有一技之长将获得加分。", "广州图普网络科技有限公司", "20-99人", "民营", "计算机软件,互联网", "", "15"
"智联", "Node.js", "Node.js 后台开发", "8001-10000", "不限", "北京", "", " 岗位工作内容与职责描述：     1.  负责Nodejs功能模块编写；  2. APP后端API编写   3.  负责APP后端管理管理开发  4.  负责产品服务端开发，不断进行产品演进，提高产品质量和用户体验。     职位要求  1、两年以上Nodejs实际项目经验，了解Node.j...", "北京御颜医疗美容诊所有限责任公司", "20人以下", "民营", "金融/投资/证券    ", "", "1"
"智联", "Node.js", "Node.js", "6001-8000", "本科", "广州 - 天河区", "1年以下", " 岗位职责：  1.负责开放平台、云服务API等后台服务的开发；     岗位要求：  1.良好的代码规范，注重细节；  2.具备Node.js全栈开发能力 ；  3.掌握以下技术点的大多数：git、github、express、koa、restify、nam、promise、mong...", "广州图普网络科技有限公司", "20-99人", "民营", "计算机软件,互联网", "", "3"
"智联", "Node.js", "Node.js工程师NKB", "20001-30000", "本科", "北京", "无经验", " 岗位职责：  负责基于node.js的服务器端开发。  根据产品需求完成应用程序框架的设计和开发。岗位要求：  有过互联网经验者优先；  开发过SaaS，或者toB产品者优先考虑；  精通一种脚本语言，并用其做过开发，如Node，Python，Ruby，PHP等  能够流畅阅读英文技...", "北京博奥维科技发展有限公司", "1000-9999人", "民营", "计算机软件,互联网", "", "12"
"智联", "Node.js", "Node.js软件工程师_SH_00694", "15001-20000", "大专", "上海", "1-3年", " 岗位职责： 1、负责建网站及轻应用平台相关业务系统的设计和研发； 2、负责移动APP的服务端数据接口服务的设计和研发； 3、优化性能，丰富功能，产出稳定、可靠且可扩展的服务框架；岗位要求： 1、精通NodeJS ，有1年以上的移动互联网后端研发经验； 2、对数据结构和算法设计有一定的理解； 3、精...", "北京博奥维科技发展有限公司", "1000-9999人", "民营", "计算机软件,互联网", "", "3"
