"fromsite", "positionType", "positionName", "salary", "education", "city", "workYear", "jobDes", "company", "companySize", "financeStage", "industryField", "rate", "number"
"智联", "Node.js", "node.js Web开发工程师", "面议", "不限", "深圳", "", "...Node.JS进行程序开发，理解Node.JS异步非阻塞的编程模型；  4、熟悉Express框架，了解ejs、Jade等页面模板工具；  5、熟悉HTML、DHTML、CSS，对HTML5、CSS3有了解；  6、熟悉JQuery或其他前端js框架；  7、熟练使...", "深圳玩美创游科技有限公司", "20-99人", "民营", "计算机软件,互联网", "", "14"
"智联", "Node.js", "高薪 node.js 程序员  双休", "8000-15000", "大专", "杭州", "1-3年", " 岗位职责：  岗位职责：  1、使用HTML/CSS/JavaScript开发网页应用；  2、使用node.js对接接口；  3、在linux服务器上部署环境；  4、能使用git管理代码。     任职要求：  1、大专学历及以上，计算机相关专业；  2、1年以上从事JavaSc...", "杭州冰狗计算机系统有限公司", "20-99人", "股份制企业", "计算机软件    ", "", "13"
"智联", "Node.js", "Node.js工程师", "10000-20000", "大专", "天津", "3-5年", " 职位描述：    1.负责移动端网站后端模块开发及前端的数据交互；    2.参与产品需求分析，研究产品技术细节，制定开发方案；    3.注重系统可用，可靠，可扩展以及安全等；  任职要求：    1.2年以上Node.js开发工作经验；    2.熟练掌握Javascript语言...", "神州租车", "10000人以上", "上市公司", "互联网/电子商务    ", "", "4"
"智联", "Node.js", "Node.js开发工程师", "15001-20000", "大专", "上海 - 徐汇区", "1-3年", " 工作内容  1.\\t在已有服务器框架下协同策划完成服务器游戏逻辑开发；  2.\\tGM工具的开发；  基本要求  1.\\t有一年以上的服务器开发经验；  2.\\t熟悉常用的HTTP、HTTPS、TCP等协议。  3.\\t熟悉node.js，熟悉javascript es6新特性，熟悉异步编程模...", "上海剑圣网络科技有限公司", "100-499人", "民营", "计算机软件,互联网", "", "9"
"智联", "Node.js", "Node.js服务端主程", "20001-30000", "不限", "上海 - 徐汇区", "", " 岗位职责：   1、迅速熟悉已有服务器框架以及业务逻辑   2、负责服务端整体架构的持续开发与逻辑的编写 3、与客户端、策划进行协调与沟通 4、对线上服务器进行维护 5、对必要的文档进行整理和编写 6、负责服务端工作的整体规划与把控  任职要求  1、有成功游戏的服务器开发和维护经验 2、熟悉no...", "上海剑圣网络科技有限公司", "100-499人", "民营", "计算机软件,互联网", "", "10"
"智联", "Node.js", "Node.js开发工程师", "15001-25000", "本科", "杭州", "3-5年", " 岗位职责:  1、使用HTML/CSS/JavaScript开发网页及客户的交互功能；  2、使用node.js开发服务器端程序；  3、依据公司产品设计完成产品功能模块的编程开发；     任职要求：  1、本科及以上学历，计算机相关专业；  2、精通HTML/CSS/DIV/JS...", "唱游信息技术有限公司北京分公司", "20-99人", "股份制企业", "计算机硬件", "", "6"
"智联", "Node.js", "Node.js开发工程师", "15001-20000", "大专", "南京", "3-5年", " 岗位职责:  1、使用HTML/CSS/JavaScript开发网页及客户的交互功能；  2、使用node.js开发服务器端程序；  3、依据公司产品设计完成产品功能模块的编程开发；     任职要求：  1、本科及以上学历，计算机相关专业；  2、精通HTML/CSS/DIV/JS...", "唱游信息技术有限公司北京分公司", "20-99人", "股份制企业", "计算机硬件", "", "14"
"智联", "Node.js", "高级Node.js开发工程师", "30001-50000", "本科", "北京", "3-5年", " 岗位职责：  1、使用HTML/CSS/JavaScript开发网页及客户的交互功能；  2、使用node.js开发服务器端程序；  3、依据公司产品设计完成产品功能模块的编程开发。  任职要求：  1、本科及以上学历，计算机相关专业,3年以上Node.js开发经验； ...", "北京兴盛豫园便民服务中心", "20-99人", "民营", "贸易/进出口    ", "", "6"
"智联", "Node.js", "高级Node.js开发工程师", "30001-50000", "本科", "北京", "3-5年", " 岗位职责：  1、使用HTML/CSS/JavaScript开发网页及客户的交互功能；  2、使用node.js开发服务器端程序；  3、依据公司产品设计完成产品功能模块的编程开发。  任职要求：  1、本科及以上学历，计算机相关专业,3年以上Node.js开发经验； ...", "北京兴盛豫园便民服务中心", "20-99人", "民营", "贸易/进出口    ", "", "5"
"智联", "Node.js", "node.js 工程师", "10001-15000", "本科", "北京 - 朝阳区", "1-3年", "...Node.js开发工作经验；   2、熟练使用Node.JS进行后端程序开发，理解Node.JS异步非阻塞的编程模型；    3、熟悉JSON，Protobuffer，XML等网络传输协议；    4、熟练使用Mysql, Redis, MongoDB...", "京银圣地国际游戏投资(北京)有限公司", "100-499人", "民营", "计算机软件", "", "7"
"智联", "Node.js", "Node.JS", "15001-25000", "本科", "上海", "1-3年", " 岗位职责：    1.负责服务端通信框架的搭建和完善（客户端基于MQTT协议和WebRTC技术）     职位要求：   1.熟悉一门或以上服务器开发语言(python, java, php等), 一年以上的 Node.js 开发工作经验   2.对服务端框架的机制，框架的设计模式，...", "上海泛微网络科技股份有限公司", "1000-9999人", "股份制企业", "计算机软件,互联网", "", "7"
"智联", "Node.js", "Node.js开发工程师", "15001-20000", "大专", "南京", "3-5年", " 岗位职责:  1、使用HTML/CSS/JavaScript开发网页及客户的交互功能；  2、使用node.js开发服务器端程序；  3、依据公司产品设计完成产品功能模块的编程开发；     任职要求：  1、本科及以上学历，计算机相关专业；  2、精通HTML/CSS/DIV/JS...", "唱游信息技术有限公司北京分公司", "20-99人", "股份制企业", "计算机硬件", "", "3"
"智联", "Node.js", "Node.js服务端主程", "20001-30000", "不限", "上海 - 徐汇区", "", " 岗位职责：   1、迅速熟悉已有服务器框架以及业务逻辑   2、负责服务端整体架构的持续开发与逻辑的编写 3、与客户端、策划进行协调与沟通 4、对线上服务器进行维护 5、对必要的文档进行整理和编写 6、负责服务端工作的整体规划与把控  任职要求  1、有成功游戏的服务器开发和维护经验 2、熟悉no...", "上海剑圣网络科技有限公司", "100-499人", "民营", "计算机软件,互联网", "", "5"
"智联", "Node.js", "Node.js开发工程师", "15001-20000", "大专", "上海 - 徐汇区", "1-3年", " 工作内容  1.\\t在已有服务器框架下协同策划完成服务器游戏逻辑开发；  2.\\tGM工具的开发；  基本要求  1.\\t有一年以上的服务器开发经验；  2.\\t熟悉常用的HTTP、HTTPS、TCP等协议。  3.\\t熟悉node.js，熟悉javascript es6新特性，熟悉异步编程模...", "上海剑圣网络科技有限公司", "100-499人", "民营", "计算机软件,互联网", "", "3"
"智联", "Node.js", "Node.js开发工程师", "15001-25000", "本科", "杭州", "3-5年", " 岗位职责:  1、使用HTML/CSS/JavaScript开发网页及客户的交互功能；  2、使用node.js开发服务器端程序；  3、依据公司产品设计完成产品功能模块的编程开发；     任职要求：  1、本科及以上学历，计算机相关专业；  2、精通HTML/CSS/DIV/JS...", "唱游信息技术有限公司北京分公司", "20-99人", "股份制企业", "计算机硬件", "", "15"
"智联", "Node.js", "Node.JS工程师", "10000-15000", "不限", "上海", "", " 岗位职责：  1、负责公司云端产品的后台服务端程序的开发、测试，负载均衡等。  2、负责网络爬虫软件开发。  3、常用小工具，脚本应用开发。     任职要求：  1、能够独立设计并实现高质量的Node.JS程序；  2、在实际项目中使用Node.JS开发服务端软件至少...", "润申信息科技(上海)有限公司", "100-499人", "民营", "计算机软件,互联网", "", "9"
"智联", "Node.js", "Node.js前/后端开发工程师", "6001-8000", "本科", "深圳 - 罗湖区", "1-3年", " 岗位职责：  1.负责证券交易系统前端产品开发，参与架构设计  2.持续优化，以提高前端的用户体验  3.分析项目需求，能给出良好的解决方案，并协助其他人员完成开发及调试工作。    任职要求：  1、本科及以上学历，2年以上Node.js开发工作经验  2、熟练使用Node....", "深圳易博科金融工程系统有限公司", "20-99人", "外商独资", "计算机软件", "", "3"
"智联", "Node.js", "Node.js高级研发工程师", "12000-20000", "本科", "北京", "3-5年", " 岗位要求： 1.三年以上Node.js服务器端开发经验，熟悉服务器端部署、性能和安全以及分布式架构的实现； 2.熟悉前后端分离开发模式，了解常用的前端框架，对组件化、模块化开放方式有足够的理解； 3.具备较强的理解和学习能力，优秀的逻辑思维以及设计能力，较好的沟通交流能力，能够迅速融...", "Esri中国信息技术有限公司", "100-499人", "外商独资", "贸易/进出口    ", "", "11"
"智联", "Node.js", "高级Node.js开发工程师", "10001-15000", "大专", "广州", "3-5年", " 1.大专或以上学历，计算机或者相关专业毕业  2.3年左右NodeJS开发经验  3.非常熟悉NodeJS LTS (4.2.x)的特性，有PostgreSQL开发经验  4.熟悉Hapi系列modules，以及Chai系列和Sinon系列的单元测试modules  5.熟悉基于Express框架...", "广州诺特软件开发有限公司", "100-499人", "外商独资", "医疗/护理/卫生    ", "", "9"
"智联", "Node.js", "后端工程师（Node.JS）", "15001-20000", "不限", "北京", "", " 岗位职责：   1.公司PC端页面开发。   2.配合产品经理和UI设计师。   3.分析项目需求，能给出良好的解决方案，并协助其他人员完成开发及调试工作。     岗位要求：   1.至少1年以上Node.js、ExpressJS和Mongodb开发经验，并精通调试技巧。  2.熟...", "美家在线科技(北京)有限公司", "100-499人", "民营", "计算机软件,互联网", "", "10"
"智联", "Node.js", "Node.js开发组长", "6000-9000", "本科", "厦门", "1-3年", " 要求：      本科以上学历，至少一年编程经验      有 Nodejs 开发相关经验      熟悉至少一种后端语言 (Nodejs/Python/PHP/Ruby/Java)      了解关系型数据库（如 PostgreSQL ），缓存管理（如 Redis ）      熟悉至少一种代码...", "厦门创艺社科技有限公司", "20-99人", "股份制企业", "计算机软件,互联网", "", "9"
"智联", "Node.js", "node.js开发工程师", "6000-12000", "不限", "南京", "", " 【你要做什么】  来来来，来负责公司产品后端开发；  新功能需求、设计与接口文档编写；   与前端的程序员们合作实现功能并优化我们的系统～     【我们寻找的人】  你得有服务端开发经验, 如果你过去熟悉Node.js框架、常用Node.js扩展、事件驱动和异步编程思...", "南京市栖霞区新路艺术培训中心", "20-99人", "民营", "金融/投资/证券    ", "", "15"
"智联", "Node.js", "Node.js工程师", "8000-15000", "本科", "福州", "3-5年", " 岗位职责：  1、负责平台的数据层和业务逻辑层的开发； 2、与产品前端和App开发团队合作，保证前后端模块的协同运作； 3、提炼公用模块，提高复用性和开发效率，持续优化运行效率； 4、进行基本的数据汇总和分析，提供数据呈现接口和运营决策支持。      任职要求：  1、熟练使用Node.J...", "福建索天信息科技股份有限公司", "20-99人", "民营", "计算机软件,互联网", "", "5"
"智联", "Node.js", "Node.js工程师", "10000-20000", "大专", "天津", "3-5年", " 职位描述：    1.负责移动端网站后端模块开发及前端的数据交互；    2.参与产品需求分析，研究产品技术细节，制定开发方案；    3.注重系统可用，可靠，可扩展以及安全等；  任职要求：    1.2年以上Node.js开发工作经验；    2.熟练掌握Javascript语言...", "神州专车", "10000人以上", "上市公司", "互联网/电子商务    ", "", "8"
"智联", "Node.js", "Node.js服务端主程", "8000-15000", "不限", "南京", "", " 岗位职责：  1、迅速熟悉已有服务器框架以及业务逻辑；  2、负责服务端整体架构的持续开发与逻辑的编写；  3、与客户端、策划进行协调与沟通；  4、对线上服务器进行维护；  5、对必要的文档进行整理和编写；  6、负责服务端工作的整体规划与把控。     任职要求：  1、有成功服务器开发和维护...", "徐州欧信电子商务有限公司南京分公司", "20-99人", "股份制企业", "专业服务(咨询、人力资源、财会)", "", "2"
"智联", "Node.js", "Node.js开发", "20001-30000", "不限", "上海", "", "...Node.js；  5.   熟悉各种 Node.js 常用模块；  6.   对MongoDB有实操经验，了解DB设计和优化；  7.   熟悉HTTP协议，熟悉前后端的常见知识要点；  8.   有1年以上的后端开发经验；  9.   在博客或Github上有技...", "上海开阅信息技术有限公司", "100-499人", "民营", "快速消费品(食品、饮料、化妆品)    ", "", "14"
"智联", "Node.js", "Node.js", "10000-20000", "本科", "北京", "1-3年", " 岗位职责：  - 负责公司产品的功能开发和维护  - 负责公司产品的性能和体验优化     任职要求：  - 熟悉 Node.js 开发，对 Express.js、Promise、Async.js、webpack 都有丰富的使用经验  - 有前端开发经验，熟悉 Backbone、Re...", "厘米脚印(北京)科技有限公司", "20-99人", "民营", "计算机软件,互联网", "", "1"
"智联", "Node.js", "Node.js开发工程师", "10001-15000", "不限", "广州", "", " 岗位职责：  1、负责Web服务端、内部系统、移动应用服务端等的架构设计与研发，撰写并整理技术文档；  2、负责优化系统性能，提高服务质量。  任职要求：  1、熟悉Javascript，对闭包、原型链、词法作用域、作用域链、this等有足够理解；  2、熟悉Node.js，熟悉异步...", "广州多益网络股份有限公司", "1000-9999人", "民营", "政府/公共事业    ", "", "10"
"智联", "Node.js", "Node.js工程师", "10000-20000", "本科", "成都", "5-10年", " 岗位职责：     1.负责服务端后台架构及API的设计、开发和维护； 2.满足业务变化需求的同时，保证系统的稳定性、可靠性，且具备可扩展性； 3.参与产品需求分析及架构设计，对服务端稳定性和扩展性负责； 4.对开发流程优化提出改进建议。                任职要求：     1. 大...", "四川一品通电子商务有限公司", "100-499人", "民营", "电子技术/半导体/集成电路    ", "", "10"
"智联", "Node.js", "Node.JS工程师", "18000-25000", "本科", "杭州", "1-3年", " 工作职责： - 负责前后端分离中前端容器开发和维护 - 负责开发过程辅助工具的开发和维护 - 支持业务系统的使用和需求 岗位要求： - 本科学历 - 有一年NodeJS开发经验 - Javascript 基础扎实，熟悉 NodeJS - 熟悉 ES6 ，了解 koa（v2） - 熟悉 MySQL ...", "上海数享信息技术有限公司", "100-499人", "其它", "网络游戏    ", "", "11"
"智联", "Node.js", "资深node.js开发工程师（方堂文化（北京）有限公司）", "15001-20000", "大专", "北京 - 朝阳区", "1-3年", " 岗位职责：  熟练使用MySQL。  熟练使用redis或mongodb数据库系统。  对网络系统的原理有比较深入的理解，熟悉常用的网络协议。  有比较好的数据机构和算法基础。  熟练使用linux系统。     任职要求：  3年以上node.js开发经验。  有高负载，高并发游戏...", "成都动鱼数码科技有限公司", "20-99人", "民营", "计算机软件,互联网", "", "5"
"智联", "Node.js", "Node.js开发工程师（中高级）", "15001-20000", "本科", "上海 - 浦东新区", "1-3年", " 职位描述： 1.  负责 nodejs 功能模块编写；    2. 负责与前端交互接口开发；    3. 持续优化，以提高前端的用户体验；      4. 分析项目需求，能给出良好的解决方案，并协助其他人员完开发及调试工作。     任职要求： 1.  2年以上 Nodejs 开发经验；     ...", "微鲸科技有限公司", "100-499人", "民营", "计算机软件,互联网", "", "8"
"智联", "Node.js", "node.js开发工程师（方堂文化（北京）有限公司）", "10001-15000", "大专", "北京 - 朝阳区", "1-3年", " 岗位职责：  熟练使用至少一种数据库系统。  了解网络系统的基本原理，熟悉至少一种网络协议。  熟悉常用的数据机构和算法。  熟悉linux系统者优先。     任职要求：  1年以上node.js开发经验。  有游戏服务器系统开发经验者优先。", "成都动鱼数码科技有限公司", "20-99人", "民营", "计算机软件,互联网", "", "11"
"智联", "Node.js", "Node.js开发工程师（双休+地铁口+强大的技术团队））", "10001-15000", "大专", "杭州", "", "...node.js/Golang、熟悉数据库（mysql、mongodb等）相关知识  5、有架构师方向工作经验优先考虑        应聘方式：  1、直接投递简历；  2、工作时间：可直拨下方招聘经理的电话进行电话预约面试；  3、公司地址及联系电话  0571-56633104...", "浙江电融数据技术有限公司", "100-499人", "民营", "互联网/电子商务    ", "", "6"
"智联", "Node.js", "node.js开发工程师", "10001-15000", "本科", "北京", "3-5年", "...Node.js；   5. 熟悉各种 Node.js 常用模块；   6. 对MongoDB有实操经验，了解DB设计和优化；   7. 熟悉HTTP协议，熟悉前后端的常见知识要点；", "北京易牛网络科技有限公司", "20-99人", "民营", "计算机软件,互联网", "", "9"
"智联", "Node.js", "node.js开发工程师", "10001-15000", "不限", "上海", "", " 岗位职责：    1.负责服务端通信框架的搭建和完善（客户端基于MQTT协议和WebRTC技术）     职位要求：   1.熟悉一门或以上服务器开发语言(python, java, php等), 一年以上的 Node.js 开发工作经验   2.对服务端框架的机制，框架的设计模式，...", "上海泛微网络科技股份有限公司", "1000-9999人", "股份制企业", "计算机软件,互联网", "", "10"
"智联", "Node.js", "Node.js开发工程师", "面议", "本科", "大连", "1-3年", " 薪资：5000-15000  职位描述：  1. 负责APP服务器端开发 ；  2. 参与系统架构、模块设计和文档编写；  3. 负责具体功能模块的实现、单元测试。  职位要求：  1. 精通Javascript和 Node.js, 熟练掌握异步编程技巧；  2. 1年以上no...", "大连聚益科技发展有限公司", "20-99人", "股份制企业", "计算机软件,互联网", "", "9"
"智联", "Node.js", "Node.JS开发", "15001-20000", "本科", "上海", "1-3年", " 岗位职责：    1.负责服务端通信框架的搭建和完善（客户端基于MQTT协议和WebRTC技术）     职位要求：   1.熟悉一门或以上服务器开发语言(python, java, php等), 一年以上的 Node.js 开发工作经验   2.对服务端框架的机制，框架的设计模式，...", "上海泛微网络科技股份有限公司", "1000-9999人", "股份制企业", "计算机软件,互联网", "", "10"
"智联", "Node.js", "Node.JS开发", "15001-20000", "本科", "上海", "1-3年", " 岗位职责：    1.负责服务端通信框架的搭建和完善（客户端基于MQTT协议和WebRTC技术）     职位要求：   1.熟悉一门或以上服务器开发语言(python, java, php等), 一年以上的 Node.js 开发工作经验   2.对服务端框架的机制，框架的设计模式，...", "上海泛微网络科技股份有限公司", "1000-9999人", "股份制企业", "计算机软件,互联网", "", "1"
"智联", "Node.js", "Node.js开发工程师", "15001-20000", "本科", "上海", "1-3年", " 岗位职责：    1.负责服务端通信框架的搭建和完善（客户端基于MQTT协议和WebRTC技术）     职位要求：   1.熟悉一门或以上服务器开发语言(python, java, php等), 一年以上的 Node.js 开发工作经验   2.对服务端框架的机制，框架的设计模式，...", "上海泛微网络科技股份有限公司", "1000-9999人", "股份制企业", "计算机软件,互联网", "", "3"
"智联", "Node.js", "Node.js 开发工程师", "15001-20000", "本科", "上海", "1-3年", " 岗位职责：   1.负责服务端通信框架的搭建和完善（客户端基于MQTT协议和WebRTC技术）     职位要求：   1.熟悉一门或以上服务器开发语言(python, java, php等), 一年以上的 Node.js 开发工作经验   2.对服务端框架的机制，框架的设计模式，数...", "上海泛微网络科技股份有限公司", "1000-9999人", "股份制企业", "计算机软件,互联网", "", "3"
"智联", "Node.js", "Node.JS", "10000-18000", "本科", "上海", "1-3年", " 岗位职责：  1：配合聊天服务器负责人完成聊天服务器新的功能开发和维护（通信协议为MQTT）    职位要求：  1：计算机相关专业毕业，一年以上的 Node.js 开发工作经验，熟悉其他一门或以上服务器开发语言(python, java, php等)优先,  2：对网络编程有一定了...", "上海泛微网络科技股份有限公司", "1000-9999人", "股份制企业", "计算机软件,互联网", "", "5"
"智联", "Node.js", "JAVA Script/Node.JS developer (GZ-ER-D021-3431)", "10001-15000", "不限", "广州", "", " Skill/Qualification Requirements   • At least 3 years of Java Script/ Node.JS experience.   • Experience with Spring, Hibernate frameworks.  •...", "瞬联讯通科技(北京)有限公司", "1000-9999人", "外商独资", "计算机软件,互联网", "", "10"
"智联", "Node.js", "Node.js开发工程师", "15001-20000", "不限", "杭州", "", "...Node.js，并有实践经验；      5、个性乐观开朗，逻辑性强，善于合作；具备问题解决能力。      6、能承受一定工作压力，具有良好的团队合作意识及沟通协作能力。     公司内职业发展方向：项目经理、技术总监。     薪资待遇和公司福利：      1、全年核发14...", "杭州众游科技有限公司", "20-99人", "民营", "计算机软件,互联网", "", "8"
"智联", "Node.js", "游戏 资深node.js开发工程师", "15001-20000", "不限", "北京", "", " 岗位职责： 1.负责游戏服务端架构设计、逻辑开发、优化等工作； 2.根据策划案，与客户端工程师，合作设计、实现游戏功能； 3.编写相关的开发文档，研究服务端开发技术； 4.负责参与相关产品需求讨论、游戏版本发布、线上问题定位处理。   任职要求： 1.3年以上node.js开发经验；...", "方堂文化(北京)有限公司", "20-99人", "民营", "计算机软件    ", "", "12"
"智联", "Node.js", "游戏 node.js开发工程师", "10001-15000", "不限", "北京", "", " 岗位职责： 1.负责游戏服务端架构设计、逻辑开发、优化等工作； 2.根据策划案，与客户端工程师，合作设计、实现游戏功能； 3.编写相关的开发文档，研究服务端开发技术； 4.负责参与相关产品需求讨论、游戏版本发布、线上问题定位处理。   任职要求： 1.1年以上node.js开发经验；...", "方堂文化(北京)有限公司", "20-99人", "民营", "计算机软件    ", "", "5"
"智联", "Node.js", "软件开发工程师（node.js  浦东张江金融项目）", "12000-24000", "本科", "上海", "", " 岗位职责：  1、负责所属模块的开发建设，包含功能的规划、需求分析设计与技术实现； 2、根据需求、设计文档完成指定的设计、开发工作； 3、完成其他交办的各类技术开发任务；  岗位要求  - 本科及以上学历  - 有2年以上项目开发经验  - 至少1年以上Node.js、Express...", "上海华腾软件系统有限公司", "10000人以上", "合资", "计算机软件    ", "", "2"
"智联", "Node.js", "Node.JS开发", "15001-25000", "本科", "上海", "1-3年", " 岗位职责：    1.负责服务端通信框架的搭建和完善（客户端基于MQTT协议和WebRTC技术）     职位要求：   1.熟悉一门或以上服务器开发语言(python, java, php等), 一年以上的 Node.js 开发工作经验   2.对服务端框架的机制，框架的设计模式，...", "上海泛微网络科技股份有限公司", "1000-9999人", "股份制企业", "计算机软件,互联网", "", "4"
"智联", "Node.js", "Node.JS开发工程师", "15001-25000", "本科", "上海", "3-5年", " 岗位职责：    1.负责服务端通信框架的搭建和完善（客户端基于MQTT协议和WebRTC技术）     职位要求：   1.熟悉一门或以上服务器开发语言(python, java, php等), 一年以上的 Node.js 开发工作经验   2.对服务端框架的机制，框架的设计模式，...", "上海泛微网络科技股份有限公司", "1000-9999人", "股份制企业", "计算机软件,互联网", "", "4"
