"fromsite", "positionType", "positionName", "salary", "education", "city", "workYear", "jobDes", "company", "companySize", "financeStage", "industryField", "rate", "number"
"智联", "Node.js", "Node.JS开发工程师", "8001-10000", "不限", "大连", "", " 岗位职责：  工作职责：  1.  负责node.js开发；  2.  负责项目的设计、编码、调优、测试及bug处理。     职位要求：  1.本科及以上学历；  2.三年以上工作经验，两年以上Node.JS项目开发工作经验  3.熟练使用，熟悉MVC，熟悉expre...", "大连展锋信息技术咨询有限公司", "100-499人", "民营", "多元化业务集团公司    ", "", "13"
"智联", "Node.js", "Node.js全栈工程师", "10000-20000", "本科", "苏州", "1-3年", " 岗位职责：  负责SaaS产品的前端及后端开发维护工作。     任职要求：  1.精通各种Web前端技术，包括HTML/CSS/Javascript,熟悉React或Angular  2.熟悉Nodejs,熟悉express/koa等后端框架，熟悉ES6等新语言特性，了解socket  3.了解...", "无锡夸微科技有限公司", "20-99人", "其它", "计算机软件,互联网", "", "1"
"智联", "Node.js", "Node.js全栈工程师", "10000-20000", "本科", "江阴", "1-3年", " 岗位职责：  负责SaaS产品的前端及后端开发维护工作。     任职要求：  1.精通各种Web前端技术，包括HTML/CSS/Javascript,熟悉React或Angular  2.熟悉Nodejs,熟悉express/koa等后端框架，熟悉ES6等新语言特性，了解socket  3.了解...", "无锡夸微科技有限公司", "20-99人", "其它", "计算机软件,互联网", "", "3"
"智联", "Node.js", "Node.js全栈工程师", "10000-20000", "本科", "杭州", "1-3年", " 岗位职责：  负责SaaS产品的前端及后端开发维护工作。     任职要求：  1.精通各种Web前端技术，包括HTML/CSS/Javascript,熟悉React或Angular  2.熟悉Nodejs,熟悉express/koa等后端框架，熟悉ES6等新语言特性，了解socket  3.了解...", "无锡夸微科技有限公司", "20-99人", "其它", "计算机软件,互联网", "", "9"
"智联", "Node.js", "Node.js全栈工程师", "10000-20000", "本科", "上海", "1-3年", " 岗位职责：  负责SaaS产品的前端及后端开发维护工作。     任职要求：  1.精通各种Web前端技术，包括HTML/CSS/Javascript,熟悉React或Angular  2.熟悉Nodejs,熟悉express/koa等后端框架，熟悉ES6等新语言特性，了解socket  3.了解...", "无锡夸微科技有限公司", "20-99人", "其它", "计算机软件,互联网", "", "10"
"智联", "Node.js", "Node.js全栈工程师", "10000-20000", "本科", "无锡", "1-3年", " 岗位职责：  负责SaaS产品的前端及后端开发维护工作。     任职要求：  1.精通各种Web前端技术，包括HTML/CSS/Javascript,熟悉React或Angular  2.熟悉Nodejs,熟悉express/koa等后端框架，熟悉ES6等新语言特性，了解socket  3.了解...", "无锡夸微科技有限公司", "20-99人", "其它", "计算机软件,互联网", "", "14"
"智联", "Node.js", "Node.js开发工程师", "20001-30000", "不限", "北京", "3-5年", "...Node.js开发经验；  3.对服务器框架的机制，框架的设计模式，数据库的优化有了解优先；", "北京医方科技有限公司", "20-99人", "股份制企业", "计算机软件,互联网", "", "7"
"智联", "Node.js", "Node.js全栈工程师", "10000-20000", "本科", "无锡 - 江阴市", "1-3年", " 岗位职责：  负责SaaS产品的前端及后端开发维护工作。     职位要求  1.精通各种Web前端技术，包括HTML/CSS/Javascript,熟悉React或Angular  2.熟悉Nodejs,熟悉express/koa等后端框架，熟悉ES6等新语言特性，了解socket  3.了解多...", "无锡夸微科技有限公司", "20-99人", "其它", "计算机软件,互联网", "", "13"
"智联", "Node.js", "Node.js全栈工程师", "10000-20000", "本科", "无锡", "1-3年", " 岗位职责：  负责SaaS产品的前端及后端开发维护工作。     任职要求：   1.精通各种Web前端技术，包括HTML/CSS/Javascript,熟悉React或Angular    2.熟悉Nodejs,熟悉express/koa等后端框架，熟悉ES6等新语言特性，了解socket  3...", "无锡夸微科技有限公司", "20-99人", "其它", "计算机软件,互联网", "", "3"
"智联", "Node.js", "WEB后端开发工程师(node.js mongodb 方向)", "8001-10000", "不限", "深圳 - 罗湖区", "", " 岗位职责：  1、负责公司物联网云平台系统的设计开发。   2、Web以及移动端产品后台系统开发。     岗位任职要求：   1、本科及以上学历；  2、熟悉Linux/Unix、C语言、Javascript、Node.js、ExpressJS和Mongodb；  3、熟悉JSon...", "深圳市动态数据技术有限公司", "20-99人", "民营", "计算机服务(系统、数据服务、维修)    ", "", "11"
"智联", "Node.js", "软件工程师  （Node.js 方向）", "6001-8000", "大专", "广州", "", " 职位描述:    负责公司合作项目开放平台服务端的设计和开发。  岗位要求：  1、专科或以上学历，计算机或相关专业大四学生。  2、对Node.js以及其他新技术充满热情。  3、熟练掌握Javascript语言编程，熟悉Node.js标准库的使用，掌握对应技术的设计...", "万方数据股份有限公司", "500-999人", "国企", "租赁服务    ", "", "1"
"智联", "Node.js", "JAVA(Node.js)开发工程师", "2001-4000", "不限", "珠海", "", " 岗位职责：   1.有较强的沟通以及团队协作能力   2.能协助上级及时主动的完成工作任务   3.自学能力强，能独立解决处理所负责的工作任务   4.工作责任心强，性格外向开朗，细致，耐心。      任职要求：   1.有1-2年以上java工作经验(优秀应届毕业生亦可)    2.熟悉B/S...", "珠海瀛海企业策划有限公司", "20-99人", "民营", "快速消费品(食品、饮料、化妆品)", "", "11"
"智联", "Node.js", "Node.js开发", "15001-20000", "不限", "北京", "3-5年", "...Node.js开发经验；  3.对服务器框架的机制，框架的设计模式，数据库的优化有了解优先；", "北京医方科技有限公司", "20-99人", "股份制企业", "计算机软件,互联网", "", "15"
"智联", "Node.js", "node.js开发工程师", "18000-28000", "大专", "上海", "1-3年", " 岗位职责  1.编写 nodejs前置机服务器，通过与后端服务进行数据整合与安全校验提供给用户所需的数据  2.编写 nodejs的websocket 长连接处理 即使的用户行为管理和通知  3.编写 nodejs 独立的游戏服务器  4.编写 nodejs 与C++ 游戏媒介服务器，分担负载  ...", "上海迪祥信息技术有限公司", "20-99人", "股份制企业", "计算机软件", "", "1"
"智联", "Node.js", "node.js工程师", "10001-15000", "大专", "北京", "3-5年", " 1、前端3年以上经验  2、node.js经验  3、工作认真好学", "北京化蝶科技有限公司", "100-499人", "民营", "计算机软件,互联网", "", "14"
"智联", "Node.js", "Node.js 后端攻城狮", "12000-18000", "本科", "上海 - 长宁区", "1-3年", "...Node.js/JavaScript/Express.js/Nginx，对常用框架和 Node.js 的 events/stream/net 等内部模块有实战经验；  能独立完成新功能模块的接口设计和开发工作；  熟悉 MySQL 数据库的脚本编写及性能调优；  熟...", "上海凯洛格信息科技有限公司", "100-499人", "民营", "计算机软件,互联网", "", "11"
"智联", "Node.js", "Node.js开发工程师", "10001-15000", "不限", "厦门", "", " 岗位职责：     *  负责  Node.js 、 MongoDB  功能模块实现；  *  分析项目需求，能给出良好的解决方案；            岗位要求：       * 有扎实的计算机基础知识；    * 良好的学习能力和沟通能力，编码稳健严谨，对问题有探究精神。", "厦门道拓科技有限公司", "20人以下", "民营", "计算机软件,互联网", "", "1"
"智联", "Node.js", "node.js开发工程师/node.js服务端开发/游戏后端逻辑开发", "8000-15000", "大专", "郑州", "1-3年", " 工作地点在河南郑州。      岗位要求：     1.熟悉node.js；    2.JavaScript基本功扎实，对闭包、事件和异步有独到的见解；    3.熟悉Redis，MySQL等的一种或多种；    4.经历过1个以上的项目开发；    5.良好的编码风格，有自主学习能...", "郑州三生石科技有限公司", "100-499人", "民营", "计算机软件,互联网", "", "12"
"智联", "Node.js", "急聘Node.js实习岗（C#/.net/php皆可)", "4001-6000", "大专", "武汉", "", " 岗位要求：(如无Node.JS经验者，公司可培养学习Node.JS）  1. 计算机专业本科或以上学历(应届生也可）  2. 1-3年以上基于Node.JS进行服务端的设计、开发；有电子商务平台开发经验者优先  3. 具备良好文档书写能力优先     技术...", "武汉大拓科技有限公司", "20人以下", "民营", "计算机软件,互联网", "", "2"
"智联", "Node.js", "Node.js开发工程师", "8001-10000", "本科", "北京", "", "...Node.js经验； 11、计算机或通信相关专业本科、硕士毕业以上", "北京科迈网通讯技术有限公司", "100-499人", "民营", "计算机软件    ", "", "5"
"智联", "Node.js", "Node.js工程师", "6001-8000", "本科", "广州", "1-3年", " 职位描述：  我们需要这样的你——  痴迷技术，强迫症，抠门，有代码洁癖，具备社交属性，审美观正常  使用js做web游戏前端开发，使用node.js做后端开发。     任职资格  1.计算机科学与技术相关专业，大学本科及以上学历；  2.1年以上Node.js开发工...", "广州学创软件科技有限公司", "20人以下", "民营", "计算机软件,互联网", "", "4"
"智联", "Node.js", "后端开发工程师（node.js/PHP/.NET/Java）", "10001-15000", "大专", "上海", "1-3年", "...Node.js/PHP/.NET/JAVA等,   Node.js优先考虑  )，或愿意对Node.js投入大量精力学习，；  4、参与过大型互联网项目设计、具备架构选型经验，熟悉服务器管理，系统部署；  5、至少精通一种数据库开发、配置、维护、性能优...", "迪彩(上海)投资管理咨询有限公司", "100-499人", "外商独资", "互联网/电子商务", "", "12"
"智联", "Node.js", "Node.js开发工程师", "13000-25000", "本科", "杭州", "5-10年", "...node.js,StrongLoop,C++,C#)；精通Linux、Git等基本技能  熟悉多种数据库（MsSQL，MySQL，NoSQL）  熟悉缓存，分布式系统   熟悉开发环境及部署环境，熟悉CI/CD流程   熟悉自动化，会利用工具提升效率   有良好的代码习惯   爱...", "杭州当堂信息技术有限公司", "100-499人", "民营", "美容/保健", "", "9"
"智联", "Node.js", "node.js开发工程师", "20000-30000", "大专", "北京 - 海淀区", "1-3年", "...node.js、Express，熟悉Liunx、Windows常用命令； 4.熟悉Redis，MySQL，Mongodb等数据库； 5.JavaScript基本功扎实，对闭包、事件和异步有独到的见解； 5.良好的编码风格，有自主学习能力，良好的团队合作意识及积极的心态。", "掌游天下(北京)信息技术股份有限公司", "100-499人", "民营", "家具/家电/玩具/礼品    ", "", "9"
"智联", "Node.js", "node.js工程师", "6001-8000", "本科", "武汉 - 洪山区", "1-3年", " 岗位职责：  1. 根据业务需要承担技术难度较大的设计和开发工作。  2. 带领、培训开发工程师完成子系统的开发和维护任务。  岗位要求：  1. 计算机相关专业本科及以上学历，具有5年以上互联网开发经验。  2. 精通Node.js，具有Node.js进行Web开发的...", "武汉易能教育科技有限公司", "20-99人", "外商独资", "计算机软件,互联网", "", "6"
"智联", "Node.js", "Node.js开发工程师", "8000-15000", "不限", "深圳", "1-3年", " 岗位职责：  1.在规定时间内完成开发产品提出的新功能；     2.配合前端开发，设计接口完成功能需求；     3.维护日常游戏版本稳定；     4.修复日常玩家反馈的BUG；     5.完善日常游戏数据统计     任职资格要求：     1.熟悉NodeJS技术，熟悉V8；     2...", "深圳市一花科技股份有限公司", "20-99人", "股份制企业", "计算机软件,互联网", "", "3"
"智联", "Node.js", "软件工程师（精通node.js后端）", "6000-10000", "本科", "北京 - 海淀区", "", " 希望找到合适的nodejs牛人负责公司产品后端开发工作，工作年限不限，欢迎优秀应届生应聘！！   职位描述：  1、利用NodeJs及相关技术进行产品后端研发与维护；  2、利用JS、CSS或HTML5等技术，完成页面开发及维护工作；  3、参与系统架构、模块设计和文档编写、设计公司产品的新功能新...", "北京北变微电网技术有限公司", "20-99人", "民营", "互联网/电子商务    ", "", "5"
"智联", "Node.js", "软件工程师（node.js后端与数据库）", "8001-10000", "本科", "北京 - 海淀区", "", " 希望找到合适的nodejs牛人负责公司产品后端开发工作，工作年限不限，欢迎优秀应届生应聘！！       职位描述：   1、利用NodeJs及相关技术进行产品后端研发与维护；  2、利用JS、CSS或HTML5等技术，完成页面开发及维护工作；  3、参与系统架构、模块设计和文档编写、设计公司产品...", "北京北变微电网技术有限公司", "20-99人", "民营", "互联网/电子商务    ", "", "11"
"智联", "Node.js", "node.js 服务器程序工程师", "10001-15000", "大专", "苏州 - 工业园区", "3-5年", "...Node.js开发工作经验；  2、熟练使用Node.JS进行后端程序开发，理解Node.JS异步非阻塞的编程模型；  3、熟悉TCP、UDP、HTTP、XMPP等网络通信协议；  4、熟练掌握Javascript语言编程，精通Node.js", "苏州朗动网络科技有限公司", "20-99人", "民营", "计算机软件,互联网", "", "15"
"智联", "Node.js", "node.js", "15001-20000", "不限", "北京 - 海淀区", "", " 我们在意每一位候选人的选择和信任，我们将竭力给您更好的面试体验；  每一位面试官都会与您进行深度沟通，他们都是本领域经验丰富的牛人；    我们将为来司复试的候选人报销京内面试交通费用。         岗位职责：  1、负责公司两大平台智课网（smartstudy.com）和极智批改网（smar...", "智课教育科技(北京)有限公司", "100-499人", "民营", "计算机软件,互联网", "", "6"
"智联", "Node.js", "Node.js中高级工程师", "12000-24000", "不限", "北京", "3-5年", " 岗位职责：     1、负责公司  Node.js   后端开发  ；      2、能够与  产品、技术、测试、运营的伙伴顺畅沟通，制定接口文档，参与联调和测试。  ；     任职资格：    1、      从事研发三年以上，且有实际项目经验，有较好的沟通协调能力；      ...", "北京量科邦信息技术有限公司", "100-499人", "民营", "互联网/电子商务    ", "", "6"
"智联", "Node.js", "c++/node.js服务器端程序", "15001-20000", "大专", "北京", "1-3年", " 岗位职责：     按照策划要求进行游戏服务器端功能开发  任职要求：     1、计算机相关专业大专以上学历，2年以上游戏开发经验，2年以上       C++开发经验；  2、熟悉mysql数据库；  3、有node.js开发经验，熟悉C/C++模块者优先；  4、有强烈的工作责...", "河北猛擎信息技术有限公司北京分公司", "20-99人", "其它", "计算机软件    ", "", "3"
"智联", "Node.js", "Node.js开发工程师", "4000-8000", "本科", "天津", "1-3年", " 岗位职责：  1.负责Node.js服务器端应用的开发工作，包括网站、数据后台、APP后台等  2.负责项目所属API的开发、单元测试、维护及文档撰写  3.持续优化，以提高前端的用户体验；  4.分析项目需求，能给出良好的解决方案，并协助其他人员完成开发及调试工作。  任职要求： ...", "渤海智慧蜂巢众创(天津)科技有限公司", "20-99人", "股份制企业", "计算机软件,互联网", "", "11"
"智联", "Node.js", "Node.js开发工程师", "10001-15000", "本科", "深圳 - 南山区", "1-3年", " 岗位职责：  1.在规定时间内完成开发产品提出的新功能；  2.配合前端开发，设计接口完成功能需求；  3.维护日常游戏版本稳定；  4.修复日常玩家反馈的 BUG；  5.完善日常游戏数据统计  任职要求：  1.熟悉 NodeJS 技术，熟悉 V8；  2.熟悉 RESTFUL，了解 TCP/...", "深圳市艾克斯特信息技术有限公司", "100-499人", "股份制企业", "机械/设备/重工    ", "", "6"
"智联", "Node.js", "node.js开发工程师", "10001-15000", "本科", "天津", "3-5年", " 岗位职责：    1. 负责node.js前端和后端开发，使用Meteor React 的方式进行开发； 2. 负责项目的设计、编码、调优、测试及bug处理。    任职要求：    1. 三年以上工作经验，至少一年以上node.js项目开发工作经验，熟练使用，熟悉MV...", "北京爱和健康科技有限公司", "100-499人", "外商独资", "计算机软件,互联网", "", "12"
"智联", "Node.js", "Node.JS工程师", "10000-15000", "不限", "上海", "", " 岗位职责：  1、负责公司云端产品的后台服务端程序的开发、测试，负载均衡等。  2、负责网络爬虫软件开发。  3、常用小工具，脚本应用开发。     任职要求：  1、能够独立设计并实现高质量的Node.JS程序；  2、在实际项目中使用Node.JS开发服务端软件至少...", "润申信息科技(上海)有限公司", "100-499人", "民营", "计算机软件,互联网", "", "6"
"智联", "Node.js", "node.js全栈工程师", "10001-15000", "不限", "北京 - 海淀区", "", " 岗位职责：  1)负责产品网站页面的前端开发和页面重构；   2)参与产品后台功能和开放接口的设计与研发；  3)参与产品性能优化,安全性优化和服务器部署维护；  任职要求：  1)统招本科211及以上学历,计算机及相关专业毕业；三年以上开发工程师经验；  2)对于新技术充满热情, 如 html5...", "北京毕加索智能科技有限公司", "20-99人", "民营", "计算机软件,互联网", "", "7"
"智联", "Node.js", "Node.js 开发工程师", "8001-10000", "不限", "厦门", "", " 1. 熟悉NodeJS技术；  2. 熟悉RESTFUL，了解TCP/IP、SOCKET、WEB SOCKET 通讯协议；  3. 熟练使用linux，熟悉Linux shell编程，能在linux下进行node开发和部署；  4. 熟悉Mysql数据库,熟悉MongoDB、Redis、memca...", "巨才(厦门)信息科技有限公司", "20人以下", "民营", "计算机软件,互联网", "", "6"
"智联", "Node.js", "Node.js服务器开发工程师", "8000-12000", "大专", "北京 - 海淀区", "1-3年", " 岗位职责：   开发网站主要业务逻辑。设计并实现系统相关模块。帮助团队解决技术难点和使用新技术。     任职要求：  1. 计算机相关专业，3年以上工作经验。     2. 熟悉网站开发流程，具有网站开发经验。     3. 精通至少一种网站后台开发语言，如java、php、go、node等，熟...", "北京海克智动科技开发有限公司", "20-99人", "民营", "计算机软件,互联网", "", "3"
"智联", "Node.js", "全栈工程师（Node.JS）", "20001-30000", "大专", "北京", "3-5年", " 岗位职责：  以向全栈工程师发展为职业目标  使用 Javascript、HTML5 完成网站、物联网平台相关 Web 应用的开发；  完成相关后台、API、系统集成等功能开发、测试和生产部署；     任职要求：  熟悉 Javascript ， 有采用 Node.js、Meteo...", "美科科技(北京)有限公司", "20-99人", "民营", "计算机软件,互联网", "", "14"
"智联", "Node.js", "软件工程师（node.js)", "10001-15000", "大专", "呼和浩特", "1-3年", "...node.js软件  3、大专及以上学历   4、对该岗位有自己的见解，工作严谨细致，有责任心，勤奋踏实，具有团队合作精神", "内蒙古金谷泰农业科技开发有限责任公司", "20-99人", "民营", "计算机软件,互联网", "", "10"
"智联", "Node.js", "Node.Js 开发工程师", "10000-20000", "大专", "上海 - 浦东新区", "1-3年", " 工作职责：   1、采用HTML5 Canvas + Nodejs + MongoDB + Redis 开发维护架构云产品； 2、负责阿里云OpenApi的开发维护； 3、完成领导安排的其他任务。  基本要求： 1、大专以上相关学历； 2、一年以上JS开发经验； 3、熟悉NodeJS + Mong...", "上海驻云信息科技有限公司", "100-499人", "民营", "计算机软件,互联网", "", "10"
"智联", "Node.js", "高级Node.js开发工程师", "30001-50000", "本科", "北京", "3-5年", " 岗位职责：  1、使用HTML/CSS/JavaScript开发网页及客户的交互功能；  2、使用node.js开发服务器端程序；  3、依据公司产品设计完成产品功能模块的编程开发。  任职要求：  1、本科及以上学历，计算机相关专业,3年以上Node.js开发经验； ...", "北京兴盛豫园便民服务中心", "20-99人", "民营", "贸易/进出口    ", "", "3"
"智联", "Node.js", "高级Node.js开发工程师", "30001-50000", "本科", "北京", "3-5年", " 岗位职责：  1、使用HTML/CSS/JavaScript开发网页及客户的交互功能；  2、使用node.js开发服务器端程序；  3、依据公司产品设计完成产品功能模块的编程开发。  任职要求：  1、本科及以上学历，计算机相关专业,3年以上Node.js开发经验； ...", "北京兴盛豫园便民服务中心", "20-99人", "民营", "贸易/进出口    ", "", "10"
"智联", "Node.js", "Node.JS中、高级开发工程师", "10001-15000", "本科", "北京", "", " 岗位职责：  1、熟悉Linux/Unix下开发；  2、熟悉TCP/IP、HTTP协议、熟悉MySQL数据库，并具有数据库设计和优化能力；  3、熟悉网络编程、多线程编程、熟悉高并发服务架构设计；  4、熟悉Node.js，并具有使用该语言进行开发经验；  5、具有后端开发能力、S...", "上海有师网络科技有限公司", "100-499人", "民营", "计算机软件,互联网", "", "14"
"智联", "Node.js", "Node.js", "20001-30000", "大专", "北京", "3-5年", " 岗位职责：  基于Node.js的服务端架构设计和研发。     任职要求：  1. 三年以上Server端开发经验，并拥有至少一年的Node.js开发经验  2. JavaScript 基本概念清晰，熟练掌握闭包、事件、回调、Promise 等  3. 熟练掌握...", "北京好奇心科技有限公司", "100-499人", "民营", "计算机软件,互联网", "", "13"
"智联", "Node.js", "node.js", "15001-20000", "不限", "北京", "", "...node.js/java；  4、熟悉Linux 系统、shell脚本，熟悉mysql数据库、sql语言,能独立设计数据库结构，掌握备份、优化、合并方案；", "北京艺游天下信息技术有限公司", "20-99人", "民营", "电子技术/半导体/集成电路", "", "8"
"智联", "Node.js", "高级软件工程师(Node.js）", "12000-20000", "大专", "北京", "1-3年", "...Node.js在线项目作品  3、拥有有Node.js相关开源项目     拥有以上经验者优先考虑", "北京东方艾狄尔会展有限公司", "100-499人", "国企", "网络游戏", "", "5"
"智联", "Node.js", "Node.JS", "8000-10000", "不限", "大连", "", " 岗位职责：  1.负责node.js开发  2.需求分析、技术设计、参与协调开发；  3.建立系统的开发文档；  4.项目的日常维护及质量控制；  职位要求：  1.本科及以上学历；  2.两年以上Node.JS开发经验；  3.掌握常用Node modules及相关框...", "大连展锋信息技术咨询有限公司", "100-499人", "民营", "多元化业务集团公司    ", "", "2"
"智联", "Node.js", "Node.js工程师", "6000-10000", "不限", "珠海", "", " 职位描述：  1.负责公司产品框架结构的搭建及交互设计；  2.负责公司产品的开发；  3.负责公司产品的维护和优化。     职位要求：  1.精通Node.JS，熟悉其他MEAN Stack (MongoDB, ExpressJS, AngularJS)；  2.熟练使用Java...", "珠海轼域网络科技有限公司", "20-99人", "外商独资", "计算机软件,互联网", "", "10"
"智联", "Node.js", "Node.js服务器开发工程师", "10001-15000", "大专", "北京 - 朝阳区", "1-3年", "...node.js + mongodb);         【我们希望你】   1、大专及以上学历,计算机相关专业;  2、熟悉html、js和css;  3、有linux经验，熟悉linux指令优先;  4、踏实、勤奋，具备高度的责任感、良好的沟通能力和进取心;  5、要有良好的沟...", "北京同创智业科技有限公司", "20-99人", "其它", "计算机软件,互联网", "", "4"
"智联", "Node.js", "node.js 工程师", "10001-15000", "本科", "北京 - 朝阳区", "1-3年", "...Node.js开发工作经验；   2、熟练使用Node.JS进行后端程序开发，理解Node.JS异步非阻塞的编程模型；    3、熟悉JSON，Protobuffer，XML等网络传输协议；    4、熟练使用Mysql, Redis, MongoDB...", "京银圣地国际游戏投资(北京)有限公司", "100-499人", "民营", "计算机软件", "", "10"
"智联", "Node.js", "Node.JS", "15001-25000", "本科", "上海", "1-3年", " 岗位职责：    1.负责服务端通信框架的搭建和完善（客户端基于MQTT协议和WebRTC技术）     职位要求：   1.熟悉一门或以上服务器开发语言(python, java, php等), 一年以上的 Node.js 开发工作经验   2.对服务端框架的机制，框架的设计模式，...", "上海泛微网络科技股份有限公司", "1000-9999人", "股份制企业", "计算机软件,互联网", "", "12"
