"fromsite", "positionType", "positionName", "salary", "education", "city", "workYear", "jobDes", "company", "companySize", "financeStage", "industryField", "rate", "number"
"智联", "Node.js", "大牛家诚聘——Node.JS开发工程师", "15001-20000", "本科", "上海", "1-3年", " 岗位职责：    1.负责服务端通信框架的搭建和完善（客户端基于MQTT协议和WebRTC技术）     职位要求：   1.熟悉一门或以上服务器开发语言(python, java, php等), 一年以上的 Node.js 开发工作经验   2.对服务端框架的机制，框架的设计模式，...", "上海泛微网络科技股份有限公司", "1000-9999人", "股份制企业", "计算机软件,互联网", "", "1"
"智联", "Node.js", "Node.js开发工程师", "8001-10000", "不限", "广州 - 天河区", "1-3年", " 岗位要求：  1. 对javascript语言本身有较为深刻的理解；  2. 具备NodeJS服务器端研发经验，熟悉异步编程；  3. 有良好的算法及数据结构基础；  4. 熟悉Mongodb、PostgreSQL或MySQL数据库，有较强的SQL编程、调优能力；  5. 熟练使用Git代码管理工...", "广东今喜网络科技有限公司", "20-99人", "民营", "计算机软件,互联网", "", "1"
"智联", "Node.js", "Node.js", "6000-10000", "大专", "成都 - 高新区", "1-3年", " 岗位职责： 1、熟练使用javascript 进行客户端或服务器端的开发； 2、熟悉Nodejs, 对异步处理有深刻的理解； 3、熟悉至少一种web框架, 如express； 4、熟练掌握数据库语言（MySql、SQL Server或者Oracle，其中一种即可），有一定的后台开发经验；  5、熟...", "成都琅琊科技有限公司", "20-99人", "股份制企业", "计算机软件,互联网", "", "12"
"智联", "Node.js", "嵌入式软件高级工程师（Linux，Node.js ）", "8000-11000", "本科", "苏州", "5-10年", " 我们是一家来自德国的企业，期待有Linux开发经验的软件工程师加盟我们苏州的研发团队。      要求: 1. 三年以上从事软件开发工作的经验 2. 熟悉面向对象的编程语言和编程思维 3. 熟悉linux内核开发和通信，有驱动和应用层开发经验；  4. 熟悉WEB服务器的搭建；熟悉Node....", "德国爱尔柏拉有限责任公司苏州代表处", "20人以下", "外商独资", "仪器仪表/工业自动化    ", "", "11"
"智联", "Node.js", "node.js服务器工程师", "10000-15000", "不限", "北京", "", "...node.js/java；  4、熟悉Linux 系统、shell脚本，熟悉mysql数据库、sql语言,能独立设计数据库结构，掌握备份、优化、合并方案；", "北京新创娱游科技有限公司", "20-99人", "民营", "计算机软件,互联网", "", "14"
"智联", "Node.js", "JAVA(Node.js)开发工程师", "2001-4000", "不限", "广州 - 海珠区", "", " 岗位职责：       1.有较强的沟通以及团队协作能力       2.能协助上级及时主动的完成工作任务       3.自学能力强，能独立解决处理所负责的工作任务       4.工作责任心强，性格外向开朗，细致，耐心。              任职要求：       1.有1-2年以上ja...", "珠海瀛海企業策劃有限公司", "20-99人", "民营", "计算机软件    ", "", "8"
"智联", "Node.js", "Node.js开发工程师", "12000-24000", "不限", "杭州 - 余杭区", "1-3年", " # 来 hooli 做什么？  - 即刻服务端(Node.js)开发     # 成为 hooli  Node.js开发工程师的硬指标  - 一年以上Node.js开发经验，对JavaScript本身有深入了解  - 熟悉ES6, ES7等新语言特性  -...", "杭州呼哩科技有限公司", "20人以下", "民营", "计算机软件,互联网", "", "3"
"智联", "Node.js", "后端Node.js工程师", "15001-20000", "本科", "北京 - 朝阳区", "", " 岗位职责：   基于Node.js的服务端设计和研发。      任职要求：  1.在Server端至少有1年开发经验；  2.JavaScript 基本概念清晰，闭包、事件、回调、Promise 等；  3.熟悉Express或Koa框架；  4.熟 悉 MySQL或Redis或类...", "北京六膳门科技有限公司", "20-99人", "其它", "计算机软件,互联网", "", "6"
"智联", "Node.js", "高级Node.js工程师", "15001-20000", "不限", "北京 - 朝阳区", "", " 岗位职责：  基于Node.js的服务端研发、架构设计、开发工具     任职要求：  1.      在Server端至少有3年开发经验，Nodejs至少1年经验，函数式编程2年以上经验  2.      有分布式系统经验  3.      在Rails、Node.js", "北京太合音乐文化发展有限公司", "100-499人", "民营", "计算机服务(系统、数据服务、维修)", "", "1"
"智联", "Node.js", "Node.js工程师", "8001-10000", "不限", "北京 - 朝阳区", "", " 岗位职责：  基于Node.js的服务端设计和研发。     任职要求：  1.      在Server端至少有1年开发经验  2.      JavaScript 基本概念清晰，闭包、事件、回调、Promise 等  3.      熟悉Express或Koa框架  4.    ...", "北京太合音乐文化发展有限公司", "100-499人", "民营", "计算机服务(系统、数据服务、维修)", "", "6"
"智联", "Node.js", "Node.JS开发工程师", "8001-10000", "大专", "广州", "", " 1、习惯阅读英文技术资料，良好的编码风格，较强的自学能力，良好的团队合作意识及积极的心态；  2、参与开发全栈工程，不限于微信接入，前后端开发，React Native App开发，数据库；  3、HTML、CSS重构能力好；  4、1-2年以上C#开发工作经验，了解熟悉Node.js", "广州杰莱互联网金融信息服务有限公司", "20-99人", "民营", "电子技术/半导体/集成电路    ", "", "15"
"智联", "Node.js", "后端开发工程师（C++,Node.js, JavaScript）", "10001-15000", "大专", "上海", "1-3年", "...Node.js开发，使用Node.js开发大型项目的经验者优先，熟悉 ECMAScript，ES6，ES7的优先 ；  2、网络编程以及常用数据结构和算法，深刻理解面向事件编程思想；  3、熟练掌握SQL语言，有较好的分布式系统、分布式数据库系统的理论基础；  4、...", "昀迈(上海)生物科技有限公司", "20人以下", "民营", "计算机软件,互联网", "", "8"
"智联", "Node.js", "Node.js开发工程师", "8000-16000", "本科", "苏州 - 高新区", "1-3年", " 岗位职责：  1.   Web及Web API的架构设计和开发；  2.   Node.js功能模块编写；  3.   与前端和移动端的接口交互设计和开发；  4.   JavaScript程序模块开发，通用类库、框架编写；  5.   持续优化，提供高效、稳定的服务接口；  6. ...", "苏州蓝海彤翔系统科技有限公司", "100-499人", "民营", "计算机软件,互联网", "", "6"
"智联", "Node.js", "Node.js software engineer", "10001-15000", "本科", "上海", "3-5年", " Technical Profile:     ·         Strong knowledge with NodeJS and npm  ·         Familiar with NodeJS framework; nice to have LoopBack fram...", "萨孚凯信息系统技术(北京)有限公司上海分公司", "100-499人", "外商独资", "计算机软件    ", "", "2"
"智联", "Node.js", "node.js高级开发工程师", "15001-20000", "不限", "成都 - 锦江区", "3-5年", " 岗位职责：  1. 负责PC网站, m站点的设计/开发/维护/优化；  2. 负责APP rest api接口的设计/开发/维护/优化；  3. 参与产品需求的沟通/讨论。  任职要求：  1. 三年以上的相关领域开发经验；  2. 熟练掌握node.js进行服务器端程序的开发, 对...", "伟业我爱我家集团", "10000人以上", "民营", "金融/投资/证券    ", "", "12"
"智联", "Node.js", "高级手机游戏服务端开发工程师（Node.js）", "10000-20000", "不限", "福州 - 鼓楼区", "", " 本公司为百度游戏与世界知名日本网络服务DeNA公司合资企业，面向中国、韩国、中国台湾、日本等市场开发和运营手机社交游戏  现福州地区诚聘：高级手机游戏服务端开发工程师（Node.js）     欢迎关注博得网络公众号（bode_game）了解公司的最新动态、招聘最新情况、伯乐奖奖金、...", "江苏博得网络科技有限公司福州分公司", "100-499人", "合资", "计算机软件,互联网", "", "6"
"智联", "Node.js", "Node.JS工程师", "10001-15000", "本科", "苏州", "3-5年", " 职位描述：  1、参与公司各项目中的Web前端功能设计、开发和实现；  2、使用Web前端技术，创建用户友好、符合标准、跨平台及跨浏览器的应用，促进产品易用性改进和界面技术优化；  3、与后端开发人员配合，高质量完成Web前端开发工作；  4、Web前沿技术研究和新技术调研。  5. 负责产品上线...", "苏州盈联智能科技股份有限公司", "100-499人", "股份制企业", "计算机软件,互联网", "", "1"
"智联", "Node.js", "Node.JS工程师", "8001-10000", "大专", "苏州 - 工业园区", "3-5年", " 岗位职责：     任职要求：1.深刻理解Javascript(例：Javascript闭包的实现原理) 2.理解Promise（至少能熟练使用Q、Async、Bluebird中的其中一种） 3.掌握Nodejs的80%模块的特性和使用（能读懂Node源码加分） 4.深刻理解Nodejs事件驱动机...", "苏州盈联智能科技股份有限公司", "100-499人", "股份制企业", "计算机软件,互联网", "", "10"
"智联", "Node.js", "高级手机游戏服务端开发工程师（Node.js）", "10000-20000", "不限", "福州 - 鼓楼区", "", " 本公司为百度游戏与世界知名日本网络服务DeNA公司合资企业，面向中国、韩国、中国台湾、日本等市场开发和运营手机社交游戏  现福州地区诚聘：高级手机游戏服务端开发工程师（Node.js）     欢迎关注博得网络公众号（bode_game）了解公司的最新动态、招聘最新情况、伯乐奖奖金、...", "江苏博得网络科技有限公司福州分公司", "100-499人", "合资", "计算机软件,互联网", "", "11"
"智联", "Node.js", "服务器开发工程师（node.js）", "10001-15000", "本科", "上海", "1-3年", " 岗位职责：  1、负责基于Node.js/MongoDB/Redis游戏的迭代开发与维护；  2、承接新功能的设计与开发，与策划、前台密切配合，保证产品的高效开发与质量；  3、参与已有问题的跟进；  4、发现项目中各种技术问题，并持续优化。  任职要求：  1、精通Node....", "DeNA(中国)", "500-999人", "外商独资", "计算机服务(系统、数据服务、维修)    ", "", "14"
"智联", "Node.js", "Node.js开发工程师", "15001-20000", "本科", "上海", "1-3年", " 工作职责：    1. 高质量的完成Node模块功能，从设计到实现。 2. 编写Restful service 3. Code review，编写单元测试。  任职资格： 1. Node常用框架和内部库有实战经验。 2. 掌握HTMLCSSJavaScriptAJAX。 3. 熟悉Linux工作环...", "上海小虎金融信息服务有限公司", "100-499人", "民营", "计算机软件    ", "", "9"
"智联", "Node.js", "Node.js工程师服务器", "10001-15000", "不限", "北京", "1-3年", " 岗位职责：    1 、基于 NodeJS 开发游戏服务器端的各类功能；      2 、开发和维护游戏服务器；      3 、  熟悉  Node.js  、  MySQL  或  Redis     岗位需求：    1  、1年以上  Javsscript  编程经验。   ...", "成都动鱼数码科技有限公司", "20-99人", "民营", "计算机软件,互联网", "", "10"
"智联", "Node.js", "node.js后端高级开发程序员工程师", "15001-20000", "不限", "杭州", "1-3年", "...node.js等后台开发语言；6、有良好的表达、沟通交流技巧，团队协作能力；有良好的适应能力和学习能力", "杭州乐紫紫网络科技有限公司", "20-99人", "民营", "计算机软件,互联网", "", "6"
"智联", "Node.js", "前端Node.js开发(好孩子集团旗下 期权)", "15001-20000", "大专", "杭州", "3-5年", " 职位描述：     1. 参与公司妈妈好移动端微商城系统（前端和nodejs部分）的开发工作；     2. 参与后端底层架构的设计/重构等工作；     3. 具备web开发，电商开发经验者优先。   任职要求：     1. 熟悉 Express / Koa 等常用框架，对 MVC 有一定了解...", "昆山妈妈好网络技术有限公司", "100-499人", "外商独资", "计算机软件    ", "", "4"
"智联", "Node.js", "Node.js开发工程师", "12000-20000", "本科", "常州", "3-5年", " 岗位职责:  1、使用HTML/CSS/JavaScript开发网页及客户的交互功能；  2、使用node.js开发服务器端程序；  3、依据公司产品设计完成产品功能模块的编程开发；     任职要求：  1、本科及以上学历，计算机相关专业；  2、精通HTML/CSS/DIV/JS...", "唱游信息技术有限公司北京分公司", "20-99人", "股份制企业", "计算机硬件", "", "9"
"智联", "Node.js", "Technical Expert (Node.js/ Docker/ Clojure/ Nginx)", "面议", "本科", "广州", "10年以上", " Technical Expert (Node.js/ Docker/ Clojure/ Nginx)    International Financial Service Group Technical Expert Job in Guangzhou  Your new compan...", "HAYS – 瀚纳仕人才管理咨询有限公司", "100-499人", "合资", "互联网/电子商务    ", "", "15"
"智联", "Node.js", "Senior Node.js Specialist", "面议", "本科", "广州", "无经验", " Senior Node.js Specialist    Senior Node.js Specialist Job in a global banking and financial service group in Guangzhou  Your new compa...", "HAYS – 瀚纳仕人才管理咨询有限公司", "100-499人", "合资", "互联网/电子商务    ", "", "15"
"智联", "Node.js", "Node.js Developer", "面议", "本科", "上海", "1-3年", " Node.js Developer   职位名称：Node.js开发工程师  地点：上海  公司介绍：  我们的客户是一家基于云服务的企业产品软件公司，客户主要为TMT和互联网+领域的企业，目前已和国内多家知名互联网公司合作。公司已完成全球知名风投机构千万美金级别B轮融...", "摹根麦肯立人才服务(上海)有限公司", "20-99人", "外商独资", "计算机软件", "", "8"
"智联", "Node.js", "Node.JS开发工程师", "6000-10000", "不限", "重庆", "1-3年", " 岗位职责：   负责相关系统的编程、开发与优化。       任职要求：   1、1年以上Node.js相关开发经验；  2、熟悉OOP，熟练掌握MVC和相关Web开发框架、设计模式与有技术；  3、熟悉Apache、Nginx、MySQL、Redis、MongoDB、Elastic...", "重庆京师科技有限公司", "20-99人", "民营", "计算机软件,互联网", "", "2"
"智联", "Node.js", "node.js全栈工程师", "10001-15000", "本科", "北京 - 海淀区", "3-5年", " 岗位职责：  1)负责产品网站页面的前端开发和页面重构；   2)参与产品后台功能和开放接口的设计与研发；  3)参与产品性能优化,安全性优化和服务器部署维护；  任职要求：  1)统招本科211及以上学历,计算机及相关专业毕业；三年以上开发工程师经验；  2)对于新技术充满热情, 如 html5...", "北京卓越盛名科技有限公司", "20人以下", "股份制企业", "计算机软件,互联网", "", "3"
"智联", "Node.js", "前端开发工程师（node.js）（项目公司招聘）", "8001-10000", "本科", "珠海", "", " 岗位职责：  1、开发及优化高互动性 Web 界面；  2、协同后台开发工程师，完成 Web 系统开发任务。  任职要求：  1、本科（含）以上学历，计算机或设计相关专业；  2、二年（含）以上前端工作经验；1年（含）以上node.js开发经验；  3、工作地点在珠海市香洲区，劳动合...", "中科招商投资管理集团有限公司", "100-499人", "民营", "教育/培训/院校", "", "14"
"智联", "Node.js", "node.js工程师", "10001-15000", "大专", "杭州 - 萧山区", "1-3年", " 岗位职责：   1.负责互联网平台组件开发维护；  2.能按照项目计划，按时提交高质量的代码；  3.与团队配合，完成开发   岗位要求：   1.2年以上开发经验，特别是基于nodejs语言开发的经验；  2.对Web技术专研有强烈兴趣，有良好的学习能力和强烈的进取心，较强的团队协作精神与创新 ...", "杭州先临三维科技股份有限公司", "500-999人", "股份制企业", "计算机软件,互联网", "", "15"
"智联", "Node.js", "Node.js Developer", "面议", "本科", "上海", "1-3年", " Node.js Developer   职位名称：Node.js开发工程师  地点：上海  公司介绍：  我们的客户是一家基于云服务的企业产品软件公司，客户主要为TMT和互联网+领域的企业，目前已和国内多家知名互联网公司合作。公司已完成全球知名风投机构千万美金级别B轮融...", "摹根麦肯立人才服务(上海)有限公司", "20-99人", "外商独资", "计算机软件", "", "15"
"智联", "Node.js", "Node.js开发工程师", "8001-10000", "本科", "珠海", "1-3年", " 岗位职责：  1、负责公司PC软件项目的开发；  2、在研发项目中，服从产品经理/项目经理或其授权的PDT成员的领导，承担并及时完成项目任务；  3、参加项目研讨，对设计方案和阶段计划提出合理化建议；  4、按项目管理制度要求及文档模板编制设计文档，保证文档的完整性和规范性。  任职要求：  1、...", "珠海优特电力科技股份有限公司", "1000-9999人", "股份制企业", "计算机软件,互联网", "", "8"
"智联", "Node.js", "node.js开发工程师", "20001-30000", "大专", "上海 - 浦东新区", "1-3年", " 主要职责:  1.负责 node.js 后端应用开发  2.编写可重复使用的，可测试的，高效的代码  3.设计并实现低延迟，高可用性和高性能的应用程序  职位要求:  1.精通 JavaScript  2.熟悉 Node.js 及框架知识，如 Express、loada...", "光橙(上海)信息科技有限公司", "500-999人", "合资", "计算机软件,互联网", "", "4"
"智联", "Node.js", "Node.js开发支持工程师", "10001-15000", "大专", "无锡", "", " 岗位职责：  该职位主要为欧美客户提供微软开发平台的咨询与支持，负责为开发人员通过网络论坛和电子邮件、网上聊天等方式提供代码建议及解决方案, 确保顾客对于微软的服务与产品持续地认可与满意。  任职要求：  1.大学英语四级以上，读写熟练  2.两年以上开发经验，熟练使用Node.js...", "上海微创软件股份有限公司", "1000-9999人", "合资", "计算机软件", "", "3"
"智联", "Node.js", "Node.js开发工程师", "8001-10000", "不限", "广州", "", "...Node.js  核心模块的使用；   5 、熟练掌握  Express  或者  koa  中间件；   6 、熟悉 Backbone 、 Angular.js 、 React 等常见前端框架，有开发经验优先；   7 、了解 React Native, Electron 有开...", "广州联客信息科技有限公司", "100-499人", "上市公司", "计算机软件,互联网", "", "13"
"智联", "Node.js", "后台开发（node.js）", "10001-15000", "大专", "北京 - 朝阳区", "3-5年", "...Node.js 源生代码者优先；  3.对新知识有一定的学习能力、钻研精神；  4.熟练掌握后端开发工具，熟练掌握相关前后台技术者优先；  5.有独立开发网站商城平台者优先;  6.要求三年以上，有系统分析，设计，数据库设计的经验；  7.有高并发，高流量互联网项目经验优先", "大连文森特软件科技有限公司北京分公司", "100-499人", "股份制企业", "计算机软件,互联网", "", "15"
"智联", "Node.js", "Node.js 全栈工程师", "15000-25000", "不限", "上海", "1-3年", " 【岗位职责】  1. 配合产品经理和 UI设计师，完成日常的业务功能实现；  2. 通过迭代开发，研究并持续改善性能及可用性；     【任职要求】  1. 精通 JS ，对闭包、事件和异步有深刻的见解；研究过 node 源码优先；  2. 2年以上前端开发经验（含 1 年以上 Node 服务端经...", "上海克而瑞软件技术有限公司", "1000-9999人", "上市公司", "批发/零售", "", "5"
"智联", "Node.js", "Node.JS", "8000-12000", "本科", "南京 - 秦淮区", "", " 岗位职责：  1.使用node.js开发服务器端程序；  2.依据公司产品设计完成产品功能模块的编程开发；     任职要求：  1.本科及以上学历，计算机相关专业，一年以上工作经验；  2.精通HTML/CSS/DIV/JS等前端开发技术  3.精通Nodejs服务端开发，掌握各个...", "江苏博源土地规划设计咨询有限公司", "20-99人", "股份制企业", "计算机软件    ", "", "11"
"智联", "Node.js", "互联网技术经理（兼服务器端Node.js高级软件工程师）", "面议", "本科", "北京 - 朝阳区", "3-5年", "...Node.js, python, PHP, java等编程语言，有一年以上Node.js编程经验；  3. 了解移动互联网软件的基本架构，有服务器端API标准的制定和开发经验；  4. 精通数据库结构设计和编程，熟悉PostgreSQL, MySQL等常用数据库操作...", "药明康德新药开发有限公司", "10000人以上", "外商独资", "通信/电信/网络设备    ", "", "10"
"智联", "Node.js", "node.js开发工程师", "6000-12000", "不限", "南京", "", " 【你要做什么】  来来来，来负责公司产品后端开发；  新功能需求、设计与接口文档编写；   与前端的程序员们合作实现功能并优化我们的系统～     【我们寻找的人】  你得有服务端开发经验, 如果你过去熟悉Node.js框架、常用Node.js扩展、事件驱动和异步编程思...", "南京市栖霞区新路艺术培训中心", "20-99人", "民营", "金融/投资/证券    ", "", "10"
"智联", "Node.js", "Node.js 资深工程师/技术专家[南京]", "15001-20000", "本科", "南京", "3-5年", " 岗位职责:  1、参与系统构架设计和开发。 2、通过对业务的理解 ，对现有产品和系统进行改进和优化。 3、优化前端开发方式及协作流程，创建技术标准及规范。 4、为前后端技术改进、网站性能优化、技术选型提供解决方案。 5、参与Node Web应用框架的开发及优化。   任职资格:  1、有扎实的No...", "YOHO！新与力文化传播有限公司", "1000-9999人", "民营", "计算机软件    ", "", "15"
"智联", "Node.js", "Node.js 开发工程师[南京]", "15001-20000", "本科", "南京", "1-3年", " 岗位职责:  1、负责Node.js及Web前端的开发工作； 2、指导团队技术进步，标准化，规范化制定，推动前端技术的进步； 3、通过迭代开发，研究并持续改善性能及可用性。   任职资格:  1、一年以上Web前端开发?工作经验，至少半年以上Node.js开发工作经验；...", "YOHO！新与力文化传播有限公司", "1000-9999人", "民营", "计算机软件    ", "", "1"
"智联", "Node.js", "Node.JS软件开发工程师（Aldon Lab）", "8000-12000", "本科", "大连 - 高新园区", "3-5年", " 职位要求   ：      1.             计算机相关专业本科及以上学历；      2.             两年以上   Node.JS   开发经验；      3.             掌握常用   Node modules   及相关框架；      ...", "Rocket Software中国研发中心", "100-499人", "外商独资", "计算机软件    ", "", "2"
"智联", "Node.js", "后端Node.js 程序员", "10001-15000", "大专", "厦门", "1-3年", " 职位诱惑 : 发展前景，国际化团队，有出国机会  职位叙述 我们正在寻找 Node.js 程序员，负责管理伺服器及使用者间的交替数据。你的主要职责将会是开发全伺服器端逻辑、定义及维护中央数据库，确保回应前端数据要求的最佳效能。  职责范围  · 建立良好API 端点以伺服前...", "厦门创定网络科技有限公司", "20-99人", "民营", "计算机软件,互联网", "", "3"
"智联", "Node.js", "node.js开发工程师", "15001-20000", "大专", "燕郊开发区", "", " 岗位职责：  1、负责平台后端Node.js部分的服务研发和性能优化；  2、深入研究并负责Node.js语言服务性能监控和性能优化；  任职要求：  1、本科学历以上，计算机相关专业，对javascript语言本身有较为深刻的理解。  2、精通 NodeJS ，要求至...", "云智慧(北京)科技有限公司", "100-499人", "合资", "计算机软件,互联网", "", "1"
"智联", "Node.js", "Node.js服务端工程师", "4001-6000", "不限", "邯郸", "", " 岗位职责：  负责手游游戏服务端业务逻辑开发。     任职要求：  熟悉javascript, 有nodejs开发经验。   有nodejs作品.     其他不做过多要求, 总之我们是个靠谱的重视技术的团队, 希望你是个靠谱的人.     另外，我们公司下一步计划偶尔做一些技术，互联网相关的培...", "北京空岛科技有限公司邯郸办事处", "20人以下", "民营", "计算机软件,互联网", "", "12"
"智联", "Node.js", "Senior Node.js Developer", "面议", "本科", "广州", "5-10年", " Senior Node.js Developer    Guangzhou Senior Node.js Development Job in a global Financial Service Organization  Your new company  This...", "HAYS – 瀚纳仕人才管理咨询有限公司", "100-499人", "合资", "互联网/电子商务    ", "", "11"
"智联", "Node.js", "Node.js前端开发工程师", "4000-8000", "本科", "成都 - 高新区", "1-3年", " 岗位要求：  1、  两年以上的开发经验，熟练掌握Node.js、HTML4/5、DIV+CSS、XHTML等web标准化设计;  2、  熟悉掌握Backbone/Angularjs/React任意一种框架。  3、  有良好的文档书写及编码习惯;  4、  具有良好的团队合作精神...", "北京金地安华科技有限公司成都分公司", "20人以下", "民营", "计算机软件,互联网", "", "14"
