"fromsite", "positionType", "positionName", "salary", "education", "city", "workYear", "jobDes", "company", "companySize", "financeStage", "industryField", "rate"
"拉勾", ".NET", ".NET开发工程师", "6000-12000", "大专", "北京", "1-3年", "职位描述岗位职责：1 根据软件设计方案，进行软件的C#、WPF相关代码编写；岗位要求1、计算机或相关专业专科以上学历；2、2年及以上应用软件开发经验，熟悉asp.net MVC,EF等框架；3、精通C#开发技术，熟练掌握WPF开发，WInform开发，偏向C/S开发；4、熟悉Devexpress商业套件，熟悉ArcGIS/mapGIS;5、具备需求分析和系统设计能力，及较强的逻辑分析和独立解决问题能力；6、工作认真态度踏实。", "北京中恒电国际信息技术有限公司", "50-150人", "初创型(未融资)", "移动互联网", "3.8"
"拉勾", ".NET", ".NET开发工程师（昆明）", "8000-10000", "大专", "昆明", "1年以下", "职位描述此岗位工作地点：云南省昆明市五华区科高路779号职位要求:1、熟练掌握.net B/S软件开发及SQLSERVER或Oracle等主流数据库的开发；2、熟悉web 前端开发技术，如jquery、javascript、HTML5、div+CSS；3、对Linux和Oracle要熟练操作，熟悉Linux常用命令，能独自完成项目的发布和日常运维及性能分析；3、熟悉关系数据库原理,熟悉数据库系统的规划、安装、配置、性能调试，制定数据库备份计划,备份和恢复数据库;4、熟悉SQL、PL/SQL 脚本的编写，有丰富的数据库管理、运维调优经验;5、熟练使用数据库管理、分析、设计工具;6、快速处理系统突发事件的能力，较强的学习和创新能力;7、良好的沟通能力、团队合作精神。各种福利：交五险一金，正常双休，生日卡、培训等。工作时间：每天七小时工作制，每周双休。", "江苏华招网信息技术有限公司", "150-500人", "初创型(未融资)", "其他", "-"
"拉勾", ".NET", ".net软件工程师（广州）", "7000-9000", "本科", "广州", "1-3年", "职位描述岗位职责：1.能承担现场主体项目开发、维护及部分实施工作；2.能够按时完成项目负责人分配的开发任务，保证质量、进度；3.遵循公司规范。按照项目要求完成需求分析设计及编程工作。任职要求：1.有2年或以上的.net软件开发经验；2.精通.net、JavaScript、HTML、XML技术。熟练掌握ASP.NET MVC、EF、Jquery、CSS等Web开发技术；4.有吃苦耐劳的精神,有良好的沟通能力及很强的责任心；5.有较强的学习能力、逻辑思维能力,并具备较强的团队合作意识；6.有在客户现场进行开发工作经验优先。", "上海金慧软件有限公司", "50-150人", "初创型(未融资)", "移动互联网", "-"
"拉勾", ".NET", ".NET开发工程师", "4000-8000", "大专", "中山", "1-3年", "职位描述1、大专以上学历，计算机软件开发或相关专业；2、至少一年.Net实际开发经验，有C/S架构开发经验；3、熟悉MS SQL Server数据库管理系统；4、熟悉开发技术，包括存储过程的编写；5、能够独立胜任项目开发（前期需求分析，文档撰写，代码功能开发实践，后期维护bug处理）。", "广州湘润信息科技有限公司", "150-500人", "初创型(未融资)", "移动互联网,企业服务", "4.0"
"拉勾", ".NET", ".NET高级工程师", "10000-16000", "大专", "深圳", "3-5年", "职位描述岗位职责：1、根据公司产品需求设计说明，完成相关模块的开发；2、负责应用系统关键模块的设计、开发及变更需求开发；3、负责维护系统日常运营，确保系统安全稳定运行；4、协助技术研发中心总监完成项目的规划、执行和管理；5、配合项目组成员，完成其他相关模块开发与维护；6、完成直属上级交办的其他相关工作。岗位要求：1、计算机、信息管理或相关专业，大专或以上学历；2、4年以上C#.NET开发经验,熟练使用MVC\\EF等；3、精通SQL语言、熟练使用SQL SERVER、MySQL数据库；4、掌握基本的前端技术（HTML\\CSS\\JAVAScript)；5、具备一定的设计能力，能带人完成模块或子系统的开发工作。6、良好的沟通和表达能力、工作耐心细致、责任心强、具备团队协作的精神、具备较强的", "深圳市微王子网络技术有限公司", "50-150人", "初创型(未融资)", "移动互联网", "3.2"
"拉勾", ".NET", ".NET网站开发工程师", "5000-9000", "大专", "广州", "1-3年", "职位描述职位描述：1、参与公司电子商务网站平台的开发工作；2、全面理解网站及系统的需求，参与网站开发过程中的需求分析工作和升级改造等工作，协助制定相应的技术解决方案，并实施技术开发以实现需求；3、根据需求完成代码编写，调试，测试、应用程序和维护；5、不断优化和完善平台的性能、使平台能承载不断增长的用户和业务需求；6、电子商务平台长期运营的技术开发和支持。任职要求：1、计算机软件或相关专业专科以上学历，3年以上Asp.Net（C#）WEB相关开发经验，有大型电子商务网站、B2B网站开发经验者优先；2、熟悉.NET框架、ASP.NET体系结构；3、具有SQL server索引优化、查询优化和存储优化经验、静态化设计方面的经验，具有一定的数据库规划能力；4、熟悉ASP.net、C#、熟悉JS、Ajax、熟悉JQuery或类似JS开发框架；5、具有大中型项目开发经验 、良好的编码风格、具备较强的沟通能力、业务分析能力、协调能力和解决问题的能力；6、具有一定的系统分析、设计能力；7、有数据库优化经验优先;8、对互联网行业有浓厚的兴趣。能够通过不断学习，应用最新的互联网知识。认同公司的愿景与文化，以身作则并时刻传递，积极与公司管理人员和团队沟通，并及时反馈自己的思考。", "南京壹号家信息科技有限公司", "2000人以上", "初创型(未融资)", "电子商务,O2O", "3.3"
"拉勾", ".NET", ".NET 软件工程师", "5000-10000", "本科", "北京", "1-3年", "职位描述1.熟悉微软.NET体系架构，有丰富的面向对象开发经验，1年以上为微软项目开发经验；2.熟悉Silverlight或Windows Phone 开发，熟悉XAML开发；3.熟悉SQL Server等主流数据库的开发；4.较强的解决问题能力，良好的团队合作精神，较强的责任心，较强的自我学习能力。具备较强的英文阅读能力，能够阅读英文技术类文档者优先。5.熟悉WPF动画设计者优先", "北京中达金桥技术服务有限公司", "50-150人", "成长型(不需要融资)", "移动互联网,硬件", "-"
"拉勾", ".NET", ".NET高级开发工程师", "10000-15000", "大专", "上海", "1-3年", "职位描述岗位职责：1、参与软件的系统设计和系统架构设计；2、参与软件开发生命周期的全过程：需求、设计、实现、测试、发布、维护；3、负责App后台开发工作,其中包括SqlServer,MediaService,NotificationService,MobileService的开发与维护等；4、严格按公司规定的流程、标准及规范进行代码编写，和单元测试工作；5、配合开发工作书写相应的文档；6、按时完成上级给予安排的其他任务职位要求：1.本科及以上学历，软件工程、计算机信息与技术等相关专业毕业；2.2年以上web项目开发与项目管理经验；3.熟悉.Net平台上的开发技术，精通.Net/C#开发，熟悉SQL Server数据库及Sql语句优化，熟悉SOA/Web Service；4.熟悉JavaScript MVC框架或者JavaScript模块化编程框架；5.熟悉Html5和css3，熟悉jQuery、zepto、bootstrap等框架，对移动设备的Html5开发有兴趣，有手机Web端开发经验者优先；6.熟悉软件技术文档的编写，具备良好的文档编制习惯和代码书写规范；7.具有良好的执行力、动手能力强，思维敏捷，良好的沟通能力和语言表达能力、具备团队合作精神。", "上海瑞慈医疗投资集团有限公司", "2000人以上", "成熟型(D轮及以上)", "医疗健康", "3.2"
"拉勾", ".NET", ".NET应用开发工程师", "4000-8000", "不限", "厦门", "不限", "职位描述职位描述：岗位职责：1.参与公司信息化项目的应用开发任务,包括ERP项目、集团门户、网站以及电子商务平台等；2.负责工作所涉及的应用开发需求管理，包括指导和帮助用户填写开发需求说明书；3.负责工作所涉及内部应用系统文挡的维护（开发、测试、培训文档等）；4.负责相关工作成果的用户培训；5.参加并负责应用开发解决方案的讨论。任职资格：1.2年以上B/S架构开发经验，完整参加过开发项目或全面维护过应用系统（asp、c#、ado、.net、sql server等开发经验）；2.有消费品行业应用系统编程经验优先考虑；3.有大型ERP项目经验或企业BI经验者优先考虑；4.有企业门户网站开发和维护经验者优先考虑。", "鸿星尔克(厦门)实业有限公司", "2000人以上", "上市公司", "生活服务", "5.0"
"拉勾", ".NET", ".net程序员", "8000-15000", "大专", "上海", "1-3年", "职位描述岗位职责：1、在上级的领导和监督下定期完成量化的工作要求；2、能独立处理和解决所负责的任务；3、根据开发进度和任务分配，完成相应模块软件的设计、开发、编程任务；4、进行程序单元、功能的测试，查出软件存在的缺陷并保证其质量；5、维护软件使之保持可用性和稳定性；6、做事严谨踏实，责任心强，条理清楚，善于学习总结，有良好的团队合作精神和沟通协调能力。任职要求：1、熟悉关系型数据库，有丰富的SQLSERVER编程经验，熟练掌握数据库存储过程；2、熟悉.NET Framework、Ajax、性能优化以及应用程序安全；3、了解Web开发客户端必须的技术，包括HTML、CSS、JavaScript、Ajax等Web标准化开发的相关技术；4、熟练掌握三层构架，熟练掌握webForm框架，熟练掌握MVC框架；5、扎实的调试、分析能力，出众的问题解决能力；6、有教育行业电子商务网站或系统开发经经验者优先。   一经录用，金程教育将为您提供广阔且公平的发展平台和富有竞争力的薪资福利，衷心欢迎您加入我们金程的大家庭！1、 员工福利：  1）社会保险+住房公积金 2）健康体检+员工宿舍+意外险 3）带薪拓展+带薪年假+年终奖  4）节日福利+国家法定假  5）导师制的职业提升培训+员工生日会2、对员工开放CFA、FRM等免费培训课程。3、定期组织员工活动（团队建设、专项管理、职场素养等方面）。4、前往知名高校免费听取课程。5、鼓励内部成员在学术水平达标后，发展为学院师资，薪资为：300—800元/时。", "上海金程国际金融专修学院", "150-500人", "成长型(B轮)", "教育", "4.0"
"拉勾", ".NET", ".NET", "6000-10000", "大专", "厦门", "1-3年", "职位描述        岗位职责：1、负责后端IT系统的程序设计与代码编写工作；2、根据IT项目具体要求，承担开发任务，按计划完成任务目标；3、协助测试人员完成软件系统及模块的测试；4、部分软件功能模块设计和软件界面美化；5、配合需求顾问完成软件系统以及模块的需求调研、需求分析；6、完成上级主管交代的其他研发相关任务。任职要求：1、大专以上学历，有asp.net网站开发一年以上的经验；2、熟练运用相关开发工具，对OOP思想有一定的认识，了解MVC开发模式。3、熟练使用SQL Server 2005/2008，熟悉Ajax/HTML/CSS/Javascript，了解div+css 布局；4、掌握良好的代码编写习惯，能够带领团队积极完成各项工作任务；5、较强的自我学习、沟通、逻辑思维能力及团队合作意识。具体薪资依工作能力而定，一经录用，待遇从优。只要你会flash、as3、wed、.net、3D建模任何一项技术编码不要你熬夜，只要你敬业，不怕你要薪，只怕你无码，会写你就来……", "上海购尚网络科技有限公司", "50-150人", "成长型(A轮)", "电子商务", "2.8"
"拉勾", ".NET", ".Net前端开发工程师", "8000-12000", "不限", "北京", "1-3年", "职位描述职位描述1、负责公司.NET相关产品前端网站、Wap页面的交互开发工作。2、根据业务要求完成系统模块的设计、开发工作，并根据测试结果进行问题的修正。3、富有团队和敬业精神，具有良好的自学能力和独立解决问题的能力。任职要求：.1、两年以上.net/C＃（ASP.NET,ASP.NET MVC）开发经验。2、熟悉B/S架构系统开发相关的常用技术，如ajax、jquery、HTML、CSS等。3、精通C#语言，深入理解语法概念，熟练掌握B/S、MVC系统结构中的分层开发模式, 对mvc等有实际的开发经验。4、拥有良好的代码习惯，要求结构清晰，命名规范，逻辑性强，代码冗余率低。5、能独立阅读资料，掌握新的技术、方法，有php 项目开发经验者优先考虑。6、有过机票、酒店类项目或熟悉Python开发经验者优先考虑。", "北京金色世纪商旅网络科技股份有限公司", "500-2000人", "成熟型(不需要融资)", "电子商务,旅游", "5.0"
"拉勾", ".NET", ".NET开发实习生(2017，北京)", "3000-5000", "本科", "北京", "应届毕业生", "职位描述任职资格：1、热爱并执着于技术学习和实践，具有良好团队合作精神，有高度的责任心，有很强的学习能力；2、熟练掌握C#、ASP.NET、Javascript、Ajax、Jquery等技术；3、熟练使用Visual Studio 2010&2012，熟悉SQL Server 2008 及存储过程的编写；4、熟悉UML、OO或有SaaS系统开发、产品设计或有大型项目设计开发经验者优先。5、计算机相关专业大三、大四、研二、研三学生，能够实习半年以上。工作职责：1、负责北森人才管理Saas软件设计、开发工作；2、解决工作中的技术难题，为用户提供高性能的体验。3、为产品设计提供优秀的建议。", "北京北森云计算股份有限公司", "500-2000人", "上市公司", "企业服务,数据服务", "4.0"
"拉勾", ".NET", ".NET软件工程师", "6000-8000", "大专", "武汉", "3-5年", "职位描述岗位职责：1.根据软件需求说明书，从事具体的软件开发，核心模块代码编写；2.及时解决项目上存在的问题，协作项目经理保证项目的顺利完成；3.按照软件工作流程提交项目成果和相关文档；岗位要求：1、两年以上工作经验，熟悉C#语言及B/S开发，对MVC开发模式有一定了解；2、熟悉JS脚本语言，能够熟练使用JQUERY；3、熟悉SQL-SERVER，能够使用SQL语言进行基本的查询，有SQL编程经验；4、逻辑思维能力较强，有一定的压力承受能力，能适应出差。", "上海金慧软件有限公司", "50-150人", "初创型(未融资)", "移动互联网", "-"
"拉勾", ".NET", ".NET", "6000-12000", "不限", "海口", "1-3年", "职位描述我们需要这样的你：1、具有C#/.net 或 Java 服务器程序开发工作经验；2、精通 sqlserver或mysql或Oracle数据库，能独立完成存储过程开发，并完成性能优化；3、熟悉mvc框架，有不断提升自身技术水平的需求 ，有大型网站开发经验者优先；4、熟练掌握软件后台读写数据库，及逻辑处理代码的开发。5、能熟练使用Eclipse或VS开发环境6、熟悉手机APP服务器端开发，5年经验7、大专以上学历，计算机相关专业，或有相关工作经验。8、具有大型项目开发工作经验，具有独立开发能力，具有一定的系统架构能力者优先；9、有创业激情，认真踏实，热爱移动互联网，有积极的工作态度和良好的团队合作精神。你要会做这些事情：1、负责项目后台的建设与研发以及相关客户端的设计与研发；2、负责服务器的架构设计、方案制定、代码编写；3、跟进项目进展，编写设计开发及实现文档；4、根据产品功能需求设计并完成软件实现；5、负责优化网站产品的质量、性能、用户体验；6、收集最新设计趋势，确保设计发展方向符合行业趋势；7、具备良好的文档维护能力，熟练使用管理代码；8、负责前端技术实施的整体考虑，提供前端与后端技术应用解决方案。", "海口集思优科网络科技有限公司", "15-50人", "初创型(未融资)", "移动互联网,O2O", "-"
"拉勾", ".NET", ".net软件工程师", "8000-16000", "大专", "广州", "3-5年", "职位描述岗位职责：1、参与公司网站、移动端项目开发工作；2、协助项目经理完成所参与项目的维护工作；3、对部门分配的专职任务保质完成；4、完成上级安排的其他工作；任职要求：1、3年以上软件开发经验，具有带领团队成员完成项目开发工作的能力，有防伪行业项目经验、pda（wince）开发经验优先；2、熟悉.NET平台、C#，.NETFramework框架；熟悉B/S相关的开发技术，熟悉前端相关技术（如html、jQuery、ajax等）；3、熟悉SQLServer数据库、SQLServer数据库环境的编程应用，熟悉存储过程及触发器；4、熟悉ADO.NET，精通SQL语言；熟练掌握企业级数据库（MSSQL、MYSQL）；5、责任心学习能力强，思想积极、活跃，工作认真、负责，有较强的沟通能力和团队合作意识；6、愿接受挑战和承受工作压力。工作时间及福利：1、周末双休、朝九晚六，中午休息一个半小时，7.5小时/天；2、五险一金+按国家规定享受带薪（婚假、产假、病假、年假等）+各类法定节假日+年度旅游+员工体检+节日福利+员工活动等；3、公司不定期举行聚餐、K歌、健身等娱乐活动；4、公司提供优美的办公环境，提供优质资源。", "广州米多网络科技有限公司", "50-150人", "成长型(A轮)", "移动互联网,电子商务", "3.0"
"拉勾", ".NET", ".NET", "15000-25000", "大专", "北京", "3-5年", "职位描述岗位职责：1、负责系统的业务需求分析、系统设计、开发任务分解、开发计划制定；2、负责开发团队成员管理；3、负责产品的研发过程跟进、任务验收、代码review、质量控制；4、负责产品线间的沟通协调工作；5、负责团队的技术培训、Scrum敏捷实践和综合管理。任职要求：1、全日制本科及以上学历，具备快速学习新理念及技术,有务实的工作态度与扎实的软件开发理论基础；2、具有4年以上移动、微信技术平台开发经验；3、熟悉敏捷开发Scrum模式，具有实际项目经验者优先4、擅长使用TFS/SVN开发和测试管理。代码关联任务/bug、、code-review、按计划周期性的自动集成发布与smoking test、发布版本管理等；5、具有良好的OOA/OOD/OOP及设计模式与敏捷开发的实践经验、分析设计与架构经验；6、具有良好的组织、沟通、协调及综合管理能力、具有强烈的责任心；7、具有良好领会公司及主管意图、具有高度的贯彻执行力、能带领团队完成团队目标；8、具有大型互联网网站实际工作经验者优先。", "北京车城网信息技术有限公司", "150-500人", "成长型(B轮)", "移动互联网", "4.5"
"拉勾", ".NET", "高级.net开发", "12000-18000", "大专", "深圳", "3-5年", "职位描述岗位职责：1、参与产品的功能模块的详细设计、编码实现和单元测试，保证开发进度及产品质量；2、参与项目重点、难点模块的研发工作，结合业务的特点，提供面向业务的整体优化方案；3、参与SQLServer、MySQL数据库的维护，管理及性能调优；4、为其他开发人员做技术支持和指导。职位要求：1、计算机相关专业大专及以上学历，3年及以上工作经验，至少参与过2个大型项目的研发；2、精通ASP.NETMVC框架，熟练使用WCF、SOCKET、多线程、Windows服务、Ajax等相关技术；3、熟悉SQLServer、MySQL数据库系统，熟悉数据库设计、调优及存储过程的编写；4、熟悉面向对象的开发，具备较扎实的编程基本功，具有良好的代码编写习惯；5、具备一定的功能需求分析、系统设计的经验，能独立开展工作，有项目管理经验者优先。", "深圳华强电子交易网络有限公司", "150-500人", "上市公司", "移动互联网 ,电子商务", "3.8"
"拉勾", ".NET", ".Net MVC 开发工程师", "10000-20000", "本科", "上海", "1-3年", "职位描述岗位职责：1、医疗互联网产品后端开发；2、与研发团队成员配合进行模块间的联合开发调试；3、书写开发过程所需的技术文档。任职要求：1、计算机等相关专业,编程基础知识扎实；2、熟练使用MVC进行后台管理系统开发；3、熟练掌握HTML,CSS,Javascript,Json,Ajax,XML等Web相关技术；4、了解webservice、wcf、webAPI、socket等API接口编程；5、了解底层TCP/IP网络通讯机制编程；6、精通MySQL数据库相关编程技术,精通SQL语句,了解Oracle；", "上海秦丰睦投资管理有限公司", "15-50人", "初创型(不需要融资)", "移动互联网,医疗健康", "2.8"
"拉勾", ".NET", "ASP.NET C#高级工程师", "20000-30000", "本科", "北京", "5-10年", "职位描述职位描述1、参与平台架构设计与开发；2、参与项目需求分析，并实施技术方案选型、验证；3、负责项目的软件设计，以及核心模块的开发实现；4、对团队其他组员进行必要的工作指导；岗位要求1、正规院校本科以上学历，数学、计算机、通信、信息管理、网络工程等相关专业；2、5年以上C#系统的软件的设计和开发经验，侧重于Web领域，年龄30-38之间；3、至少精通一种大型关系数据库的开发，并熟悉NoSql解决方案；4、涉猎一些中间件、开源技术，尤其用于大规模数据、并发访问等领域的技术方案；5、有很强学习能力和解决技术难题的能力；6、较强的团队协作精神和责任心，有一定的组织领导能力，较强的沟通协调能力。", "北京乐教乐学教育科技有限责任公司", "50-150人", "初创型(未融资)", "电子商务,教育", "3.4"
"拉勾", ".NET", ".NET", "8000-16000", "大专", "深圳", "3-5年", "职位描述1.3年以上C#、asp.net工作经验，能独立开发大中型B/S项目；2.熟悉面向对象编程和多层架构的设计和开发；3.熟练使用Visual Studio 2008/2013、Sql server 2008/2012、SVN ,TFS等相关开发工具；4.熟练掌握XML、wcf技术、HTML, Javascript, CSS，Jquery，MVC4等相关技术；5.精通SQL Server 数据库调优、镜像、同步，有较强的复杂业务逻辑处理能力及数据库设计和优化技巧；6.熟悉微软的架构体系，网站静态化设计，大型高性能架构设计，缓存（Redis）、负载、高并发；7.注重团队合作，具备良好的分析能力、创新能力、承压能力，学习能力、沟通能力。", "深圳市壹捌无线科技有限公司", "150-500人", "成长型(B轮)", "移动互联网", "4.0"
"拉勾", ".NET", ".NET", "10000-20000", "本科", "南京", "3-5年", "职位描述1、深入理解面向对象的概念，了解C#语言特性2、熟悉.net开发流程，熟练使用开发工具和版控工具3、善于快速学习使用新的互联网技术", "南京途牛科技有限公司", "2000人以上", "上市公司", "电子商务,旅游", "3.9"
"拉勾", ".NET", ".Net", "5000-8000", "大专", "杭州", "1-3年", "职位描述岗位职责：1.负责公司信息系统(C/S架构)的功能模块开发；2.负责与电商平台（淘宝、天猫、京东等）、快递公司的接口开发；3.根据项目具体要求，承担开发任务，按计划完成任务目标；4.负责系统的版本更新及部分维护工作。任职要求：1.大专以上学历，信息管理、计算机等相关专业；2.1年以上的.NET（C#）企业应用管理软件项目开发经验；3.熟练面向对象技术和三层架构；4.熟练各种常规数据库（Oracle、MySQL或SQLServer等）应用及开发；5.具有团队工作精神，善于沟通，积极上进，有责任感。", "杭州赋优电子商务有限公司", "150-500人", "成熟型(C轮)", "电子商务", "4.3"
"拉勾", ".NET", "后端开发(asp.net）", "8000-16000", "不限", "东莞", "1-3年", "职位描述1、精通C#、ASP.Net编程，精通SQLServer、Oracle等至少一种数据库；2、熟悉MVC开发框架，有实际web项目开发经验；3、熟悉js、jQuery、EXTjs、Easyjs、CSS等前端开发技巧，熟悉EF Code  First；4、c#基础扎实，熟练掌握多线程、委托、事件、反射技术；5、熟悉MYSQL、MSSQL熟练编写程储过程，触发器与函数，并有数据库设计经验；", "深圳市金塔山投资控股有限公司", "150-500人", "初创型(未融资)", "移动互联网,教育", "4.4"
