"fromsite", "positionType", "positionName", "salary", "education", "city", "workYear", "jobDes", "company", "companySize", "financeStage", "industryField", "rate"
"拉勾", ".NET", ".NET", "4000-8000", "本科", "北京", "1-3年", "职位描述岗位职责：1.参与技术体系的建设与运作支持;2.完成上级安排的技术架构探索及现有技术架构的运营;3.完成安排的产品技术开发工作，并根据测试结果进行问题的修正;4.完成上级交办的其他工作；5.APP端前台开发。岗位要求：1.计算机相关专业。具有3年或以上的C＃（ASP.NET,ASP.NET MVC 3.0）企业级开发经验；2.精通C#、ASP.NET、MVC3.0应用程序开发；精通SQL Server、mysql数据库，有复杂报表SQL编写经验者优先；3.熟悉HTML、XML、DIV/CSS、JavaScript、Jquery等Web技术，并且有一定的浏览器兼容性开发经验；熟悉Microsoft Visual Studio系列编程IDE；4.有大型电商、企业网等系统及接口开发、统计分析、数据结构等优先；5.熟悉设计模式，有一定的独立软件设计与系统设计能力者优先；6.具有Socket、多线程编程者优先；具有大数据量，高并发经验者优先；7.有一定的独立问题分析与解决能力；有一定的规范技术文档写作能力；8.具有较强的责任感和良好的沟通协调能力。起讯科技欢迎你~", "起讯名扬(北京)科技有限公司", "50-150人", "成长型(不需要融资)", "移动互联网,电子商务", "-"
"拉勾", ".NET", "高级开发工程师（Asp.net）", "8000-12000", "大专", "郑州", "3-5年", "职位描述岗位职责：1.参与公司平台架构分析和设计工作，协助进行流程的整理，编写相关文档;2.负责核心框架与核心代码的开发;3.负责指导开发人员进行功能的开发;4.负责功能代码质量审核工作，并控制算法和编写规范;5.参与系统部署工作，解决生产环境可能出现的故障。任职要求：1.大专及以上，计算机、软件工程及相关专业;2.三年以上.net系统开发经验，具备大型系统的设计和开发经验优先;3.精通.NET下的C/S、B/S系统开发，精通.Net框架类库，如WCF、WebAPI、Web Form、MVC，Entity Framework等;4.精通软件架构、设计模式，掌握可重用、扩展构架机制，对AOP，IOC有深入的理解和应用;5.熟悉SQLSERVER，Oracle等主流数据库，并熟练掌握SQL，存储过程，触发器等，能够根据项目需要灵活运用数据库的各种功能，并对数据库优化有一定的了解;6.具备良好的编程风格，有多层架构的开发经验和严谨的编程作风;7.善于与人沟通，为人正直、诚信，具备良好的职业素养，具有较强的团队协作精神、自学能力和责任心。薪酬待遇：年薪10-15万。直接上级：技术总监", "河南润泰电子商务有限公司", "50-150人", "初创型(未融资)", "电子商务,O2O", "3.6"
"拉勾", ".NET", ".NET软件开发工程师（急聘）", "10000-20000", "大专", "深圳", "3-5年", "职位描述职位职责：1、根据产品需求，产品原型及单元需求按照规范完成概要设计，详细设计，代码实现，代码测试。2、协助开发工程师进行代码规范实施，难点攻关。3、负责产品实施的开发质量控制，编写安装文档，配合运维组进行软件安装实施，配合测试组进行测试环境安装实施。职位要求：1、熟练掌握面向对象思想，能够进行面向对象开发与设计。2、具备3年以上基于、net技术的项目开发经验3、熟悉.net体系架构，熟悉、net开发平台，具备internet应用、分布式应用、多层结构应设计技能，熟悉相关设计模式。4、熟悉c#、asp.net等高级开发语言与架构。5、熟悉sql server和oracle数据库设计与应用，精通sql语言，能编写高效的sql语句。6、熟悉html、css等页面表现语言以及jquery等脚本框架。7、有一个以上大型b/s架构项目设计开发经验。8、具备良好编程风格与习惯,思维敏捷、自学能力强、接受能力强。9、熟悉至少一种java script框架，jquery***，并有过相关开发经验。10、了解sitecore/wcf/ccflow/knockout/cas/lucene者优先【员工福利】1.5天7小时工作制，周末双休，提供极具竞争力的薪酬与福利；2.团队活动经费、节日福利、员工培训等；3.正式员工购买养老、医疗、工伤、失业、生育、住房公积金等社会保障福利；4.依法享有国家法律/法规规定的病假、婚假、产假、丧假、法定假日等有薪假期。", "长城物业集团股份有限公司", "2000人以上", "成熟型(不需要融资)", "移动互联网,O2O", "3.8"
"拉勾", ".NET", ".NET", "3000-5000", "大专", "成都", "应届毕业生", "职位描述职位描述1．运用.Net，C#开发和维护内部系统和公司产品；2．运用Ajax、缓存技术等提升响应速度和用户体验；3. 具有ASP.NET（MVC, WebAPI）方面的开发经验4. 至少熟悉以下一种数据库：SQL Server，MySQL优先条件对软件程序设计工作充满热情额外具有一种或多种编程语言方面的经验，包括但不限于：C/C++，Python，JavaScript或Go精通AJAX，数据库设计和SQL有兴趣并有能力在需要时学习其他编码语言你的技术可以不高，但至少你要有学习的热情熟悉Git或者SVN源代码管理", "成都安意科技有限公司", "少于15人", "初创型(未融资)", "移动互联网,数据服务", "-"
"拉勾", ".NET", ".NET", "8000-15000", "本科", "深圳", "1-3年", "职位描述职位描述岗位职责：设计及开发数据库驱动的Win32应用，Web应用，及跨平台手机APP任职要求：1- 计算机、软件、电子信息、土木工程等相关专业2- 1-3年.NET开发经验，优秀应届毕业生亦可考虑，熟练掌握一种或了解多种.NET开发框架3- 熟悉WPF开发，熟练掌握XAML标记语言，能够自定义控件4- 熟练掌握主流数据库，如SQL Server，MySQL，熟悉XML，Json，Web service及相关技术，熟悉Html/Javascript/AJAX，能实现页面报表的展现5- 土木工程专业背景以及有移动APP开发经验者优先考虑", "深圳筑星科技有限公司", "15-50人", "初创型(不需要融资)", "移动互联网,信息安全", "-"
"拉勾", ".NET", ".NET工程师（高级）", "8000-15000", "本科", "成都", "5-10年", "职位描述【应聘要求】1. 5年以上工作经验，熟练运用.net2. 熟练使用至少一种主流数据库开发3. 通信运营商项目经验、sql数据库经验等优先4. 本科及以上学历。", "四川联友电讯技术有限公司", "50-150人", "成长型(不需要融资)", "移动互联网,电子商务", "-"
"拉勾", ".NET", "ASP.NET程序员", "6000-12000", "不限", "成都", "1-3年", "职位描述岗位职责：1、负责 asp.net 的 web 应用程序的维护、开发；2、sqlserver 数据库脚本编写、数据库优化与维护；3、负责各应用级的 web 和 客户端程序的开发工作。任职资格：1、熟练运用C# ASP.NET 开发，两年以上实际项目开发经验；2、有良好的编码习惯；3、熟悉 SQL SERVER 数据库、MySql数据库，能熟练地运用SQL语言，熟悉SQL语句调优和数据库调优；4、熟悉网站产品开发流程，对网站产品的UI及用户体验有很好的认识；5、熟悉Div+Css开发模式，能熟练运用Html、css、JavaScript、JQuery；6、具备一定的 WinForm 开发能力；7、具备较强逻辑思维，有抗压能力，有责任心，有良好的沟通能力，能自我学习，自我提高；8、有工作责任心，头脑灵活，积极肯干；9、具有良好的团队合作精神和敬业精神。", "四川金虎多媒体通讯技术有限公司", "15-50人", "初创型(不需要融资)", "移动互联网,教育", "-"
"拉勾", ".NET", ".NET软件开发工程师", "5000-8000", "不限", "天津", "1-3年", "职位描述岗位职责：1、负责系统开发与维护；2、配合部门经理完成相应模块设计；3、按照项目管理流程，参与研发部门的总体设计评审；4、进行详细设计、代码开发，配合测试，高质量完成项目；5、参与技术难题攻关、组织技术积累等工作。任职要求：1、有开发经验，熟练运用web api者优先；2、精通asp.net编程，熟练使用Visual Studio等开发工具；3、熟悉JavaScript、Ajax、XML等相关技术；4、熟悉MySQL等数据库开发、SQL性能调优；5、有良好的代码书写、注释和单元测试习惯，熟练运用多种软件设计模式；6、具备良好的沟通合作技巧，较强的责任心及团队合作精神。", "天津云顶云科技有限公司", "15-50人", "初创型(未融资)", "移动互联网,企业服务", "-"
"拉勾", ".NET", ".NET", "6000-8000", "大专", "广州", "1-3年", "职位描述1.负责系统项目的架构设计、性能优化、代码编写等工作；2.负责系统项目的实地安装、调试与维护；3.负责项目中各阶段所需的必要文档的编写工作；4.负责与客户进行沟通，对其反馈信息进行及时跟进与处理。任职要求:1、大专以上学历，计算机软件开发或相关专业；2、至少一年.Net开发经验，熟悉HTML、JavaScript，Jquery，Ajax技术，有B/S结构网站应用的开发经验；3、熟悉MSSQL Server数据库管理系统；4、熟悉开发技术，包括存储过程的编写；5、能够独立胜任项目开发（前期需求分析，文档撰写，代码功能开发实践，后期维护bug处理）。薪酬待遇：1.6-8K+项目提成2.单双休3.购买五险4.节假福利5.公司旅游6.带薪年假7.法定节假日8.员工生日9.朝十晚六10.工作时间每满一年最高20%提薪", "广州市昊翼信息科技有限公司", "15-50人", "初创型(未融资)", "移动互联网,游戏", "4.3"
"拉勾", ".NET", ".NET", "10000-18000", "大专", "上海", "3-5年", "职位描述岗位职责：1、负责维护和开发公司业务系统（B/S结构）2、可以胜任复杂度较高的系统的程式分析与设计、数据库维护和设计的工作；3、具有主动意识并独立解决问题的能力，兼具团队协作的能力4、良好的沟通能力职位要求：1、2年以上B/S结构的C#开发经验2、熟悉MVC、WCF、Web API、IoC、MemberCache等技术3、能独立完成基本的前端工作，JQuery+CSS，熟悉Bootstrap等前端框架更佳4、熟悉SQL Server ，熟悉SQL开发和优化，熟练使用至少一种ORM框架5、具有互联网开发经验更佳6、具有大型站点开发、部署和性能调优者优先7、具有阅读和维护asp代码能力者优先", "上海宽文是风软件有限公司", "150-500人", "初创型(未融资)", "企业服务", "3.9"
"拉勾", ".NET", "C#.Net", "10000-20000", "大专", "北京", "1-3年", "职位描述职责描述：1.参与项目的需求分析和设计工作2.进行开发设计，参与项目的开发/调试/测试工作3.配合相关部门的需求开发系统后台功能模块岗位要求：1.本科及以上学历，计算机相关专业优先，具备一年以上相关工作经验或两年以上相关领域开发经验2.丰富的C#开发经验，熟练掌握.net框架及开发环境。熟悉ASP.NET开发3.熟悉基本数据库（Microsoft SQL Server/Oracle/MySQL）开发使用4.熟悉Azure开发5.具有良好的学习能力、沟通能力,工作细心负责,能承受一定工作压力", "五洲万象（北京）科技有限公司", "15-50人", "成长型(A轮)", "移动互联网", "4.8"
"拉勾", ".NET", ".NET开发程序员", "10000-20000", "大专", "广州", "3-5年", "职位描述岗位职责1、使用ASP.Net（C#）进行网站的前台设计制作和后台开发;2、负责公司项目网站、App服务端的开发以及需求的整理；3、相关文档的编写，包括需求、设计、使用手册等;4、负责公司网站服务端开发、维护、更新；有电商、社交网站开发经验优先;5、负责在WindowsServer2008，IIS的网站发布、配置和维护;6、有WEBAPP（HTML5）或微信公众号开发经验优先.岗位要求1、熟练掌握.NET平台上的开发技术，2年以上程序开发经验；2.熟练使用C#语言基础、了解MVC框架、了解WCF架构等.net技术体系；3.熟练掌握SQL语句、存储过程、熟悉SQLServer2008数据库开发；4.对面向对象、面向服务、软件系统架构有概念性的理解，有较强的逻辑能力和较高的工作效率；5.具有良好的沟通力和团队合作精神；6.熟练应用VS2015、SQL2008R2、TFS等微软体系开发工具.", "广州大象健康科技有限公司", "150-500人", "成长型(A轮)", "移动互联网", "4.0"
"拉勾", ".NET", ".NET", "8000-14000", "大专", "东莞", "1-3年", "职位描述工作职责：1、独立完成部分模块概要设计；2、能响应部分模块业务内容的技术需求；3、解决系统测试阶段、系统维护阶段部分模块出现的相关故障；4、负责部分模块的业务系统技术支持；5、根据需求文档按时完成部分模块的设计、开发工作，并达到验收标准。任职要求：1、大专及以上学历，计算机及相关专业；2、具有2年以上.NET平台开发经验；3、熟悉面向对象思想，熟练掌握经典设计模式的应用；4．熟悉.NET平台常用技术框架的应用，如MVC、Entity Framework、WCF、IOC框架等；5．熟练掌握Web前端技术，包括HTML5/CSS3/JavaScript/AJAX/XML/JSON等；6、熟练掌握MSSQL、MYSQL等数据库，能够编写较复杂的SQL语句和存储过程；7、熟悉Redis和MongoDB的优先；8、工作态度端正、责任心强，具有良好的学习能力、团队协作精神。9、有电子商务系统开发经验者、CRM或仓储物流系统开发经验者优先。待遇：1、工作时间：朝九晚六，双休，享受国家法定假期，年假。2、薪资：税前月薪8k-14k。", "东莞市芝麻地网络科技有限公司", "15-50人", "初创型(未融资)", "移动互联网", "5.0"
"拉勾", ".NET", ".NET软件开发工程师 - 杭州", "7000-14000", "本科", "杭州", "1-3年", "职位描述岗位职责参与软件系统架构设计、接口设计、技术调研、文档编写、软件开发工作参与软件业务沟通、需求讨论、编写设计文档、系统解决方案设计等负责模块的代码编写、功能实现和优化、重构、改善和优化软件性能等严格按照公司贵的流程、标准和技术规范编写代码和文档任职要求计算机本科或相关专业学历，热爱编程3年以上C#和.NET软件开发经验，熟悉Visual Studio开发工具2年以上WPF项目经验，熟悉WPF类库，熟悉MVVM模式和数据绑定原理，熟悉XAML3年以上SQL Server开发经验英语听说读写流利，有外企任职经验者优先有金融或相关行业从业经验者优先具备web前端开发经验者优先", "威廉欧奈尔信息科技（上海）有限公司", "15-50人", "初创型(未融资)", "移动互联网,金融", "3.2"
"拉勾", ".NET", ".NET", "10000-15000", "本科", "上海", "1-3年", "职位描述岗位职责： 1、与开发团队配合，完成产品的开发和维护； 2、能独立完成产品经理分配的开发任务； 3、配合项目实施人员完成项目中产品的修改和维护； 岗位要求： 1、本科及本科以上学历； 2、思路清晰，热爱编程，有责任心，有团队精神，吃苦耐劳； 3、1年以上开发经验，精通C#语言，熟练掌握.NetFramework； 4、1年以上B/S,C/S项目经验，能根据需求及产品设计，独立搭建项目原型； 5、熟练掌握Web通讯，熟练掌握Socket通讯； 6、熟练掌握MYSQL或其他大型数据库的开发； 7、有框架编写经验者优先；有Socket编程经验者优先；", "递易（上海）智能科技有限公司", "150-500人", "成长型(A轮)", "O2O,硬件", "3.2"
"拉勾", ".NET", ".NET系统架构师", "10000-20000", "大专", "广州", "5-10年", "职位描述岗位职责：1、使用ASP.Net（C#）进行网站的前台设计制作和后台开发;2、负责公司项目网站、App服务端的开发以及需求的整理；3、相关文档的编写，包括需求、设计、使用手册等;4、负责公司网站服务端开发、维护、更新；有电商、社交网站开发经验优先;5、负责在Windows Server 2008，IIS的网站发布、配置和维护;任职要求：1、熟练掌握.NET平台上的开发技术，2年以上程序开发经验；2. 熟练使用C#语言基础、了解MVC框架、了解WCF架构等.net技术体系；3. 熟练掌握SQL语句、存储过程、熟悉SQLServer2008数据库开发；4. 对面向对象、面向服务、软件系统架构有概念性的理解，有较强的逻辑能力和较高的工作效率；5. 具有良好的沟通力和团队合作精神；6. 熟练应用VS2015、SQL2008R2、TFS等微软体系开发工具.", "广州大象健康科技有限公司", "150-500人", "成长型(A轮)", "移动互联网", "4.0"
"拉勾", ".NET", "初级.NET软件开发工程师", "5000-10000", "本科", "上海", "不限", "职位描述岗位职责根据技术团队的任务分派，按时独立完成开发任务参与系统设计、技术调研、软件开发、文档编写、软件测试等工作严格按照公司规定的流程、标准和技术规范编写代码和文档任职要求计算机本科或相关专业学历，热爱软件开发行业1年以上 C# 和 .NET开发经验，熟悉Visual Studio开发工具具有WPF+WCF的软件开发经验，了解XAML了解MVVM框架1年以上SQL Server开发经验英语听说读写流利，有外企任职经验者优先具备web前端开发经验者优先", "威廉欧奈尔信息科技（上海）有限公司", "15-50人", "初创型(未融资)", "移动互联网,金融", "3.2"
"拉勾", ".NET", ".net开发工程师", "4000-8000", "大专", "厦门", "1-3年", "职位描述岗位内容：1、根据开发进度和任务分配，完成相应模块软件的开发、编程任务；2、进行程序单元、功能的测试，查出软件存在的缺陷并保证其质量；3、编码符合规范，代码质量可以保证，编码效率达到标准生产性；4、编制相关的项目文档和质量记录的工作；5、维护软件使之保持可用性和稳定性；岗位要求：1、精通C#、Windows Form、Asp.net，一定的C++基础；2、掌握面向对象开发思想；3、熟悉.NET 3.5或4.0框架；4、熟悉Linq数据访问开发；5、对windows系统有深入了解，熟悉网络协议；6、精通SQL Server、MySql, 熟悉存储过程的编写；7、良好的过程开发规范和团队合作精神；8、1年以上软件开发经验，有电商系统开发经验优先；", "福建长潮信息科技股份有限公司", "50-150人", "上市公司", "移动互联网", "-"
"拉勾", ".NET", ".NET中级开发工程师", "4000-8000", "大专", "广州", "1-3年", "职位描述岗位职责：1、基于.NET技术，参与公司前、后台业务系统开发2、参与甲方的需求调研和需求分析；3、做好项目相关代码以及文档的整理归档工作；4、负责产品持续交付、功能模块的开发，包括性能优化和新需求实现；任职资格1、一年或以上.NET开发经验；2、熟练掌握 C#语言，熟悉MVC，熟练使用VS进行项目开发；2、了解IOC/AOP，EF code first MVC dynamic Linq Lambda ；4、有电商系统 、 开源技术（Nop、Orchard、ABP等）开发经验者优先考虑。公司属于创业公司，目前处于发展过程张，公司对于杰出贡献者提供较好的晋升渠道与薪资待遇，欢迎加入", "广州易社网络科技有限公司", "少于15人", "初创型(未融资)", "电子商务,企业服务", "-"
"拉勾", ".NET", ".NET", "5000-8000", "大专", "成都", "1-3年", "职位描述一、招聘岗位   .net 研发工程师二、需求人数  3人三、岗位职责   负责.net后台研发四、任职要求  1. 要求有良好的沟通能力和需求理解能力。能无障碍保持和团队成员的沟通协作。对业务需求有较强的理解能力  2. 至少参与过一个 .net mvc开发项目。对.net mvc 有深入的理解。  3. 熟悉数据库方面的理论知识。至少熟悉sqlserver /mysql 其中一种数据库。能编写存储过程，理解索引的用途等。  4. 能使用html和javascript将前端开发工程师的静态页面转换为动态页面。至少使用过一种js扩展组建  5. 有良好的团队工作能力以及吃苦耐劳的品质, 能适应工作时间上的调配和安排；  6. 有ERP开发经验优先。有移动端后台开发经验优先", "成都起业科技有限公司", "15-50人", "成长型(A轮)", "移动互联网,电子商务", "4.1"
"拉勾", ".NET", ".NET/C#软件开发工程师+五险一金+双休", "4000-8000", "不限", "郑州", "1年以下", "职位描述工作职责：员工福利： 1、公司实行双休制，所有节假日均按国家规定执行； 2、为员工缴纳五险及住房公积金； 3、享有年休假（5天以上）及婚假、产育假(包含男职工陪产假)等休假制度； 4、每月享受有午餐和交通补助； 5、每年有定期组织旅游、聚餐、运动会等各类活动； 6、公司定期为员工提供各类培训，使员工全面发展； 7、每年一次体检； 8、享受每年普调工资制度。任职资格：1、掌握C#，ASP.NET；熟悉.NET框架，有较强的OOP思想，熟悉三层架构；2、熟悉SQL Server 2000，存储过程；3、熟悉HTML语言、CSS、Javascript等，熟悉DIV+CSS进行网页布局优先；4、能接受北京、上海、杭州、南京、天津等地区的出差", "河南省863软件孵化器有限公司", "500-2000人", "初创型(未融资)", "移动互联网", "3.4"
"拉勾", ".NET", ".NET", "8000-13000", "本科", "苏州", "3-5年", "职位描述- Bachlor degree or above- 5 years of C#/.NET development experience or above- Good at ASP.NET MVC- Good at HTML/CSS- Familiar with mordern frontend frameworks (jQuery, AngularJS, Bootstrap, etc.)- Good sense of testing- Good communicating and team lead skills- Good English speaking/listening (MUST)- Good understanding of Agile- Familiar with team collabration tools like JIRA, TFS, PivotalTracker, etc.", "北京盛安德科技发展有限公司", "150-500人", "成长型(不需要融资)", "移动互联网,企业服务", "4.3"
"拉勾", ".NET", ".NET", "10000-20000", "本科", "郑州", "5-10年", "职位描述1、本科以上学历，计算机相关专业；2、年龄30周岁以上，5年以上软件系统架构设计经验，精通构架设计的理论、实践和工具，并掌握多种参考构架、主要的可重用构架机制和模式；3、熟悉.NET或J2EE架构和主流开源架构；熟悉移动互联的设计与开发；4、有“互联网+交通”行业信息系统业务经验和架构经验者优先；5、有项目经理证，并且能将证书带到公司，具有中级以上职称者优先；6、三年以上团队管理经验，掌握CMMI3相关流程者优先。岗位职责：1.全面负责集团造价公司的市场开拓和运营；2.根据集团的战略目标，制定公司全年的工作目标及预算，并上报集团；3.具备一定的团队组建及领导能力，能够带领团队完成集团下达的经营、管理等各项指标；4.了解工程造价行业要求和从业规范，对工程造价行业有深刻认识；5.具备开拓精神和领导能力，能够根据项目进程采取不同方式，推动业务进展从而实现利润。", "河南金途科技集团有限公司", "50-150人", "初创型(未融资)", "企业服务,数据服务", "-"
"拉勾", ".NET", ".NET开发工程师", "10000-15000", "大专", "深圳", "1-3年", "职位描述工作要求：1、一年以上.Net程序开发经验；2、熟练运用C#开发，熟悉MVC开发，对面向对象编程有较深刻的理解；3、熟练掌握SQLServer的开发和应用；4、熟悉HTML5/CSS/JavaScript/JQuery等Web前端开发技术；5、具备良好的沟通合作技巧，较强的责任心及团队合作精神；6、具有较强的个人学习能力及较强的创新能力。", "广东联塑科技实业有限公司", "2000人以上", "上市公司", "生活服务", "4.4"
"拉勾", ".NET", "Asp.net 高级工程师", "15000-20000", "大专", "北京", "3-5年", "职位描述岗位职责：1、完成项目规定分配的开发任务；2、严格按公司规定的流程、标准及规范进行代码编写；3、积极负责的进行单元测试，配合完成逻辑测试，压力测试，性能调优，完善功能；4、良好的文档撰写能力。任职要求：1、熟悉.NET Framework，精通Asp.net程序设计；2、统招大专及以上学历，具有3年以上Web应用程序开发经验；3、熟悉OOD,OOP设计编程理念，熟悉MVC等设计方法；4、熟悉c#语言，熟练使用webservice，webapi；5、熟练使用sql server数据库，对数据库优化有一定的了解；6、熟练掌握HTML、JavaScript、AJAX、CSS、jquery；7、熟悉企业网站架构，有过企业级软件开发和大型网站开发经验；8、逻辑思维清晰，良好的系统设计、分析和解决问题的技巧；9、应具备强烈的责任心和团队合作精神，能承受工作压力；10、良好文档习惯和沟通技巧，对工作积极严谨；11、为人正直，工作踏实细致，身体健康。", "北京镭嘉商务服务有限公司", "15-50人", "成长型(B轮)", "移动互联网,电子商务", "3.8"
