"fromsite", "positionType", "positionName", "salary", "education", "city", "workYear", "jobDes", "company", "companySize", "financeStage", "industryField", "rate"
"拉勾", "Go", "Go语言研发工程师", "15000-30000", "大专", "北京", "不限", "职位描述职位描述:负责公司各种后台系统的各种后端服务开发。任职资格1、熟悉Linux下多线程/进程及网络开发，熟悉相关网络协议。2、现有熟悉编程语言不限，但是需要对你工作的语言扎实精通。 愿意使用或转向Golang开发，有Go开发经验优先。3、需要熟练掌握各种存储的使用，关系型、NoSQL都需要。4、有长期运行的服务器开发和运维的经验。5、高可用是必须的，所以你最好能有一定的面向异常系统的设计和架构能力。6、良好的自我驱动学习能力。", "清檬智慧健康科技有限公司", "50-150人", "成长型(不需要融资)", "其他", "-"
"拉勾", "Go", "Go高级工程师", "30000-40000", "本科", "上海", "1-3年", "职位描述        岗位职责：1. 研发基于 SOA 架构的核心业务服务；2. 研发基础平台服务相关系统，包括长连接服务、推送系统、消息队列、日志处理、数据分析等；3. 研发基于 Docker&Kubernetes 的服务系统。岗位要求：1. 精通或擅长 Go 语言，熟悉 Node.js；2. 熟悉主流 Go Web 框架设计和实现原理；3. 具有很强的学习能力、分析问题和解决问题能力、对技术有钻研精神和兴趣；4. 在 Github 上参与贡献过优秀 Go 开源项目；加分项：有大型分布式、高并发、高负载、高可用系统设计、开发和调优经验者加分。", "上海汇翼信息科技有限公司", "50-150人", "成长型(B轮)", "移动互联网,企业服务", "4.3"
"拉勾", "Go", "Go开发", "15000-30000", "本科", "北京", "不限", "职位描述工作内容：负责开发私有云PaaS平台后端服务的开发、优化和维护；参与运维自动化架构和流程的设计和开发；熟悉Docker以及分布式相关知识、新技术的研究和二次开发；招聘要求：一年以上Go语言开发经验，了解python、JavaScript、C等语言的开发；熟悉常用的web开发技术；熟悉常用的数据结构和算法；拥有大流量服务开发经验、性能调优经验者优先；熟悉常用后台开发技术，了解分布式系统基本原理；有docker、etcd、consul等相关经验者优先；熟悉运维业务和流程者优先", "北京小米科技有限责任公司", "2000人以上", "成熟型(D轮及以上)", "移动互联网", "4.1"
"拉勾", "Go", "GO工程师", "20000-30000", "本科", "北京", "1-3年", "职位描述工作职责：1、负责滴滴高可用，高并发的规则引擎2、负责滴滴统一的分单，抢单，调度服务引擎3、负责滴滴智能交通引擎——潮汐任职资格：基本要求：1、基础扎实：cc++go，网络操作系统，数据结构算法等需要过硬2、踏实靠谱，主动性强，能真正做事3、2年以上服务端开发经验，一线互联网公司背景高阶要求：1、具备架构师意识2、高负载高并发高可用架构经验3、分布式存储计算经验", "北京小桔科技有限公司", "500-2000人", "成熟型(D轮及以上)", "移动互联网", "3.5"
"拉勾", "Go", "Golang工程师", "9000-16000", "本科", "成都", "1-3年", "职位描述工作职责：1.使用go语言开发高并发系统;2.能独立或协作完成压力测试系统的设计及实现;3.能独立或协作完成大数据抓取模块的设计及实现;任职要求：1、了解Linux编程及sockets编程。用C写过多进程/多线程的网络服务程序优先；2、有高并发同/异步后端服务设计经验及分布式系统设计开发经验者优先；3、较好的网络知识，熟悉TCP/IP和常用的网络协议（HTTP,HTTPS，SMTP,IMAP等优先）；4、至少熟练掌握python, lua等一种脚本语言；", "北京网思科平科技有限公司", "50-150人", "成长型(A轮)", "信息安全,数据服务", "4.2"
"拉勾", "Go", "Go", "9000-18000", "本科", "成都", "1-3年", "职位描述工作职责：1.使用go语言开发高并发系统;2.能独立或协作完成压力测试系统的设计及实现;3.能独立或协作完成大数据抓取模块的设计及实现;任职要求：1、了解Linux编程及sockets编程。用C写过多进程/多线程的网络服务程序优先；2、有高并发同/异步后端服务设计经验及分布式系统设计开发经验者优先；3、较好的网络知识，熟悉TCP/IP和常用的网络协议（HTTP,HTTPS，SMTP,IMAP等优先）；4、至少熟练掌握python, lua等一种脚本语言；", "成都网思科平科技有限公司", "15-50人", "初创型(未融资)", "移动互联网,数据服务", "-"
"拉勾", "Go", "GoLang", "8000-15000", "本科", "南京", "不限", "职位描述核心技能：Go,C++/C, Lua高并发/并行处理/队列/任务调度相关工作经历还期望您可能具备：相关工作岗位经验;集群, Docker部署;Linux 基础;JavaScript/Node.js;内存库：Redis, mongo…;关系数据库: Postgres, MySQL...;MQ 相关: MQTT,CoAP...;会 Java/C#, 有强烈学习意愿.其他：欢迎完美主义者/小偏执狂:-)岗位职责：各种姿势 Coding;做好TDD驱动或开发者驱动测试;任务/故障跟踪和迭代;定期的代码度量/Review必要的跨部门沟通和客户沟通;", "南京以太数据科技有限公司", "少于15人", "初创型(不需要融资)", "移动互联网", "-"
"拉勾", "Go", "Go", "10000-15000", "大专", "上海", "1-3年", "职位描述工作职责:1、负责服务端架构设计；2、核心模块开发和优化, 撰写相关文档；3、参与关键技术攻克, 提供解决方案。岗位要求:1、两年以上Linux平台开发经验；2、拥有扎实的计算机基础知识和C/C++语言基础；3、熟练使用Go语言编程, 熟悉Linux环境下的编程；4、精通网络编程和多线程编程；5、熟悉SQLite或MySQL数据库应用开发；6、熟悉开源软件, 热爱技术研究；7、具有较大型、高并发、高吞吐软件架构设计和实现经验；8、学习能力强, 逻辑能力强, 沟通能力强；9、拥有较强英文文献阅读能力；10、对存储系统或操作系统内核有研究者优先考虑。", "上海够快网络科技股份有限公司", "50-150人", "成长型(B轮)", "移动互联网,企业服务", "4.0"
"拉勾", "Go", "基础平台开发工程师C/Go/Python/Java(CDN)", "20000-40000", "本科", "杭州", "不限", "职位描述阿里巴巴社招开始了！欢迎小伙伴们投简历到我们团队（阿里云-飞天技术部-Web平台），我们负责阿里巴巴Web服务器（Tengine）和CDN系统的开发。有趣，有料，有挑战。招聘信息，内推，简历可以发我邮箱: 443776148 ## qq.com，http://tengine.taobao.org/ (Tengine)，http://www.aliyun.com/product/cdn/?spm=5176.383338.201.12.7TT9jF（CDN），两大产品主页。欢迎大神丢简历过来。目前最火的视频直播技术，我们主要做视频直播平台，(https://www.aliyun.com/solution/media/live?spm=5176.8009263.277601.3.VaDRah)HTTPS/SSL: 淘宝，天猫的全站https就是出自本团队。主要编程语言C, Go, Python，Java。招聘范围涉及：视频研发方面的资深工程师，只要你会这些技术中的一项或者多项：点播，直播，编解码，缓存，转码，p2p，播放器，IOS，安卓，RTMP，FLV，HLS，协议开发，大数据，等等等。工作地点：北京，杭州都可以。阿里云-视频研发专家-CDN岗位描述：1、负责阿里云CDN视频解决方案的设计与开发，从端到端的解决视频处理与分发问题。2、设计、开发和优化视频解决方案中功能、性能、兼容性等各种问题，服务阿里云海量的视频流量，打造稳固并拥有极致用户体验的阿里多媒体处理与分发系统。岗位要求：1、至少掌握C/Java/Go等1-2种开发语言并有多媒体开发的兴趣与经验。2、有以下经验加分：熟悉视频编解码，熟悉FLV、MP4、HLS等视频格式，熟悉HTTP、RTMP、RTP等协议，研发视频点播或者直播系统，多媒体移动端开发，视频P2P分发等。3、有开源经验优先，有移动开发经验优先。4、对于互联网多媒体行业有强烈兴趣，对用户体验追求极致。5、勇于担当，敢于面对挑战和和困难，有独立解决问题的能力。6、具有深厚算法及数据结构知识优先。阿里云-系统研发专家-CDN岗位描述：1、负责阿里云CDN系统的设计与开发。2、设计、优化HTTP缓存软件、DNS服务器、负载均衡软件、调度系统等核心系统的开发与设计。3、优化CDN系统与架构以满足日益增长的阿里巴巴集团的流量、性能、成本要求。4、直接参与到系统设计和核心代码开发。岗位要求：1、3年以上系统软件开发工作经验。2、精通Linux系统、C/C++语言、HTTP协议。3、精通高性能服务器编程采用的核心技术，如IO处理、多线程。4、有CDN系统开发经验者优先。5、熟悉HTTP缓存服务器（如Squid、Varnish、TrafficServer等），有分析其代码实现或模块编写经验者优先。6、具有深厚算法及数据结构知识优先。7、开源社区成员优先阿里云CDN是国内领先的CDN研发团队，团队致力于研发稳定、高效、易用、低成本的CDN系统，基于阿里巴巴强大的网络基础设施将海量内容高效分发给互联网终端用户。目前阿里云CDN有超过500个节点，20T以上带宽，节点覆盖6大洲，所支持的业务不仅包括阿里集团所有的业务，如淘宝、天猫、支付宝、CBU、ICBU的网站加速，同时，阿里云CDN也以云产品的形式，对国内外云计算的海量客户提供优质的加速服务。", "阿里云计算有限公司", "2000人以上", "上市公司", "电子商务,企业服务", "4.8"
"拉勾", "Go", "Go/golang/Go语言", "10000-15000", "大专", "北京", "1-3年", "职位描述要求：1.精通Java/Erlang/Golang/C++/Python/Lua/其中一种，有函数式编程经验加分2.熟悉Redis等Nosql设计理念3.计算机基础和算法基本功扎实4.亲自设计过服务器架构者加分5.熟悉TCP协议", "北京逍遥天地科技文化有限公司", "15-50人", "成长型(A轮)", "游戏", "4.0"
"拉勾", "Go", "高级|资深Go系统研发工程师", "13000-25000", "本科", "厦门", "不限", "职位描述我们做什么？1. 负责高性能的核心基础业务和基础系统研发我们拥有什么？成员来自国内一线互联网公司的核心岗位，并且也都经历过从产品发展初期到成长为国内非常有影响力的产品的阶段，对于构建高并发、高可用和具有海量数据的互联网在线系统有非常丰富的实践经验，并作为讲师参加过国内最大的技术大会及其业界各种技术沙龙。团队崇尚技术分享和讨论氛围，崇尚精英文化，并有配套的传帮带机制，以成员的成长为团队建设重点。美图作为当前国内发展非常迅速的公司，系统面临的挑战越来越大，期望你能一起来应对这些挑战，并一起努力把团队打造为国内有影响力有活力的技术研发团队。工作地点和待遇情况：由于公司总部在厦门，期望能在厦门工作，这里拥有帝都的技术班底和技术氛围，成员也是来自帝都一线互联网团队的核心岗位，来这里也还是可以像是在帝都一样工作，主要区别是出门发现原来还有蓝天白云大海。当然也可以考虑在北京研发中心工作待遇范围在13k - 25k，能力出众的待遇可以再面谈，快速成长的业务及其富有经验的技术团队，相信无论是对于经验丰富的你还是期望能快速成长的你，都会有很大的帮助期望你是这样的：1、三年以上Java或C/C++研发经验，一年以上Go研发经验2、熟悉网络编程技术，对构建高并发高性能服务有深入研究3、具有技术钻研精神，追求完美，并具有较强自驱学习能力4、有大中型互联网系统设计或开发经验者优先5、开源爱好者优先，提供github源码者优先，提供技术博客者优先 【丰厚的福利待遇】工资奖金 —— 高于业内水平多种激励 —— 季度、年度评优，项目奖、建议奖、人才推荐奖、专利基金等社会保险 —— 按厦门市规定为每个员工缴纳养老保险、医疗保险、失业保险、工伤保险、生育保险公 积 金 —— 为每位员工缴纳公积金落户厦门 —— 为符合厦门市人事局落户条件的人员办理厦门落户事宜带薪年假 —— 享受国家规定的带薪年休假上班时间 —— 弹性工作制，5天7个半小时，按照国家规定实行假期制度班车接送 —— 上班提供沿线班车，下班有班车补贴员工活动 —— 旅游，聚餐，K歌，看电影，每周羽毛球，拓展，中秋搏饼，年终尾牙…你能想到的，都能组织；每月还有丰厚的部门活动经费培训分享 —— 每周安排专业培训或分享，一起学习提高员工生日 —— 公司赠送生日蛋糕，生日书，生日礼物各种茶点 —— 公司内点心、奶茶、咖啡无限量供应；每日午后有新鲜水果提供；根据天气变化不定期提供热汤、冰饮、小蛋糕等我们，拥有上亿用户，是国内顶尖的图片服务平台。天使投资人蔡文胜和CEO吴欣鸿是我们的联合创始人；我们，是厦门少有的产品氛围融洽的公司。年轻，创造，进步，是我们一直以来的keywords；我们，是一群执着于梦想的人，是怀着理想主义在做产品的Geek。梦想和工作，并肩而行；我们，是美图网，在寻找，和我们一样的你。 ", "厦门美图之家科技有限公司", "500-2000人", "成熟型(C轮)", "移动互联网,硬件", "4.1"
"拉勾", "Go", "Docker/Go开发工程师", "15000以上", "本科", "上海", "1-3年", "职位描述工作职责:基于Docker开源社区，开发高可靠自动化的云计算平台职位要求：掌握基础的计算机专业知识，如Linux，网络，数据库，操作系统等对新兴事物有强烈的好奇心，有将最新的技术转化为产品的热情有与人沟通的能力，乐意分享，敢于承诺日常工作中熟练掌握并使用(Go, Java, C++)至少一种编程语言，熟悉Go语言者有加分，参与过开源项目者有加分工作地点：上海", "星环信息科技（上海）有限公司", "150-500人", "成长型(B轮)", "数据服务", "4.3"
"拉勾", "Go", "基础平台开发工程师C/Go/Python/Java(CDN)", "20000-40000", "本科", "北京", "不限", "职位描述阿里巴巴社招开始了！欢迎小伙伴们投简历到我们团队（阿里云-飞天技术部-Web平台），我们负责阿里巴巴Web服务器（Tengine）和CDN系统的开发。有趣，有料，有挑战。招聘信息，内推，简历可以发我邮箱: 443776148 ## qq.com，http://tengine.taobao.org/ (Tengine)，http://www.aliyun.com/product/cdn/?spm=5176.383338.201.12.7TT9jF（CDN），两大产品主页。欢迎大神丢简历过来。目前最火的视频直播技术，我们主要做视频直播平台，(https://www.aliyun.com/solution/media/live?spm=5176.8009263.277601.3.VaDRah) HTTPS/SSL: 淘宝，天猫的全站https就是出自本团队。主要编程语言C, Go, Python，Java。招聘范围涉及：视频研发方面的资深工程师，只要你会这些技术中的一项或者多项：点播，直播，编解码，缓存，转码，p2p，播放器，IOS，安卓，RTMP，FLV，HLS，协议开发，大数据，等等等。工作地点：北京，杭州都可以。阿里云-视频研发专家-CDN岗位描述：1、负责阿里云CDN视频解决方案的设计与开发，从端到端的解决视频处理与分发问题。2、设计、开发和优化视频解决方案中功能、性能、兼容性等各种问题，服务阿里云海量的视频流量，打造稳固并拥有极致用户体验的阿里多媒体处理与分发系统。岗位要求：1、至少掌握C/Java/Go等1-2种开发语言并有多媒体开发的兴趣与经验。2、有以下经验加分：熟悉视频编解码，熟悉FLV、MP4、HLS等视频格式，熟悉HTTP、RTMP、RTP等协议，研发视频点播或者直播系统，多媒体移动端开发，视频P2P分发等。3、有开源经验优先，有移动开发经验优先。4、对于互联网多媒体行业有强烈兴趣，对用户体验追求极致。5、勇于担当，敢于面对挑战和和困难，有独立解决问题的能力。6、具有深厚算法及数据结构知识优先。阿里云-系统研发专家-CDN岗位描述：1、负责阿里云CDN系统的设计与开发。2、设计、优化HTTP缓存软件、DNS服务器、负载均衡软件、调度系统等核心系统的开发与设计。3、优化CDN系统与架构以满足日益增长的阿里巴巴集团的流量、性能、成本要求。4、直接参与到系统设计和核心代码开发。岗位要求：1、3年以上系统软件开发工作经验。2、精通Linux系统、C/C++语言、HTTP协议。3、精通高性能服务器编程采用的核心技术，如IO处理、多线程。4、有CDN系统开发经验者优先。5、熟悉HTTP缓存服务器（如Squid、Varnish、TrafficServer等），有分析其代码实现或模块编写经验者优先。6、具有深厚算法及数据结构知识优先。7、开源社区成员优先阿里云CDN是国内领先的CDN研发团队，团队致力于研发稳定、高效、易用、低成本的CDN系统，基于阿里巴巴强大的网络基础设施将海量内容高效分发给互联网终端用户。目前阿里云CDN有超过500个节点，20T以上带宽，节点覆盖6大洲，所支持的业务不仅包括阿里集团所有的业务，如淘宝、天猫、支付宝、CBU、ICBU的网站加速，同时，阿里云CDN也以云产品的形式，对国内外云计算的海量客户提供优质的加速服务。", "阿里云计算有限公司", "2000人以上", "上市公司", "电子商务,企业服务", "4.8"
"拉勾", "Go", "Go /Golang 工程师（后台开发）/架构师", "20000-40000", "本科", "北京", "3-5年", "职位描述职责：1、负责滴滴各种后台系统的设计、开发、维护要求：1、熟悉Linux下多线程/进程及网络开发2、语言不限，只要你确认你认真学好了一门你常用的语言（有C/C++经验更好），但愿意使用或转向Golang开发，有Go开发经验优先3、需要熟练掌握各种存储的使用，关系型、NoSQL都需要4、需要你有一定的运维经验，开发出运维友好的系统&能及时处理线上疑难杂症5、高可用是必须的，所以你最好能有一定的面向异常系统的设计和架构能力", "北京小桔科技有限公司", "500-2000人", "成熟型(D轮及以上)", "移动互联网", "3.5"
"拉勾", "Go", "Golang工程师", "8000-15000", "本科", "西安", "3-5年", "职位描述岗位职责：1、负责公司产品的后端服务迭代开发。2、能够和其他同事紧密合作，乐于向团队分享技术经验和项目经验。任职要求：1、计算机或相关专业本科以上学历， 1-5年后端开发经验，1年以上 golang 开发经验。2、熟练使用 Linux 操作系统，有 Linux 下编程的经验。3、熟悉网络应用开发和 RESTful API 开发。4、熟悉 MySQL/MongoDB/Redis/RabbitMQ5、熟练使用 git，熟悉项目自动化测试和构建。有解决问题和钻研新技术的兴趣和能力。6、具有良好的沟通和表达能力，注重团队的合作。具有以下条件者优先录取：1、拥有 github 账号，有独立项目或对开源社区做过贡献。2、拥有技术博客或公众号，经常分享自己的技术经验。3、有过微服务架构实践经验或完善的 Restful API 设计和开发经验。4、了解 javascript ，使用过 React 等流行的前端框架。5、熟悉 Docker/Nginx/Consul/Jenkins 。", "西安圣点世纪科技有限公司", "150-500人", "上市公司", "移动互联网", "4.7"
"拉勾", "Go", "golang程序员", "15000-25000", "不限", "北京", "1-3年", "职位描述北京创业团队现招golang,js技术研发和实习生职位1：技术研发招收golang、js开发了，要求工作3年以上，良好基础知识,精通golang或js开发，熟练掌握各种常用加密算法，常用数据结构；开源贡献者优先， github 源码者优先，技术博客者优先；掌握golang的同时还掌握其他一门或多门语言（如python、c++、java）的加分。精通javascript开发，熟悉nodejs的优先，熟悉Angularjs的优先。对分布式相关理论和系统有研究者优先具有技术钻研精神，追求完美，并具有较强自驱学习能力薪酬：10k-20k每月。另招收在校实习生，计算机专业，懂golang优先，有开源项目经验优先", "北京魔镜科技有限公司", "15-50人", "初创型(天使轮)", "金融,数据服务", "-"
"拉勾", "Go", "\u200bGolang开发工程师", "20000-30000", "本科", "北京", "1-3年", "职位描述Golang开发工程师工作内容：1）负责CDN分发网络中调度、缓存、监控等核心系统的设计和研发；2）负责上传加速网络的设计与研发；3）负责网络加速中一些新技术的设计与研发；技能要求：1）有Hacker精神；2）非常熟悉C/C++/Go至少一门编程语言；3）熟悉TCP/IP协议簇，有较丰富的网络编程经验；或熟悉缓存/存储系统；4）有CDN经验者优先；5）有大型互联网后端服务器系统设计开发经验者优先；职位简述：base在北京，工作地点：太阳宫大厦；这里有一批醉心于技术、有丰富CDN经验的伙伴期待你的到来！", "上海七牛信息技术有限公司", "150-500人", "成熟型(D轮及以上)", "移动互联网,数据服务", "4.2"
"拉勾", "Go", "系统开发工程师（C/C++/Go）", "6000-8000", "不限", "合肥", "1-3年", "职位描述对软件开发工作有兴趣,有计算机科学相关理论基础。两年以上系统软件（Linux或Windows）开发经验。熟悉操作系统原理及计算机体系结构。了解Lua、Go、JAVA、Python中的一种语言。熟悉Linux或Unix类操作系统环境。熟悉Linux下系统编程（C/C++/Go）踏实、易沟通有良好的团队意识.无两年以上开发经历者请转投《软件开发工程师职位》注： 此职位无学历限制，实验室项目、公司项目和个人开源项目均算作同等开发经历。", "深圳市英莱合创电子有限公司", "15-50人", "成长型(A轮)", "硬件,数据服务", "4.7"
"拉勾", "Go", "后端开发工程师 PHP JAVA GO PYTHON（交易行情）", "15000-30000", "本科", "上海", "3-5年", "职位描述程序猿要不要加入华尔街见闻？如今，说一个人是程序猿，能联想到的就是互联网泡沫、闷骚、宅…….在诸多HR和老板的眼中，程序猿就是个要价高而流动性特别大的生物。在其他部门同事眼中，程序猿就是一群没法沟通的非人类。其实我们程序猿谁不是在拿绳命撸码呢？而程序猿的最高境界，私以为是虽然人已经走了，但是他的代码却依然活着。。。唯一能确认的是，我们都还不想走。需求看似这么简单，程序写起来就是这么难。我们，是华尔街见闻，不是BAT，但有一群互联网大牛。我们是谁华尔街见闻是移动互联网时代下，财经资讯领域的佼佼者，未来的独角兽。及时、专业是我们的特色。全网日活已过百万。未来，我们会形成金融产品矩阵，覆盖上亿金融人群。我们需要需要代码风骚BUG率低的程序猿！拥有知名互联网公司撸码经验，想早日实现财务自由解甲归田的你，发一份简历给我，好吗？我们需要你拥有知名互联网公司撸码经验，老板在的时候，双手飞速撸码。一个人在星巴克，镁铝走过的时候，一手撸码，一手喝着星巴克。高并发，千亿级用户项目在你的手下撸出“快”感，撸出精彩。我们能提供你负责勇撸代码，老板负责发放软妹币。弹性工作，对“八阿哥”负责，实在没办法就把“八阿哥”掰弯。忙时忘记时间，闲时吹牛感慨。不勾心斗角，不无所事事，欢快时和领导斗嘴，郁闷时和同事喝酒。上天，入地，大把赚钱。大神指导炒股，刚领的工资说翻就翻。来吧！我们一起陪你耍。我们对后端开发攻城狮的要求本科及以上学历，计算机、软件工程或相关专业；熟悉Linux/Unix系统、精通Java,pythongolang,或者C/C++编程语言等其中一门语言；精通网络编程、多线程编程；精通数据库系统,有sql或者nosql开发经验；专业知识面广，热爱技术工作，具有钻研精神，责任心强；具有良好的团队合作精神和积极主动的沟通意识；熟悉证券行业券商接口、有相关工作经验者优先考虑；熟悉CTP,FIX,IB等接口协议优先考虑；具备证券交易策略、量化分析相关工作经验者优先考虑；你会负责主要方向：稳定、高并发、高访问频率、高效、高可用、易扩展的证券交易系统，风险控制系统；负责股票，外汇，基金交易系统的设计和编码工作；负责交易系统模块结构和流程逻辑的设计和优化。薪资福利业内相当有竞争力薪资福利优秀员工16-20薪只要你靠谱，期权不远，涨薪很近请在简历中附带 github账号或者个人技术博客地址，这是必填项", "上海阿牛信息科技有限公司", "50-150人", "成长型(B轮)", "金融,移动互联网", "4.0"
