"fromsite", "positionType", "positionName", "salary", "education", "city", "workYear", "jobDes", "company", "companySize", "financeStage", "industryField", "rate"
"拉勾", "Go", "golang高级开发工程师", "12000-24000", "本科", "上海", "3-5年", "职位描述工作职责：1. 采用Go语言(Golang)开发稳健可扩展的后端程序；2. 通过单元测试、自动化以及代码审查等提升优化代码质量；3. 积极参与各种头脑风暴会议并对用到的技术、算法和产品功能提出意见和建议；4. 同产品和设计团队协作，理解用户需求，归纳功能用例，并转化为高效的技术解决方案；5. 重点及难点技术攻坚，并按时交付研究成果。任职资格：1. 2-5年的实际项目开发经验；2. 本科及以上学历，计算机相关专业，全面的计算机理论基础，综合能力较强者可降低学历要求；3. 具备按时完成项目开发与交付的能力；4. 工作认真负责有责任心，追求细节和极致，有解决各类疑难问题的强烈愿望；5. 具备扎实的相关软件开发技能，能根据架构要求，开发设计可扩展、可复用、高性能的功能模块；6. 具备网络编程知识的实际应用和优化经验，能始终保持对新技术的学习热情；7.具备LinuxUnix平台下的编程和操作经验，熟悉一种或者多种脚本语言(Python, Perl, Shell等)。", "上海优刻得信息技术有限公司", "500-2000人", "成熟型(C轮)", "数据服务", "3.9"
"拉勾", "Go", "Golang开发工程师", "10000-20000", "本科", "北京", "1-3年", "职位描述岗位职责：负责Docker的搭建与内部推广负责CDN管理系统API接口编写、数据分析工作。负责运维自动化中状态回收、监控统计获取，相关处理程序编写。参与CDN业务处理逻辑的设计与架构优化。任职要求：精通Golang;熟悉Docker及其生态圈;至少1年以上运维经验，代码清晰规范；熟悉Perl/Python者优先;熟悉HTTP协议、TCP/IP常用网络协议；", "北京快网科技有限公司", "150-500人", "上市公司", "移动互联网,数据服务", "4.7"
"拉勾", "Go", "Golang服务端开发工程师", "10000-20000", "本科", "北京", "1-3年", "职位描述工作职责:参与移动端社交app项目服务端的开发职位要求:1. 熟练使用Linux操作系统2. 一年以上服务端工作经验3. 基础算法，数据结构知识扎实4. 对go语言有一定了解，对处理并发，内存管理有自己的见解5. 了解TCP/IP，HTTP， Websocket6. 熟悉数据库mySQL，Redis；7. 熟悉Git等版本控制管理工具；8. 有责任心,良好的团队协作能力和学习能力加分项:1. 开发过高并发系统(C++/Nodejs/golang)2. 开发过大型互联网系统", "北京炬鑫网络科技有限公司", "50-150人", "初创型(天使轮)", "移动互联网,社交网络", "4.1"
"拉勾", "Go", "系统研发C、golang工程师", "6000-8000", "本科", "宁波", "1-3年", "职位描述岗位职责：负责网关和服务器程序的开发、升级、维护工作（需要学习GOLANG，前期可指导）任职要求：1、熟练使用C、C++、Object-C,C#、GOLANG、JAVA其中一种，熟练使用SQLite、MYSQL，熟悉PostgreSQL、Oracle、MongoDB等常见数据库者优先，熟悉Hadoop、Docker、Memcache、Redis者优先,熟悉LINUX；2、本科及以上学历，软件工程、计算机、电子信息等相关专业；3、1年以上工作经验，有过成熟项目的开发经验；4、精通互联网开发技术，对互联网行业背景有深刻了解；5、学习能力强，能在短时间内满足岗位需求。", "宁波星宏智能技术有限公司", "50-150人", "初创型(天使轮)", "硬件", "3.8"
"拉勾", "Go", "高级Golang工程师", "12000-20000", "大专", "成都", "1-3年", "职位描述工作职责：1. 设计和实现平台级互联网软件系统的部分模块。2. 参与平台级系统的架构设计。3. 负责相关系统和模块的运行的稳定和持久。4. 可指导普通工程师的设计和编码。基本任职要求：1. 计算机或数学相关专业专科及以上学历，从事互联网软件开发工作2~5年。2. 有较丰富的互联网应用系统设计和实现经验，可独立进行系统模块的功能分析和设计实现。3. 主动积极，善于学习和总结，乐于分享，有较强的团队精神。4. 基础扎实，熟悉常用数据结构和算法，了解主流的分布式系统设计概念和算法。5. 熟悉Go语言，或者熟悉其他（Java或PHP）编程语言并愿意从事Go程序开发工作。加分项：1. 对高并发、高可用的互联网软件系统有正确、深刻的理解。2. 熟悉消息系统和PUSH服务的构建方法。3. 熟悉网络爬虫系统的构建方法。4. 熟悉开放平台的构建方法，以及开放开发规范。", "北京微赛时代体育科技有限公司", "150-500人", "成长型(A轮)", "移动互联网,文化娱乐", "4.5"
"拉勾", "Go", "GO语言", "15000-25000", "本科", "上海", "3-5年", "职位描述职位描述：1.负责系统分析、架构设计和技术研究等关键性工作；2.负责核心组件、通用组件的开发和持续优化；3.负责服务治理架构和运维保障系统的研发；4.为项目和项目组成员提供技术支持和指导。任职要求：1.熟练使用Go语言，熟练使用gorouting和channel等Go核心工具，熟练使用Revel或beego；2.熟悉MySQL、Redis，熟悉数据库设计和优化；3.熟悉TCP、HTTP等网络协议；4.熟悉Linux系统，熟悉常用命令；5.熟悉javascript,boostrap等；6.开源爱好者优先，提供github源码者优先，提供技术博客者优先。", "微鲸科技有限公司", "500-2000人", "成熟型(不需要融资)", "移动互联网", "4.2"
"拉勾", "Go", "Go", "10000-20000", "本科", "成都", "3-5年", "职位描述岗位职责：1.使用Go语言开发游戏服务器端功能；2.与客户端开发团队紧密配合，完成项目具体需求；3.维护服务器系统，解决服务器问题。 岗位要求：1.有两年以上网络游戏服务器开发经验；2.熟悉go，mongo，php优先；3.有成功上线项目经验者优先；4.具有良好的团队合作精神，逻辑思维能力强，善于沟通。", "成都沙漏科技有限公司", "15-50人", "初创型(天使轮)", "游戏,文化娱乐", "-"
"拉勾", "Go", "后端研发工程师(PHP/Python/Golang/Java/C++)", "9000-15000", "本科", "广州", "1-3年", "职位描述办公地理位置：广州大学城（有客村、车陂南往返班车接送）岗位职责：1.基础系统架构、模块研发；2.公共基础库维护；3.海量数据处理；4.数据系统优化。任职要求：1.熟练使用Golang/C/C++/Java/Python/PHP等一种或以上语言；2.熟悉基于TCP/UDP/HTTP协议的网络编程；3.熟悉Linux下编程和操作经验，且相关的各类技术情有独钟；4.熟练使用各种数据库存储，并且能够进行调；5.熟练使用各种团队协作工具（Wiki，Git，BugTracker）；6.具有良好的算法数据结构基础，在各类计算机相关竞 赛中 获奖者优先；7.有大规模、高性能互联网网站系统相关的设计和开发经验者优先。", "有米科技股份有限公司", "150-500人", "上市公司", "移动互联网,广告营销", "3.8"
"拉勾", "Go", "Go", "15000-30000", "本科", "北京", "1-3年", "职位描述岗位职责采用Go语言（Golang）开发稳健、可扩展的后端程序负责研发产品的文档编写、维护至少精通C/C++、PYTHON,GO, 中的一种语言，有3年以上该语言的开发经验具备关系型数据库mysql等数据库相关知识的实际应用经验具备TCP/UDP,HTTP网络编程, 了解RESTful API等相关技术有自己的开源项目或者作为核心成员参与过其他开源项目者优先熟悉基于Git的团队合作开发模式熟悉Linux系统的运行机制及系统调用具有技术钻研精神，追求质量，具有较强自驱学习能力参与过大型分布式/服务器系统的架构和开发， 并在项目中起核心作用", "北京博晨技术有限公司", "少于15人", "初创型(天使轮)", "企业服务", "-"
"拉勾", "Go", "Golang工程师", "15000-25000", "本科", "北京", "3-5年", "职位描述工作内容： 主要：Go语言应用探针研发次要：公司后端架构中Go语言微服务的开发和维护次要：听云Controller CDN项目Go语言服务开发和维护 技能要求： 精通C/C++/Golang至少一种语言开发 熟悉TCP/IP协议，有网络编程经验 熟悉系统和代码性能优化 有探索精神，有较学习能力和热情", "北京基调网络股份有限公司", "150-500人", "上市公司", "移动互联网,数据服务", "3.5"
"拉勾", "Go", "核心服务研发工程师(go/java/c)", "15000-30000", "本科", "北京", "1-3年", "职位描述岗位职责：1、根据功能说明书完成模块级软件的设计；2、负责系统的编码实现、调试与性能优化；3、C/C++/golang 子系统开发部署及子模块单元、集成测试。任职要求：1、计算机相关行业本科以上学历，1 年以上 C/C++ 软件开发经验；2、具有很强的分析、解决问题能力，熟悉虚拟化相关技术者优先；3、良好的沟通能力和团队协作精神。4、有一定的网络服务开发经验", "百度外卖", "500-2000人", "成长型(B轮)", "O2O,生活服务", "4.1"
"拉勾", "Go", "Go语言开发师", "8000-10000", "本科", "杭州", "不限", "职位描述岗位职责：1、负责公司应用后端服务开发与集成，负责服务端业务实现。2、独立负责完成项目模块的设计、编码及相关文档编写，解决开发中的技术问题；3、参与产品后台管理系统的设计与开发工作4、采用Go语言（Golang）开发稳健、可扩展的后端程序；5、参与 Web 应用系统的架构设计和实现。任职要求：1、大学本科学历，计算机专业，扎实计算机专业基础，熟悉常用的数据结构与算法；2、熟悉tcp/ip协议并能进行有网络开发经验，熟悉http开发；3、熟悉Go语言，熟悉shell或者python脚本并能在Linux环境进行开发；4、熟练使用Go语言，开发过成熟产品；", "杭州宇为科技有限公司", "15-50人", "初创型(天使轮)", "数据服务,移动互联网", "4.3"
"拉勾", "Go", "Go工程师", "7000-12000", "本科", "厦门", "不限", "职位描述岗位职责：1.采用Go（Golang）语言开发稳健的后端程序；2.负责Go相关的开发工作；3.根据开发进度和任务分配，完成相应模块的设计、开发、编程任务；任职要求：1、熟悉Go语言2、熟悉REST API设计和开发3、熟悉主流Web框架，了解框架设计和实现原理4、熟悉分布式系统的设计和开发，对系统高可用有一定经验5、熟悉MongoDB和Redis6、熟悉Linux系统及常用命令", "深图（厦门）科技有限公司", "15-50人", "初创型(天使轮)", "移动互联网,数据服务", "4.3"
"拉勾", "Go", "滴滴账号高级工程师/架构师(golang语言）", "15000-30000", "本科", "北京", "3-5年", "职位描述【Passport高级工程师、架构师】【工作职责】1、滴滴帐号平台的设计和开发，参与需求定义，确定设计方案并负责最终实现；2、负责项目的整体架构；3、负责辅导工程师。【职位要求】1、熟练掌握C、C++、java、python等语言，熟悉golang将是很大的加分项，我们未来的开发将以golang为主；2、有丰富的工作经验，能够独立主导要求对自己做的项目有自己深入的理解，并能持续的关注和优化自己做的项目，研究过优秀开源软件的源码并有心得者优先；3、精通MySQL应用开发，熟悉数据库原理和常用性能优化技术，以及NoSQL原理、使用场景以及限制；4、熟悉常用的互联网技术，包括但不限于RPC、MQ、缓存技术、调用策略等；5、参与过大型复杂分布式互联网系统的设计、架构者优先；6、有较强的逻辑思维能力，善于分析、归纳、解决问题；能够独立或带队进行项目开发；7、对帐号系统、帐号安全有实际经验者优先。", "北京小桔科技有限公司", "500-2000人", "成熟型(D轮及以上)", "移动互联网", "3.5"
"拉勾", "Go", "Golang服务端开发工程师（高级）", "15000-30000", "本科", "北京", "3-5年", "职位描述工作经验要求： 1、设计、开发过大型互联网系统 2、能够进行性能评估及优化 3、能够在大型系统中进行错误分析和处置 4、设计、开发过高并行系统 5、具有后端开发经验，语言如下：PHP，C/C++，nodejs等  个人要求： 1、良好的计算机科学基础知识（数据结构，算法等），出色的编码能力 2、熟悉大规模互联网系统，了解系统底层 3、了解大规模系统的性能和可扩展性 4、良好的沟通能力", "北京炬鑫网络科技有限公司", "50-150人", "初创型(天使轮)", "移动互联网,社交网络", "4.1"
"拉勾", "Go", "后端研发（PHP/Python/C/C++/Golang）！！！", "10000-20000", "本科", "广州", "1-3年", "职位描述办公地理位置：广州大学城（有客村、车陂南往返班车接送）如果您不是技术牛人，我们把您打造成为技术牛人。。。如果您是技术牛人，我们需要您，做什么，来了就知道。。。职位描述:工作职责：负责移动广告产品功能开发参与移动广告平台的相关算法和模型的开发与优化处理海量请求，打造高性能、高可用的后端服务深入研究存储系统，支撑海量数据存储研究计算广告学，优化广告投放策略，提高广告投放精准度任职要求：1、熟练使用PHP/Python/C/C++/Golang，会一种或以上后端编程语言2、熟悉基于TCP/UDP/HTTP协议的网络编程 ，具有Linux下编程和操作经验4、熟练使用各种数据库存储，并且能够进行调优5、熟练使用各种团队协作工具（Wiki，Git，BugTracker）6、熟悉常用数据结构和算法7、有高并发，高性能系统开发经验加分项：互联网广告平台ACM赛区省级以上银牌获得者提供您自豪的github开源项目处理高并发、分布式系统等经验名校名企灰常有“个性的”。。。", "有米科技股份有限公司", "150-500人", "上市公司", "移动互联网,广告营销", "3.8"
"拉勾", "Go", "技术经理（Java/Go/Scala）", "30000-55000", "本科", "北京", "5-10年", "职位描述技术经理/架构师岗位职责ü 负责互联网金融相关产品后台服务的设计和开发；ü 对团队成员进行有效的指导，增强团队技术能力。任职资格ü 计算机或相关专业本科及以上学历；ü 精通精通Java或者Go、Scala等语言, 5年以上开发经验，有大型分布式高性能开发的优先或服务器端的开发经验者优先；ü 有web应用系统设计经验和一定的数据库设计优化能力；ü 扎实的数据结构及算法基础，理解面向对象设计的基本原则，熟悉常用的设计模式；ü 优秀的学习能力，分析和解决问题的能力和强烈的进取心；ü 诚恳、踏实，对技术和工作充满热情；ü 具备良好的沟通能力和团队合作精神。", "普信恒业科技发展（北京）有限公司", "2000人以上", "上市公司", "移动互联网,金融", "3.9"
"拉勾", "Go", "手机百度--Go高级研发工程师", "15000-30000", "本科", "北京", "3-5年", "职位描述岗位职责：-负责公司通讯产品服务器端开发及维护-根据产品需求，高质量完成设计开发职位要求：-本科及以上学历-具有golang服务器端1年以上开发经验，有C/C++服务器开发经验优先-拥有扎实的计算机编程能力，软件设计方面有较好的功底-熟悉linux系统使用及原理；并作为主要工作开发环境-熟悉TCP/IP、HTTP-熟悉mysql，mongodb，redis相关知识及实际应用-具有分布式系统设计开发经验者优先-具备中等规模项目实际开发经验-具有良好的编码风格和团队协作精神-工作认真负责有责任心,有解决各类疑难问题的愿望及能力", "百度在线网络技术（北京）有限公司", "2000人以上", "上市公司", "移动互联网,数据服务", "3.9"
"拉勾", "Go", "Golang辅导老师（兼职）", "4000-6000", "不限", "北京", "1-3年", "职位描述职位描述：1.负责Golang职业学院学生的作业批改工作；2.采用视频＋语音的形式，在线完成（录播形式，非远程在线解答）；3.抢单模式，利用碎片时间抢单批改；4.试用期一个月，至少完成10个作业的批改。任职要求：1.熟悉C/C++语言，精通Go语言，至少两年以上Go语言项目实际开发经验；2.熟悉主流Go语言下的Web框架，了解框架设计和实现原理；3.熟悉MySQL、MongoDB和Redis等数据库并精通其一；4.熟悉HTML、CSS、JavaScript，有前端开发经验者优先；5.对短链接服务、微服务、Beego应用框架、Docker等有了解者优先；6.熟悉基于Golang的网络游戏开发者优先。成为Golang兼职老师，你将收获：1．丰厚报酬，积极参与轻松月入5000+；2. 自我提升，免费学习极客学院官网上的VIP课程；3. 包装宣传，增加实战教练曝光度，扩大影响力；4. 晋升空间，达到相关标准可成为极客学院兼职布道师；5. 额外福利，饱含爱心的生日红包和节日礼品。懂技术、爱分享，欢迎这样的你来极客学院一试身手", "北京易联致远无线技术有限公司（EOE-最大的android社区）", "50-150人", "成长型(B轮)", "移动互联网", "4.0"
"拉勾", "Go", "go语言开发实习生", "3000-6000", "大专", "杭州", "应届毕业生", "职位描述职责：1.实现各种平台级软件系统和业务系统。2.设计或辅助设计相关系统的架构。3.负责和保证相关系统的稳定、持久运行。4.独立解决相关系统的技术问题。5.忠于开源6,.对分布式有一定了解要求：1.计算机或数学相关专业大专及以上学历。2.期望从事互联网软件开发工作。3.主动积极，善于学习和总结，乐于分享，有较强的团队精神。4.基础扎实，熟悉常用数据结构和算法。5.熟悉Go语言，或者熟悉其他（C++，Java或PHP）编程语言并愿意从事Go程序开发工作。6.有接触过开源代码并能够修改开源代码", "杭州曼线科技有限公司", "少于15人", "初创型(未融资)", "移动互联网,硬件", "4.0"
"拉勾", "Go", "Go语言开发", "15000-25000", "大专", "深圳", "1-3年", "职位描述职责：1 设计和实现各种平台级软件系统和业务系统。2 设计或辅助设计相关系统的架构。3 负责和保证相关系统的稳定、持久运行。4 独立解决相关系统的技术问题。要求：1 计算机或数学相关专业本科以上学历。2 从事互联网软件开发工作2~3年。3 有一定的互联网分布式系统设计和实现经验。4 主动积极，善于学习和总结，乐于分享，有较强的团队精神。5 基础扎实，熟悉常用数据结构和算法。6 熟练使用Go语言7 对高并发、高可用的互联网软件系统有正确、深刻的理解。", "深圳云帆加速科技有限公司", "50-150人", "成长型(A轮)", "移动互联网,数据服务", "4.3"
"拉勾", "Go", "Go语言开发工程师", "15000-25000", "本科", "北京", "1-3年", "职位描述注意：公司地址：北京市朝阳区将台西路18号皮革大厦（地铁14号线将台站）公司只招聘国家承认学历的正规本科毕业生（学信网可查）岗位职责：1.基于GO语言的分布式文件系统技术的研究及开发；2.基于GO语言的区块链系统技术的研究及开发。任职要求：1.熟悉golang语言编程，掌握socket、HTTP等相关技术；2.熟悉TCP、UDP协议，了解p2p,ice,区块链相关技术；3.计算机相关本科或者以上学历，2-5年工作经验；4.责任心强，具备良好的团队合作精神和承受压力的能力。", "北京广密华安科技有限公司", "15-50人", "成长型(B轮)", "信息安全", "-"
"拉勾", "Go", "Go 服务器端开发工程师", "12000-18000", "大专", "上海", "1-3年", "职位描述岗位职责：1.负责手机游戏后端系统的开发2.能够独立完成部分游戏功能模块的开发任职要求：1、全日制专科及以上学历，计算机相关专业毕业.2、熟练掌握Go语言，对代码基本规范有清晰的认识，1年以上Go语言项目开发经验.3、有丰富的UNIX/Linux环境下的编程经验，熟悉多线程进程及网络开发.4、熟悉Tcp/ip协议栈、HTTP等网络协议.5、精通Redis、MySQL、Linux，并在其环境下开发.6、必须具备游戏服务端开发经验，有C,PHP开发经验优先。7、深入理解计算机网络和现代操作系统.8、对服务端相关技术和架构（通讯、计算、存储）有较深刻的理解.9、有良好的编程习惯，包括好的设计文档，单元测试，代码审查.10、有大规模分布式项目, 高性能大并发项目经验优先。            ", "上海游墨网络科技有限公司", "15-50人", "成长型(A轮)", "移动互联网,游戏", "3.3"
"拉勾", "Go", "高级golang工程师", "13000-26000", "本科", "深圳", "5-10年", "职位描述岗位职责：对现有后台架构进行重构、优化制定开发规范、参与制定技术标准，编写相应技术文档根据业务规划，制定技术规划及架构方案解决项目中关键架构问题和技术难题，负责项目中关键技术难点的攻关和预研，对开发团队进行技术指导和培训具备较强的逻辑思维和沟通技巧，为技术团队提供可行的、富有成效的、前沿的架构方案岗位要求：熟悉Linux环境下的go语言开发熟悉常用 数据结构与算法有Linux环境系统编程经验优先深入阅读 过某 一著名开源项目源代码优先熟悉Docker,LXC,CoreOS,Kubernetes等容器生态开源项目优先", "深圳传音控股有限公司", "2000人以上", "成熟型(不需要融资)", "移动互联网", "4.0"
"拉勾", "Go", "Golang", "16000-20000", "不限", "上海", "1-3年", "职位描述工作内容1、 使用go语言开发，按需求实现服务端相关功能模块，保证代码质量。2、 负责为WEB前端，APP提供API；3、 负责相关技术文档的整理和维护；4、 负责性能优化、安全升级;5、 协作完成压力测试系统的设计及实现6、 结合实际应用需求进行技术的改进与创新职位要求1、 使用go语言开发，按需求实现服务端相关功能模块，保证代码质量。2、 负责为WEB前端，APP提供API；3、 负责相关技术文档的整理和维护；4、 负责性能优化、安全升级;5、 协作完成压力测试系统的设计及实现6、 结合实际应用需求进行技术的改进与创新", "上海爱有网络科技有限公司", "150-500人", "成长型(A轮)", "移动互联网,电子商务", "3.8"
"拉勾", "Go", "Go高级服务器端研发工程师", "30000-60000", "本科", "北京", "3-5年", "职位描述[职位描述]负责移动应用的后端开发工作（目前DAU日活跃用户180万）；基于SOA架构，为各类项目需求设计架构，开发后端功能服务；通过单元测试、自动化以及代码审查等提升优化代码质量；积极参与各种头脑风暴会议并对用到的技术、算法和产品功能提出意见和建议；同产品和设计团队协作，理解用户需求，归纳功能用例，并转化为高效的技术解决方案。[任职资格]2~5年移动APP后端开发经验，熟悉掌握至少一门编程语言，如python、c、c++、Java、Perl、Sell等；具备数据库（特别是关系型数据库MySQL,PostgreSQL等）及相关知识的实际应用和优化经验熟悉Linux/Unix具备扎实的OOP及相关软件开发技能，能根据架构要求，开发设计可扩展、可复用、高性能的功能模块；工作认真负责有责任心，追求细节和极致，有解决各类疑难问题的强烈愿望。加分项对GO语言有一定了解上班地点：东大桥", "北京宏途联创信息技术有限公司", "少于15人", "初创型(不需要融资)", "移动互联网,金融", "4.0"
"拉勾", "Go", "Go服务器端开发工程师", "13000-25000", "本科", "武汉", "1-3年", "职位描述职位描述【职位描述】负责核心系统服务器端模块设计、实现，包括并不限制于UDP协议、游戏网络同步算法【任职要求】1. 1年以上相关工作经验，精通Go的语言特性以及后端系统架构2. 熟悉算法，有大规模网站后端架构经验，善于做架构取舍，以及扩展预估；3. 熟悉各种SQL、NoSQL数据库应用场景，熟悉TCP、UDP协议4. 熟悉各种缓存使用（Memcached, Redis）5. 严谨的工作态度，对技术、业务细节有充分把控6. 优异的沟通能力，敢于打回“无理的产品需求”，善于提供“合理的可执行方案”7. 为自己写的代码骄傲！", "武汉微派网络科技有限公司", "15-50人", "成长型(A轮)", "社交网络", "5.0"
"拉勾", "Go", "Go", "5000-10000", "本科", "西安", "不限", "职位描述负责公司新产品的开发负责公司系统的运行和维护使用golang语言进行编程学习能力强", "西安微开网络科技有限公司", "少于15人", "初创型(不需要融资)", "移动互联网", "3.5"
