"fromsite", "positionType", "positionName", "salary", "education", "city", "workYear", "jobDes", "company", "companySize", "financeStage", "industryField", "rate"
"拉勾", "HTML5", "html5开发", "15000-25000", "大专", "上海", "1-3年", "职位描述岗位职责：1、负责产品的页面制作及维护，根据设计图完成页面html5应用的编码；2、完成主流浏览器及移动设备的兼容性调试；3、利用HTML5和CSS3等相关技术开发网站、手机、平板电脑等多平台上的前端应用；4、负责利用JavaScript实现WebApp中的交互效果。任职要求：1、一年以上html5开发工作经验；2)、熟悉手机端和PC端web的差异，有移动平台前端开发经验，了解移动互联网产品；3、精通Javascript、HTML/HTML5/XML、CSS/CSS3、Ajax、html5 Canvas等前端开发技术，熟悉W3C标准。4、熟悉各种前端框架并对其有深入的理解，例jQuery、jQueryMobile、jQTouch、Sencha Touch等HTML5框架。5、熟悉http/xml/json/webservices/rest等网络通信技术，同时对iOS、安卓等移动端语言具有一定的了解和理解。6、熟悉webkit、深刻理解各手机主流浏览器和平板设备之间的兼容性，已用户体验为导向。", "上海微愉网络科技有限公司", "15-50人", "初创型(天使轮)", "教育,移动互联网", "5.0"
"拉勾", "HTML5", "HTML5工程师", "10000-20000", "不限", "广州", "不限", "职位描述岗位职责：1、根据需求文档，使用LayaAIR引擎进行手机游戏开发；任职要求：1、至少1年以上游戏开发工作经验；2、精通javascript等前端开发技术；3、熟悉html5游戏开发框架，能独立开发；4、熟悉LayaAIR或Egret引擎，对跨平台开发有一定的经验；5、有LayaAIR引擎游戏开发经验、具备游戏上线开发经验者优先。", "三七互娱（上海）科技有限公司", "500-2000人", "上市公司", "游戏", "4.2"
"拉勾", "HTML5", "HTML5开发工程师", "15000-23000", "大专", "上海", "3-5年", "职位描述岗位职责：1、H5前端开发,混合APP开发封装2、负责公司产品H5模块和前端的架构设计和开发工作3、负责Web App及混合App的前沿技术研究和新技术调研任职要求：1、熟练运用JavaScript语言与HTML5、CSS3等技术; 熟悉移动端Web绘图相关高级特性, 如canvas, webGL, CSS3动画效果等2、熟悉模块化、前端编译和构建工具，熟练运用主流的移动端JS库和开发框架，并深入理解其设计原理，例如：jQuery Mobile、Zepto、Angular、Bootstrap等3、能提供完善的WebApp和混合App（JS方向）技术方案，了解服务端（node/java或其他语言）或native移动应用开发4、对技术有强烈的进取心，具有良好的沟通能力和团队合作精神、优秀的分析问题和解决问题的能力", "上海埃林哲软件系统股份有限公司", "150-500人", "上市公司", "企业服务,O2O", "4.2"
"拉勾", "HTML5", "html5", "15000-20000", "本科", "宁波", "3-5年", "职位描述岗位描述：1、负责网站前端规划和设计；2、熟练使用CSS/DIV/XML/JSON地完成页面的编码和设计；3、熟练使用JavaScript进行代码构建，完成产品设计的各种特效；4、保持高效的前端性能，优秀的代码可维护性，良好的浏览器兼容性；5、同后台相关开发人员协作，获取后端数据后进行效果展示；6、与其他同事共享开发经验，优化网站的功能和性能；7、Web前沿技术研究和新技术调研。岗位要求：1、本科学历，3年及以上相关工作经验2、精通CSS/DIV/XML/JSON，熟悉http协议；3、精通JavaScript，擅长Ajax等页面信息异步展现技术；4、熟悉软件工程思想，良好的前端编程能力和编程习惯；5、积极向上，有良好的人际沟通能力，良好的工作协调能力，踏实肯干的工作精神；6、有大型网站程序开发经验者，优先考虑。备注：请附上相关作品网址。", "网新新云联技术有限公司", "150-500人", "成长型(A轮)", "电子商务,O2O", "4.2"
"拉勾", "HTML5", "HTML5互动开发", "10000-20000", "本科", "北京", "1-3年", "职位描述岗位职责：1、负责网站和移动端h5互动项目开发工作。2、负责系统前端开发工作。3、优化前端功能设计，解决各种浏览器的兼容性问题。4、JavaScript程序模块开发，通用类库、框架编写。5、Web前端表现层及与后端交互的设计和开发。6、通过各种前端技术手段，提高用户体验并满足性能要求任职要求：1、精通javascript、css／css3、html／html5等前端开发技术；2、对互联网及技术较为熟悉和敏感，具有互联网广告行业经验优先。3、具备项目团队间的协作和沟通能力，责任心强。4、三观向上，正能量满满。5、脑洞大，点子多，能玩儿能造。", "北京扎根知本教育科技有限公司", "15-50人", "初创型(未融资)", "移动互联网,教育", "4.6"
"拉勾", "HTML5", "html5", "4000-8000", "大专", "上海", "1-3年", "职位描述工作职责：根据产品需求和设计完成兼容性良好的PC/手机WAP平台网站前端页面制作，与PHP后台工程师协作，完成数据交互、动态信息展现。主要以移动端H5页面为主。维护及优化网站前端性能，优化前端开发模式和规范。研究和探索创新的开发思路和最新的前端技术。任职要求：计算机、软件工程、通信等相关专业。精通Web前端技术，包括HTML5/CSS3/JavaScript/Ajax等，能解决各种浏览器兼容性问题。持续关注业界的新话题和新技术，善于学习新技能，熟练掌握JQuery、AngularJS、Bootstrap等前端框架中2种或以上。掌握网站性能优化、SEO和服务器端的基础知识。热爱前端技术，个性乐观开朗，逻辑性强，善于沟通合作。懂得协作、分享，有理想有追求，有一颗想做事的心。有独立开发经验和案例更佳，有H5动画、微信H5活动、微信小游戏开发经验优先录用。", "上海千樱信息科技有限公司", "15-50人", "初创型(天使轮)", "移动互联网", "4.4"
"拉勾", "HTML5", "HTML5前端开发工程师", "10000-15000", "大专", "杭州", "3-5年", "职位描述工作职责：1、负责项目的前端构建及开发工作；2、JavaScript程序模块开发，通用类库、框架编写及优化；3、优化项目性能，提高用户体验和交互效果，保证项目质量；4、与其他部门协作，提高产品体验和提出优化建议。---------------------------------------------------------------------------岗位要求：1、计算机及相关专业大专及以上学历，2年以上网页开发经验；2、精通各种Web前端技术，包括HTML/CSS/Javascript；能熟练高效的手工编写HTML及CSS代码，确保代码对各种浏览器的良好兼容性；3、深刻理解Web标准，对可用性、可访问性等相关知识有实际的了解和实践经验；4、熟悉Jquery，SenCha,Touch等常用框架以及一些开发包和库类；5、至少精通一门非web前端脚本的语言（如Java、PHP、C++），并有项目经验；6、优秀的编程能力和良好的编程习惯和团队协作精神；7、有智能手机网页开发经验的尤佳（iPhone，Android）或有移动Html5游戏开发经验者优先考虑。", "浙江天搜科技股份有限公司", "500-2000人", "上市公司", "移动互联网", "4.7"
"拉勾", "HTML5", "HTML5前端开发工程师", "13000-20000", "本科", "深圳", "3-5年", "职位描述岗位职责：1、负责项目中技术难点和关键模块的设计和编码；2、负责HTML5开发技术工作，包括针对开发需求的技术方案设计、开发指导和团队技能提升等；3、设计和规划HTML5的整体架构和技术规范，并在日常开发实践中贯彻执行；4、优化代码实现，提高产品性能；5、配合开发主管，参与HTML5应用架构的设计和规范化工作。岗位要求：1、计算机相关专业本科以上学历；2、2年或以上 JS 开发工作经验，熟悉 jQuery Mobile 或 Sencha Touch 库，具备 HTML5、CSS3 开发技术，有响应式页面开发经验；3、精通DIV+CSS和W3C标准，熟练运用XHTML,CSS，深刻理解手机平台上各主流浏览器之间的兼容性；4、熟悉HTML5特性，了解HTML5最新规范，能够熟练运用HTML5特性构建移动端的WebApp；5、熟悉JS/CSS/ HTML 5在各种手机分辨率、PAD平台上的兼容和性能优化；6、善于使用前段的基本调试工具，熟练手写代码；7、熟悉Javascript/Json/XML/HTML 5等Web前端技术，熟练使用JQuery框架，能与后台开发人员一起编写Ajax互交程序。", "海南海航信息技术有限公司", "150-500人", "成长型(不需要融资)", "移动互联网,生活服务", "3.4"
"拉勾", "HTML5", "HTML5", "10000-15000", "大专", "广州", "3-5年", "职位描述任职要求：1、熟悉html5和AS3；2、深刻理解OPP编程思想，熟悉模块化编程，对代码质量有严格要求；3、有移动平台前端开发经验者优先；4、有很强的责任心、抗压能力；5、愿意学习和接受新技术，对攻关疑难问题具有浓厚兴趣；5、熟悉H5游戏引擎（LayaBox,白鹭）者优先；6、熟悉游戏动画实现所需相关数学知识、物理知识等；7、了解H5游戏性能优化；岗位职责：1、使用H5游戏引擎（LayaBox）完成项目功能模块的开发；2、负责游戏内性能的优化；3、协助策划和美术同事们推进项目整体进度。", "广州新恺软件科技有限公司", "50-150人", "初创型(未融资)", "游戏", "4.3"
"拉勾", "HTML5", "html5开发工程师", "10000-15000", "大专", "杭州", "3-5年", "职位描述任职要求：1、精通XHTML/XML，熟悉语义化HTML及HTML标签含有的原生样式2、熟悉W3C标准，对表现与数据分离、Web语义化等有深刻理解3、精通CSS/CSS3，熟悉常用CSS属性，能快速给出常见前端特效的CSS解决方案，熟悉浏览器渲染差异以及重要的CSS兼容问题4、精通javascript，理解JS执行机制及其面向对象机制；精通Javascript浏览器编程，熟悉Ajax、DOM等前端技术编程，熟悉常用函数在W3C 和IE中的实现差异，能脱离JS框架书写各种兼容代码。能熟悉使用JQuery等主流框架，能使用框架快速开发，能书写基于框架的高性能代码5、熟悉前端优化原则，了解SEO6、能熟悉使用正则表达式为佳其他要求：1、两年以上的前端页面与脚本开发经验，有移动互联网方向研发经验者优先2、有独立完成复杂前端模块的设计与实现的经验者优先3、有移动端原生APP开发经验者优先4、对用户体验、交互操作流程、及用户需求有深入理解5、有强烈的上进心和求知欲，善于学习和运用新知识6、善于沟通和逻辑表达，良好的团队合作精神和积极主动的沟通意识7、计算机或相关专业专科及以上学历", "杭州商帝网络技术有限公司", "50-150人", "成长型(A轮)", "移动互联网", "4.3"
"拉勾", "HTML5", "HTML5技术人员", "4000-6000", "大专", "广州", "1-3年", "职位描述1. 能够准确细致地规划DIV、CSS结构，并能解决主流浏览器之间的兼容问题；2. 熟练使用HTML，HTML5，CSS2/3，Javascript等静态页面技术和jquery ,jquery mobile等常用JS框架；了解React，有开发实用经验更佳。3. 拥有将网页设计师的效果图快速恢复成web标准原型的能力，熟悉页面优化和SEO等技术；4. 注重团队合作，有良好的语言表达能力及沟通能力，工作认真负责、细致周到，能承受一定的工作压力且有一定的客户服务意识；5. 具备大型网站前端开发经验；应聘者请提供作品地址；6.思路清晰，思维缜密，具备良好的沟通能力、理解能力和较强的学习能力；", "广州新际网络科技有限公司", "15-50人", "初创型(未融资)", "移动互联网,O2O", "3.3"
"拉勾", "HTML5", "html5", "18000-25000", "本科", "北京", "1-3年", "职位描述工作职责：1、负责产品的前端开发工作、页面性能优化2、与后端工程师配合，为项目提供最优化的技术解决方案3、移动端H5相关的开发及微信小程序的开发要求：1、大学本科或以上学历，计算机等相关专业，有两年以上互联网产品前端开发经验；2、熟悉 css 包括 css3，熟悉 html/html53、精通JavaScript语言，熟悉jquery或者zepto，至少会一种框架（Backbone、Angular、React、Vue）； 4、熟悉常见的浏览器的特点和限制，熟悉W3C相关标准和Web常用协议、图片文件格式等；能解决常见浏览器兼容性问题，熟悉IE、Firefox、Chrome等主流浏览器的常见兼容性问题，并有可行的解决办法5、至少熟悉一门后端语言（PHP、Node、Python等）；", "北京华图宏阳网络科技有限公司", "150-500人", "成熟型(D轮及以上)", "移动互联网", "3.2"
"拉勾", "HTML5", "html5工程师", "8000-10000", "本科", "上海", "1-3年", "职位描述职位描述：1.利用Java作为后台语言，开发微信公共账号相关应用；2.负责公司产品或项目的html5开发，并配合后端的开发；3.根据需求实现页面交互效果；职位要求：1、计算机及相关专业统招全日制本科或以上学历；2、计算机软件或互联网行业，相关工作经验至少1年；3、精通HTML5/CSS3，JavaScript，Ajax等Web开发技术；（需要核心掌握并应用的的技术）4、熟练掌握前端开发技术(HTML5、JS、JSON、XHTML、CSS3)，了解各项技术的相关标准，并严格按照标准进行开发，熟练使用JQuery框架能与后台开发人员一起编写Ajax交互程序；5、熟悉各种浏览器的兼容性调试；6、对数据结构以及后台语言Java等有简单了解；7、良好的沟通与表达能力，思路清晰，有强烈的责任心和创新意识，业务逻辑理解与分析能力强。", "上海泛微网络科技股份有限公司", "500-2000人", "成熟型(D轮及以上)", "移动互联网,企业服务", "4.0"
"拉勾", "HTML5", "html5/网页制作/前端开发工程师", "4000-6000", "不限", "济南", "1-3年", "职位描述在这里，你将拥有宽松、愉悦、平等的工作环境；你将收获友爱、尊重、温暖的朋友及创业伙伴；你将最大限度地提高自己的工作技能以及能力；更重要的是，你可以实现自己的最大价值，让你的未来拥有无限可能。岗位职责：1.负责公司产品PC、移动端网页开发；2.配合运营人员进行营销类页面编写。任职资格：1.1-2年前端开发；2.能使用HTML5+CSS3语言熟练写出符合W3C标准、兼容主流浏览器的代码；3.熟悉JS开发，了解目前业界常用的前台移动框架，如：jQuery、jQuery Mobile；4.精通html5，对html5调用手机底层及各种动画效果制作熟练；5.了解对产品开发流程、用户研究流程及用户使用习惯，掌握用户研究、可用性测试和评估技能；6.为人正直、诚恳、有责任感，并具有良好的团队合作精神和沟通表达能力 。工作时间：1、工作时间：上午9:00-12:00，下午：1:30-5:30，周末及法定节假日休息；2、弹性工作制度，结果导向。薪资待遇：1、薪资4K-6K，五险一金+年底奖金 ；2、期权奖励，享受公司成长回报。", "济南九九云信息科技有限公司", "少于15人", "初创型(未融资)", "移动互联网,金融", "-"
"拉勾", "HTML5", "html5", "6000-10000", "大专", "深圳", "1-3年", "职位描述要求：1、有微信H5页面和html5动画效果页面开发经验2、对web移动端体验、交互、动画、兼容性调整有深刻的理解3、熟练掌握html5/css3常用技术4、js逻辑和结构清晰，能够合理的封装和组织js代码5、对canvas 动画以及html5小游戏有一定了解的优先考虑欢迎有上进心、有责任感的你加入我们注：面试时请带上自己的作品1、炫酷的HTML5移动端交互页面2、自己做的canvas案例", "深圳市蓝之石传媒有限公司", "少于15人", "初创型(未融资)", "移动互联网", "-"
"拉勾", "HTML5", "HTML5", "4000-8000", "本科", "贵阳", "1-3年", "职位描述一件衣物，一个故事，一种文化，一份传承。这是一个有温度的项目；这是一个有梦想的团队；这是一个有价值的公司。只要你有创业的激情和梦想，只要你有足够大的野心，只要你有支撑野心的才华，加入我们团队，让我们一起开启新世纪的“郑和号”巨舰！工作职责1、负责移动HTML5开发，迭代2、负责H5移动端内核开发职位要求1、具有良好的Javascript基础，1-3年以上开发经验2、有HTML5/CSS3方面的具体实践3、具备良好的代码风格和编程习惯，掌握模块化编程思想，合理使用各类设计模式，熟悉移动端交互式开发4、熟悉构建工具相关知识优先5、有ApiCloud、DCloud-HBuilder、APPCAN、WEX5等开发经验优先6、了解W3C、Native.js、NODE.JS 等相关知识优先", "贵州九朝道客文化传播有限公司", "15-50人", "初创型(天使轮)", "移动互联网,电子商务", "-"
"拉勾", "HTML5", "html5", "35000-50000", "本科", "北京", "5-10年", "职位描述1、负责公司产品前端代码开发、页面重构以及交互设计逻辑处理；2、解决产品开发过程中的疑难问题；1、4年以上Html5开发经验。2、精通HTML、CSS、 JavaScript等Web前端开发技术。3、熟练应用Html5、CSS3 ，对动画、交互、体验有大量经验和心得。4、熟悉页面性能的优化，熟悉Firebug等开发调试工具，具有移动端经验更佳；5、持续学习，乐于分享。良好的沟通心态，能够推动团队成员向前发展", "普信恒业科技发展（北京）有限公司", "2000人以上", "上市公司", "移动互联网,金融", "3.9"
"拉勾", "HTML5", "HTML5", "15000-30000", "本科", "上海", "1-3年", "职位描述岗位职责：1.负责产品页面制作及维护，根据设计图完成页面h5应用的编码：2.与设计师和后台程序配合，高效率高质量地完成页面的实现工作；3.根据产品设计，利用h5和css3等相关技术开发网站、手机、平板电脑等多平台上的前端应用；4.负责利用javascript实现WEBAPP中的交互效果。", "上海迎智正能文化发展有限公司", "50-150人", "初创型(天使轮)", "移动互联网,其他", "-"
"拉勾", "HTML5", "html5前端工程师", "10000-16000", "本科", "深圳", "1-3年", "职位描述岗位职位：1、根据项目需求，分析并给出合理的页面前端结构解决方案；2、根据产品设计，利用HTML5，CSS3等相关技术开发网站等多 平台的前端应用；3、团队配合，参与HTML5应用架构的设计和规范化工作，优化代码实现，提高产品性能；4、与设计师、后端开发工程师紧密工作在一起，完成功能的镶嵌和调试工作，实现产品前端UI和交互开发需求，确保产品在不同平台、设备商兼具优秀的用户体验。岗位要求1. 1-3年以上Web前端开发经验，要求有较高的JavaScript语言驾驭能力，能够进行面向对象/组件的前端设计和开发；2. 要求有较强的页面制作功底（切图、DIV+CSS布局等），并有一定的页面审美意识；3. 精通HTML5、CSS/CSS3、JavaScript等前端相关技术，熟悉W3C标准；4. 对各种浏览器的兼容性有一定了解，并有相关问题的解决经验；5. 精通AJAX运作机制，掌握JQuery，了解html5相关的js开发；6. 掌握photoshop/fireworks、dreamwaver等设计工具者优先考虑；7. 良好的代码书写风格。", "深圳微信创科技有限公司", "50-150人", "成长型(不需要融资)", "生活服务,硬件", "3.7"
"拉勾", "HTML5", "html5", "8000-15000", "本科", "深圳", "1-3年", "职位描述1、负责公司项目的前端开发与制作；2、根据项目设计，利用HTML5相关技术开发移动应用页面；3、追求最新的前端技术和标准（HTML5），持续提高前端的用户体验及性能；岗位要求：1、本科以上学历，3年以上前端开发经验。2、精通htm l/ html5、CSS / 3、JS等前端开发技术，熟悉W3C标准；3、能熟练运用一种常见JS开发框架，如jquery,angularJS等；4、能够熟练手工编写html及CSS代码，对网站及页面性能优化有一定认识和经验；5、能处理不同浏览器兼容问题，熟练编写结构良好的语义化的（X）Html；6、能熟练使用Firebug、chrome dev等开发调试工具；7、对Html和手机开发尤其是微信用户界面开发有深入了解者优先。", "深圳市虹美影像科技有限公司", "50-150人", "初创型(天使轮)", "移动互联网,电子商务", "3.4"
"拉勾", "HTML5", "html5", "8000-10000", "本科", "上海", "1-3年", "职位描述岗位职责：1、负责公司产品、方案的微信端、服务端HTML5前端的设计、开发工作；任职要求：1、精通DIV+CSS和W3C标准，能熟练运用XHTML,CSS进行合理的网页制作，深刻理解手机平台上各主流浏览器之间的兼容性；2、熟悉JS/CSS/ HTML 5在各种手机分辨率、PAD平台上的兼容和性能优化；3、善于使用前段的基本调试工具，熟练手写代码；4、熟悉Javascript/Json/XML/HTML 5等Web前端技术，熟练使用JQuery框架，能与后台开发人员一起编写Ajax互交程序；5、熟悉交互设计，对可用性，可访问性等用户体验知识有相当的了解和实践经验；6、具备良好的服务意识、责任心、较强的学习能力、优秀的团队沟通与协作能力、能承受一定的工作压力；7、熟悉Java后台技术者优先.", "上海天臣防伪技术股份有限公司", "150-500人", "成长型(不需要融资)", "企业服务,信息安全", "4.3"
"拉勾", "HTML5", "html5", "15000-30000", "不限", "上海", "3-5年", "职位描述职位描述我们所寻找的是一个做事认真负责，团队协作能力强，并能快速实现产品UE/UI，同时能够积极地参与团队讨论，抱着开放的心态去拥抱新技术，新理念，不断挑战自我，和团队共同成长，共同蜕变的人。关于技术团队非常注重代码质量，可读性好，扩展性好以及模块化是首要考量；非常注重开发效率，移动互联网千变万化，业务成指数形式快速增长，我们需要拥抱变化，并进行快速响应；非常注重架构，通过架构最大限度减少重复代码量，提高代码质量，增加应用扩展能力；非常注重新技术的发展，随时拥抱，随时引入；职责使用简单，干净，可维护性高，扩展性好的代码实现产品功能，并在必要时重构现有代码；和UE/UI紧密合作，能根据UI设计稿和UE交互稿独立完成网页（PC，Mobile都包含）的构建；和.Net的小伙伴们紧密合作，研发基于REST风格API的Rich Web App；和Android/iOS小伙伴们紧密合作，开发Hybird App；参与产品需求讨论会，和产品团队一起讨论如何构建新颖的产品功能以及极致的用户体验；需要使用到的技术包含但不限于RequireJS，Zepto，jQuery，Underscore，Backbone，jQuery Mobile，Angular，iScroll，Sass，ECharts，Highcharts等；要求2年前端/Html/Javascript相关工作经验；精通HTML/CSS/Javascript；熟悉至少一种mv*框架（Backbone、Angular等），并有已实现的单页应用案例；深刻理解Web标准，以及不同浏览器（包括移动端浏览器、WebView、UIWebView）的代码兼容问题和解决方案。", "上海路路由信息技术有限公司", "150-500人", "成长型(A轮)", "移动互联网,O2O", "3.6"
"拉勾", "HTML5", "html5", "12000-16000", "本科", "上海", "1-3年", "职位描述岗位描述：1、负责公司APP软件产品的页面功能的开发和优化2、可以独立编写前端的页面，3、有自己熟练掌握的比较好的技术框架，会设计方面优先4、利用HTML5/CSS3/JavaScript/Flash/React.js/angular.js等各种Web技术进行产品的界面开发5、配合后台开发人员实现产品界面和功能与后台的交互6、制作标准优化的代码，并增加交互动态功能。岗位要求：本科以上学历，计算机相关专业，技术优秀，大专学历也可考虑2年左右前端开发工作经验，有前端技术选型经验优先；3. 熟练掌握Web前端技术CSS/HTML/Javascript，有html5/css3开发经验4. 熟悉常用Web前端框架(jQuery,React.js，angular.js，Bootstrap等)；5. 良好的编程习惯和较强的的学习能力；6. 有责任感和良好的团队合作精神；7. 有java开发经验者优先", "上海泛微网络科技股份有限公司", "500-2000人", "成熟型(D轮及以上)", "移动互联网,企业服务", "4.0"
