"fromsite", "positionType", "positionName", "salary", "education", "city", "workYear", "jobDes", "company", "companySize", "financeStage", "industryField", "rate"
"拉勾", "HTML5", "html5开发", "6000-8000", "大专", "上海", "1-3年", "职位描述岗位职责：1.负责公司产品Web app(html+css+javascript)前端开发，根据设计图完成页面html5应用的编码；2.熟悉HTML5及CSS3特性，包括(localStorage/Application Cache/CSS 3.0标准)；3.根据产品设计，利用HTML5和CSS3等相关技术开发网站、手机、平板电脑等多平台上的前端应用；4.负责利用JavaScript实现WebApp中的交互效果；5.负责移动终端的Web效果图切图制作和交互效果制作，与设计师和后台程序配合，高效率高质量地完成页面的实现工作；任职要求：1.一年以上html5开发工作经验，本科以上学历；2.熟悉手机端和PC端web的差异，有移动平台前端开发经验，了解移动互联网产品和行业；3.精通基于CSS3与JavaScript实现的用户交互模式；4.精通html5在android和ios应用程序开发，移动客户端开发；5.对于页面性能优化、javascript执行效率优化有一定的了解；6.沟通能力好，责任心强，工作踏实严谨。", "上海颉恩网络科技有限公司", "15-50人", "初创型(不需要融资)", "移动互联网,广告营销", "4.3"
"拉勾", "HTML5", "html5开发培训讲师", "8000-15000", "不限", "湖州", "1年以下", "职位描述工作内容：1）从事IT培训学院的课程讲师工作；2）参与课程研发，课程体系完善，提高讲师团队授课水平；要求：1）计算机、通信等相关专业本科学历；2)具备HTML、JAVA、ASP、.NE T、C#、PHP、SQLServer、Oracle等其中一种开发经验；3）有较强的学习，领悟能力；4）具备良好的沟通能力和优秀的团队协作能力；5）具备传道授业解惑能力（全职或兼职任教）。", "浙江风雷信息科技有限公司", "15-50人", "初创型(未融资)", "移动互联网,企业服务", "-"
"拉勾", "HTML5", "html5", "13000-25000", "大专", "杭州", "3-5年", "职位描述        职位描述岗位职责:1、负责前端的架构设计及实现；2、精通JavaScript/CSS/HTML等前台相关技术，并能利用技术开发网站、手机、平板电脑等多平台上的前端应用，熟悉编写响应式的界面，能让网页格式自动适应各款各大小的手机；3、分析并解决软件开发过程中的问题；4、与后台开发人员进行接口联调；5、具有很强的技术研发和创新能力、良好的沟通表达能力、很强的业务理解和技术实现能力；任职要求:1、2年及以上移动前端开发工作经验，精通HTML5，CSS3和原生JS，能准确地将设计师的意图转换为前端代码实现。2、具备应用JavaScript实现前端逻辑和网页动画。3、理解HTTP原理，并能够应用AJAX技术实现与后端通信4、熟悉web前端框架jquery， angular 或backbone等主流开发框架。", "九五宝佑网络科技（浙江）股份有限公司", "150-500人", "成长型(不需要融资)", "移动互联网,金融", "4.2"
"拉勾", "HTML5", "后端java， 前端javascript html5， 移动端 andiod", "3000-5000", "大专", "石家庄", "1-3年", "职位描述软件开发工程师任职资格条件●计算机及相关专业专科及以上学历，2年以上JavaWEB应用软件开发经验；●具有良好的面向对象分析与设计能力，熟悉设计模式，有丰富的设计经验；●精通Java、JSP、JavaScript、HTML、CSS开发技术；有ext或jQuery开发经验者；●熟悉Oracle数据库的使用，掌握Oracle数据库开发技术；●责任心强，具备良好的团队合作精神；●有公安行业应用软件开发经验者优先；●有与GIS相关应用软件开发经验者优先。主要工作职责1、根据系统设计文档，编写软件系统的代码；2、完成编码工作，并保证交付的产品符合业务需求；3、测试和检查自己的代码，及时消除代码中的缺陷；", "石家庄晶恒科技有限责任公司", "15-50人", "初创型(未融资)", "移动互联网,硬件", "-"
"拉勾", "HTML5", "html5", "12000-16000", "本科", "上海", "1-3年", "职位描述职位描述：1. 负责公司产品或项目Web前端研发，并配合后端的开发。2. 根据需求实现页面交互效果。职位要求：1、计算机及相关专业统招全日制本科或以上学历；2、计算机软件或互联网行业，相关工作经验至少1年；3、精通HTML5/CSS3，JavaScript，Ajax等Web开发技术；（需要核心掌握并应用的的技术）4、熟练掌握前端开发技术(HTML5、JS、JSON、XHTML、CSS3)，了解各项技术的相关标准，并严格按照标准进行开发，熟练使用JQuery框架能与后台开发人员一起编写Ajax交互程序；5、熟悉各种浏览器的兼容性调试；6、对数据结构以及后台语言Java等有简单了解；7、良好的沟通与表达能力，思路清晰，有强烈的责任心和创新意识，业务逻辑理解与分析能力强。", "上海泛微网络科技股份有限公司", "500-2000人", "成熟型(D轮及以上)", "移动互联网,企业服务", "4.0"
"拉勾", "HTML5", "前端开发（Html5方向）", "6000-10000", "大专", "杭州", "1-3年", "职位描述工作职责：1、负责web项目的前端开发工作，偏重移动项目；2、和后端程序技术有效配合，完成相关的工作；3、根据产品需求，分析并给出合理的页面前端结构解决方案；4、能够持续优化产品性能、页面逻辑及用户体验；任职要求：1、2-3年前端开发经验；2、熟练使用各种Web前端技术，对 HTML5、CSS3 有深入研究；3、熟练使用JQ、zepto、Angula、Vue等开发框架；4、对移动设备的操作特性有了解，能熟练处理移动设备不同分辨率设备之间的适配；5、熟悉react nativ等混合应用开发经验优先，熟悉nodejs的加分。", "浙江畅唐网络股份有限公司", "500-2000人", "成熟型(不需要融资)", "游戏", "4.1"
"拉勾", "HTML5", "html5", "10000-20000", "不限", "杭州", "3-5年", "职位描述工作职责 ：1、负责项目的前端构建及开发工作；2、JavaScript程序模块开发，通用类库、框架编写及优化；3、优化项目性能，提高用户体验和交互效果，保证项目质量；4、与其他部门协作，提高产品体验和提出优化建议。--------------------------------------------------------------------------------------------二、岗位要求1、计算机及相关专业大专及以上学历，2年以上网页开发经验；2、精通各种Web前端技术，包括HTML/CSS/Javascript；能熟练高效的手工编写HTML及CSS代码，确保代码对各种浏览器的良好兼容性；3、深刻理解Web标准，对可用性、可访问性等相关知识有实际的了解和实践经验；4、熟悉Jquery，SenCha,Touch等常用框架以及一些开发包和库类；5、至少精通一门非web前端脚本的语言（如Java、PHP、C++），并有项目经验；6、优秀的编程能力和良好的编程习惯和团队协作精神；7、有智能手机网页开发经验的尤佳（iPhone，Android）或有移动Html5游戏开发经验者优先考虑。", "浙江天搜科技股份有限公司", "500-2000人", "上市公司", "移动互联网", "4.7"
"拉勾", "html5", "html5", "3000-5000", "本科", "上海", "不限", "职位描述【基本要求】：(1) 本科、及以上在校生、可以实习4个月以上、每周5天全职实习(2) 理解能力强、学习能力强、积极上进、思路敏捷，动手能力强；(3) 团队奉献意识强——拒绝不善于团队合作的成员；【技术要求】：(1)能够独立进行HTML5类的页面开发。(2)熟练Html5 + css3 + JS开发。(3)熟练使用AngularJs或Jquery等JS框架开发；(4)面试需要携带可演示的自己开发的HTML5页面实现。", "北京和讯在线信息咨询服务有限公司上海分公司", "50-150人", "成长型(不需要融资)", "移动互联网,金融", "-"
"拉勾", "html5", "html5", "20000-30000", "本科", "杭州", "3-5年", "职位描述职位描述：1.前端架构工作（移动端为主）；2.基础架构设计和推行工作；3.参与产品需求讨论，能深入思考需求本质，提出专业性的优化建议；备注：阅读、动漫、端游相关类项目职位要求：1.本科以上学历，3年以上前端开发经验2.熟悉Html5，JS, CSS3，JavaScript等前端通用技术，使用过Bootstrap等常见类库和框架，有能力设计和开发前端组件和前端基础高性能架构3.熟悉jquery、Ajax、JSON等Web通信技术;熟悉页面性能的优化4.开发过兼容多平台多浏览器的项目，丰富的项目经验、有前端代码组织、代码发布整合的相关经验，对当前成熟的前端构建工具（fis、glup、grunt等）有所了解，有所使用。5.关注前端新技术，自我驱动，学习能力强。", "杭州掌维科技股份有限公司", "50-150人", "初创型(未融资)", "移动互联网,文化娱乐", "3.8"
"拉勾", "html5", "html5", "10000-20000", "大专", "北京", "1-3年", "职位描述职位描述：1.负责移动web应用以及pc前端开发工作，开发具有高性能和高可靠性的系统，具有可扩展性；2.能够使用css、sass、less等语言实现UI设计，编写高性能的javasript实现交互设计；3.整体页面结构及样式层结构的设计、优化；4.利用HTML5相关技术开发跨平台的前端产品；5.配合UI设计人员完成设计，与后端人员进行调试、数据交互。职位要求：1.具备javascript、HTML、CSS编程经验；精通AJAX运作机制，熟悉HTML5；2.熟悉jquery、jquery-mobile、bootstrap等前端库，并了解其机制，使用过AMD/CMD规范；3.实际项目中使用过angularJS、backbone、react等前端框架，对hybird编程有一定了解；4.熟悉grunt、gulp等构建工具；5.良好的编码习惯，对工作具有强烈的责任心。", "国美金控投资有限公司", "50-150人", "初创型(未融资)", "金融", "3.8"
"拉勾", "html5", "html5", "10000-20000", "本科", "北京", "1-3年", "职位描述岗位职责：熟练运用一些前端基础库和动效库，独立完成 H5专题制作，保证在主流移动端平台有良好的体验；配合其他产品开发视觉效果和交互部分；协助完善产品和设计需求；对新技术进行定期的学习调研；岗位要求：本科是计算机相关专业；两年以上前端工作经验；良好的JS、CSS和OOP基础，熟练使用PS进行切图；具有H5专题页面和其他移动端网站的开发经验，能够进行较好的性能优化；熟练使用jQuery（或Zepto）、CSS3和其他动效库进行网页特效的开发，保证主流手机平台的兼容性；喜欢研究用户交互及视觉效果，有一定的研究，并对其有浓厚的兴趣；能独立完成复杂的前端模块设计与实现，对用户体验、交互操作流程有深入的理解和丰富的开发经验者优先。", "央视国际视频通讯有限公司", "150-500人", "成长型(不需要融资)", "移动互联网", "4.3"
"拉勾", "html5", "html5前端开发工程师", "10000-20000", "大专", "上海", "3-5年", "职位描述岗位职责：1、承担Web与移动互联网前端模块的设计开发工作2、负责HTML5项目前端开发3、配合后台工程师一起研讨技术实现方案，进行应用及系统整合4、跟踪最新前端技术和标准（HTML5），持续优化前端，以提高前端的用户体验以及性能任职资格：1. 大专及以上学历，2年以上工作经验；2. 熟悉HTML5/CSS3标准并对跨浏览器和平台的兼容有深入理解；3. 熟练使用NodeJs、RequireJs，了解AMD/CMD；4. 熟悉AngularJs/ReactJs；5. 熟悉Gulp、Webpack、Bower、Yeoman，能熟练配置各类gulp任务；6. 了解ES6/TypeScript；7. 会使用PhotoShop等进行基本的切图；8. 有过电商等网站开发者优先；9. 对网站页面性能优化有一定认识和经验；10. 有Web App相关应用开发经验的优先，具备良好的沟通能力，能够快速理解系统需求并完成开发工作；11. 有良好的团队合作能力，工作认真，细心，能高效完成工作。", "上海元轼信息咨询有限公司", "150-500人", "初创型(未融资)", "电子商务", "-"
"拉勾", "html5", "html5开发工程师", "10000-15000", "本科", "北京", "1-3年", "职位描述岗位职责：1．负责APP中HTML5的前端开发工作；2．利用JS、CSS或HTML5等技术，完成页面开发制作及维护工作；3．参与设计、产品及市场人员沟通，保证产品的质量和开发进度；4．持续的优化相关的产品的质量、性能、用户体验.任职资格：1．计算机相关专业本科以上学历，两年以上Web前端工作经验；2．精通JavaScript、Ajax、HTML/XHTML、CSS等基础网页制作开发技术；3．熟悉HTML5+CSS3+JS编程，熟悉各种前端调试工具；熟悉JS性能优化；4．熟可熟练运用移动端框架如：jQueryMobile、SenchaTouch、iWebkit<spa.", "大象城堡（北京）信息技术有限公司", "15-50人", "初创型(天使轮)", "移动互联网,电子商务", "3.6"
"拉勾", "html5", "html5", "17000-22000", "大专", "广州", "3-5年", "职位描述1.精通HTML，CSS，Javascript，DIV+CSS网页布局；2.精通jQuery，Ext/YUI等前端开发框架（其中一个即可）；3.熟悉HTML5、CSS3技术者优先；4.熟悉Backbone，sass等前端框架者优先；5.精通网页调试技术、跨浏览器技术方案。", "北京恒拓高飞航空技术有限公司", "500-2000人", "成长型(A轮)", "企业服务,数据服务", "4.0"
"拉勾", "html5", "前端开发工程师（html5）", "9000-18000", "本科", "北京", "1-3年", "职位描述岗位职责：1、负责前端开发，移动端html5页面开发，移动应用开发（混合应用）；2、参与需求评审，对需求完善及实施提供方案；3、负责指导攻克技术难点及解决稳定性和性能问题；4、参与核心业务编码工作并保证编码工作具有良好的维护性。任职要求：1、1-3年左右web开发经验；2、精通Web及前端技术（包括 html，css，Javascript，ajax，json）；3、至少精通一种或多种常见JavaScript框架（如：jQuery/Mootools/DWR/JSON/EXTJS/YUI等），熟悉常用函数在W3C和IE中的实现差异，能脱离JS框架书写各种兼容代码4、有良好的编码习惯，能够改善编码规范，降低软件维护成本；5、有html5，混合应用或移动应用开发经验者优先；6、至少熟悉一种服务器端开发语言，具有较强的代码走读能力，精通J2EE体系结构者优先；7、有过电子商务相关项目开发经验者优先，能够参与需求评审检查需求缺陷并提出合理设计方案；8、能够承担较强的工作压力，保证所负责相关领域工作进度及业务支持；9、具备较强的沟通交流、团队合作能力。", "北京一度用车信息科技有限公司", "50-150人", "成长型(A轮)", "移动互联网", "4.3"
"拉勾", "html5", "web前端/HTML5", "10000-20000", "大专", "上海", "1-3年", "职位描述工作内容：1、使用Node.js+Express+开发后台RESTful服务；2、使用MySQL/Redis/MongoDB/Elasticsearch数据库和搜索引擎；3、使用react／angular参与hybrid app 的开发 ；4、为前端（H5、IOS、Android）同时提供RESTful接口。任职条件：1、大专及以上学历计算机或相关专业，2年以上相关工作经验；2、能看懂英文技术文档，有良好的沟通能力；3、熟悉HTML5/CSS3等前端开发语言、熟练react／angular ；4、熟悉至少一个sql（尤其mysql）、一个NoSQL（尤其是mongodb）；5、会使用Linux基本命令；6、熟悉RESTful的定义与规范；7、能主动思考、有较强学习能力。在美承集团移动解决方案本部，你将获得：1.集团大平台具有的完善运行体制，移动端的时尚科技，创新创意的公司文化，阳光朝气的研发团队；2.高大上的移动端项目开发和管理流程，与行业***极客合作，助你成为移动行业高手；3.移动解决方案本部业务快速发展，发展前景广大，现在的你必将成为核心人员；4.公司成熟人才培养体系，为你职业生涯发展提供保驾护航；5.优雅的智能家居办公环境，时尚的办公设施，灵活的办公体制为你量身而定；6.大集团提供的完善薪酬体系，集团即将上市带来的员工期权。", "上海美承电子商务有限公司", "2000人以上", "成熟型(不需要融资)", "企业服务,硬件", "-"
"拉勾", "html5", "html5（游戏开发）", "15000-25000", "大专", "北京", "1-3年", "职位描述岗位职责:1、根据策划方案，主要负责市场部H5移动页面开发工作，包括但不限于邀请函、产品展示、市场活动、抽奖、投票、互动、小游戏；2、熟练掌握Html5动画的开发技能，不仅是位移、渐隐渐现等简单功能，更包括一些前沿动画技术；3、负责部分重点Web页面的前端开发工作；4、书写符合W3C标准的代码，高效解决常见的兼容问题和其他BUG；任职资格:1、专科及以上学历，两年前端开发经验以上，至少1年移动页面开发经验，投递简历请附带作品地址或二维码；2、熟悉Http协议和Ps工具的使用，精通Dom、Html5、Css3、JavaScript和至少一种JS框架；3、熟悉后台开发，数据库，能与后台开发工程师无缝对接与技术沟通；4、熟悉常见手机API应用和微信接入API应用；5、能适应快节奏工作方式，具备良好的学习能力和自我攻克难题的能力", "蜂韵互娱（北京）信息技术有限责任公司", "50-150人", "成长型(不需要融资)", "游戏", "4.4"
"拉勾", "html5", "html5", "5000-10000", "大专", "北京", "1-3年", "职位描述任职资格：1.本科学历，1年以上前端开发经验，有线上作品优先；2.掌握(X)HTML、CSS和JavaScript等前端开发技术，能熟练编写结构良好跨浏览器的代码；3.掌握Jquery/YUI/MooToolsajs等框架中至少一种框架的使用，对seajs研究深入者优先；4.掌握HTML5/CSS3方面知识，有HTML5实践开发经验者或有线上作品者优先；5.熟悉静态文件打包、发包、GIT代码管理；6.熟悉Java编程，熟悉Jason接口调用；7.熟悉JSP脚本语言；8.具有分析和解决问题的能力，重视团队协作，善于沟通、有责任心。", "陕西万德软件有限公司", "500-2000人", "上市公司", "移动互联网,电子商务", "4.5"
"拉勾", "html5", "html5开发工程师", "6000-12000", "大专", "上海", "1-3年", "职位描述工作职责：1.负责平台移动产品及网站前端开发工作；2.参与研发部门产品和项目研发，配合团队实现产品界面和功能。岗位要求：1.大专及以上学历，1年以上网站前端开发经验；2.精通HTML5+Javascript+CSS3；3.至少熟悉 reactJS，AngularJS，EmberJS 中的一种 H5 框架；4.有手机端微信端H5开发经验者优先5.有较强的学习能力，对新技术能够快速理解和运用；6.具备良好的责任心、有较强的主动性及团队合作精神，开朗自信，能承受一定的工作压力。工作时间：周一至周五9:00-17:30", "育宁文化发展（上海）有限公司", "15-50人", "成长型(A轮)", "电子商务,教育", "-"
"拉勾", "html5", "html5", "10000-15000", "本科", "上海", "1-3年", "职位描述在集团下属移动互联网公司产品开发部任职，负责集团各主题乐园、青年公寓、消费金融等项目的移动端、网站、微信公众号、官网的开发工作，提升用户的消费体验。岗位职责：1.负责Web站点的web前端开发2.负责移动端html5开发3.负责相关前端产品的浏览器兼容性，性能优化等任职要求：1、熟练掌握HTML5和CSS3的开发技能，能解决跨浏览器、跨终端、跨系统的兼容性问题；2、使用Javascript熟练、准确地进行代码构建，实现产品所需的动画效果以及交互效果；3、精通Javascript，能够独立开发JS模块,熟悉常用的JavaScript框架、类库，如jQuery、EXTJS、YUI、JS、DOM、ajax等；4、能够独立完成微信开发和调试工作，对微网站、微应用开发有较深的理解与应用；5.熟悉bootstrap，有webAPP、hybrid应用开发经验。6、根据工作的需求，有不断学习、钻研前端前沿技术的能力；7、计算机相关专业本科及以上学历。", "上海炎武金融信息服务有限公司", "50-150人", "上市公司", "移动互联网,金融", "4.7"
"拉勾", "html5", "HTML5", "9000-11000", "大专", "北京", "3-5年", "职位描述1.HTML5开发经验2年或以上经验；2.良好的学习能力和沟通能力；3.精通Javascript,精通Jquery;4.深刻了解WEB标准，熟练手写JS,有HTML5+css3.使用经验；5.精通HTML5和mobile web开发；6.对JSP和模板技术有一定经验；7.熟悉AngularJS和BOOtstrap开发框架", "深圳市希仑科技有限公司", "150-500人", "成长型(不需要融资)", "移动互联网,电子商务", "2.7"
"拉勾", "html5", "html5", "8000-15000", "本科", "深圳", "1-3年", "职位描述工作职责：1、负责项目所有页面展示类业务开发；2、其他 基于H5页面嵌入式进行业务平台接入的需求。任职要求：1、精通HTML5+Javascript+CSS32、有丰富的手机端H5开发经验3、深刻理解手机平台上各主流浏览器之间的兼容性4、熟练使用Zepto，Backbone, Require等主流框架，并且对这些框架的内部实现有深刻的认识5、对编写高效的Javascript代码有深刻的认识，能够迅速定位到出现性能问题的代码6、有移动端混合开发模式经验者优先7、有较强的学习能力，对新技术能够快速理解8、具备良好的责任心、优秀的团队沟通与协作能力、能承受一定的工作压力", "深圳市拓思创新通信技术有限公司", "15-50人", "初创型(不需要融资)", "移动互联网,游戏", "4.7"
"拉勾", "html5", "html5", "10000-20000", "大专", "北京", "1-3年", "职位描述职位描述：1.负责移动web应用以及pc前端开发工作，开发具有高性能和高可靠性的系统，具有可扩展性；2.能够使用css、sass、less等语言实现UI设计，编写高性能的javasript实现交互设计；3.整体页面结构及样式层结构的设计、优化；4.利用HTML5相关技术开发跨平台的前端产品；5.配合UI设计人员完成设计，与后端人员进行调试、数据交互。职位要求：1.具备javascript、HTML、CSS编程经验；精通AJAX运作机制，熟悉HTML5；2.熟悉jquery、jquery-mobile、bootstrap等前端库，并了解其机制，使用过AMD/CMD规范；3.实际项目中使用过angularJS、backbone、react等前端框架，对hybird编程有一定了解；4.熟悉grunt、gulp等构建工具；5.良好的编码习惯，对工作具有强烈的责任心。", "国美金控投资有限公司", "50-150人", "初创型(未融资)", "金融", "3.8"
"拉勾", "html5", "html5", "15000-25000", "本科", "上海", "1-3年", "职位描述岗位职责：1、负责移动端Hybrid产品的H5研发工作；2、独立完成新模块的设计和开发；3、现有模块的维护和优化。岗位要求：1、大学本科及以上学历；2、一年以上相关工作经验（有互联网背景优先）；3、熟练掌握HTML5、CSS3、JavaScript等Web前端技术，有React、Nodejs开发经验者优先；4、熟悉HTTP协议，有后端开发经验者优先；5、对于新技术敏感，学习能力强;6、良好的沟通能力和团队合作能力，有强烈的工作责任心。", "上海秦苍信息科技有限公司", "150-500人", "成熟型(C轮)", "金融", "3.9"
"拉勾", "html5", "HTML5/JS游戏研发工程师（接受实习）", "5000-8000", "本科", "西安", "不限", "职位描述岗位要求：1、本科及以上学历，学习成绩良好；2、精通Javascricp编程，有web前端基础；3、熟悉面向对象编程思想，至少熟悉一门面向对象编程语言；4、对技术有热情，喜欢钻研学习新技术；5、互联网重度用户，资深游戏玩家优先；6、有Flash等游戏开发经验者优先；7、在校期间参加过科技类竞赛并获奖者优先。*公司也提供该职位带薪实习机会，需保证连续6个月以上实习时间！", "西安指舞飞游网络科技有限公司", "少于15人", "初创型(天使轮)", "移动互联网,游戏", "-"
"拉勾", "html5", "html5开发工程师", "10000-20000", "不限", "北京", "1-3年", "职位描述职位描述：1.负责HTML5手游客户端功能研发职位要求：1.计算机相关专业本科及以上学历2.有过1个及以上Egret项目经验3.熟悉Javascript或TypeScript4.对开发工作有富有热情，工作责任心强5.具有优良的编程风格和习惯6.富于团队精神和敬业精神，具有良好的自学能力和独立解决问题的能力7.可承受一定的工作压力并在指定的时间内完成高质量的程序。加分项：1. 接触过Cocos2d开发优先考虑2. 有已上架iOS/Android/HTML5产品3. 有NodeJs开发经验4. 了解微信平台接入、手游平台SDK接入者", "英雄互娱", "150-500人", "上市公司", "游戏", "4.8"
