"fromsite", "positionType", "positionName", "salary", "education", "city", "workYear", "jobDes", "company", "companySize", "financeStage", "industryField", "rate"
"拉勾", "html5", "html5", "20000-30000", "不限", "上海", "3-5年", "职位描述岗位职责：1、 负责网站前端开发、已有页面的代码重构；2、 配合后台开发人员实现前后台功能的衔接；3、 持续的优化前端体验和页面响应速度；4、 保证前台页面样式及交互效果在主流浏览器（包括但不限于IE8.0及以上、360安全浏览器、Safari、Chrome、Firefox）之间的兼容；任职要求：1、 有三年以上的前端开发经验，精通HTML5/CSS3/Javascript/Ajax等，熟练手写代码,擅长jQuery/ backbone.js/AngularJS等JS框架，并能熟练编写高性能的页面控件；2、 熟练掌握photoshop等软件，能够快速将效果图转变为html页面；3、 不限制任何专业，但要求有互联网产品经验，深刻理解以用户为中心的产品设计理念；4、 有移动Web前端开发、响应式网页开发、微信二次开发、Node.js建站等任一经验者优先；5、 工作态度认真、细心，能够踏踏实实地完成工作任务，具有良好的团队合作精神和沟通能力。", "上海信而富企业管理有限公司", "2000人以上", "成熟型(C轮)", "金融", "3.9"
"拉勾", "html5", "HTML5", "6000-8000", "本科", "成都", "1-3年", "职位描述职位描述：1. 负责HTML5页面的开发2.实现网站页面特效、JS效果；职位要求：1. 精通 HTML5、CSS3、JavaScript、Ajax等web前端技术2.熟悉各浏览器特点，能够对各种浏览器的兼容性调整；3.熟悉使用JavaScript,熟悉jQuery,能快速高效实现各种交互效果;5. 具备强烈的进取心、求知欲及团队合作精神，有较强的沟通能力；6. 性格耐心细致，责任心强，能承受较强的工作压力，具备良好的敬业精神。", "上海看榜科技有限责任公司", "50-150人", "成长型(A轮)", "数据服务", "4.4"
"拉勾", "html5", "html5", "11000-14000", "本科", "广州", "3-5年", "职位描述必备技能：1、本科以及以上学历，计算机相关专业，有三年及以上Html5开发经验；2.精通Web前端技术，包括XHTML/XML/CSS/JavaScript/Ajax等，熟悉W3C标准，对页面的性能和浏览器兼容有丰富的实践经验，熟悉Html5、CSS3.0等；3.熟悉手机端和pc端和web端的实现差异。4.熟悉各种前端框架,熟练使用Bootstrap、AngularJS、JQuery、 Easyui中部分框架；5.具有很强的团队合作能力，有良好的组织、协作和沟通能力；", "东软（广州）有限公司", "2000人以上", "上市公司", "移动互联网,教育", "5.0"
"拉勾", "html5", "HTML5游戏开发工程师", "2000-3000", "本科", "广州", "1年以下", "职位描述岗位职责：根据小游戏项目规划制作HTML5游戏。岗位要求：热爱小游戏。计算机相关专业在校生。自学能力较强。优秀的英文文档阅读能力。有HTML5游戏、Phaser、PlayCanvas等游戏引擎开发经验者优先。", "广州善游网络科技有限公司", "15-50人", "初创型(未融资)", "游戏", "4.8"
"拉勾", "html5", "高级 HTML5 移动开发工程师", "7000-10000", "本科", "北京", "3-5年", "职位描述1. 利用HTML5, javascript等相关技术开发移动客户端功能；2. 确保产品在不同平台、设备上兼具优质的用户使用体验；3. 持续优化代码的性能；4. 参与移动客户端的架构讨论和部分设计；5. 协助并完成其他各类技术开发任务.任职要求：1. 3年以上前端开发工作经验，2年以上Html5实际开发经验2. 精通html5、css、javascript，能够独立开发HTML5应用；熟悉HTML5+CSS3的新功能、canvas动画制作等3. 熟悉jquery、bootstrap、Angular等框架;4. 熟悉页面性能的优化，熟练应用开发调试工具；5. 良好的合作态度及团队精神，善于沟通，富有工作激情及责任感，能承受较高强度的工作压力6. 手持终端界面开发案例（或网页、软件界面开发和设计案例）者优先。", "天恒众航（北京）科技有限公司", "50-150人", "初创型(天使轮)", "移动互联网", "4.5"
"拉勾", "html5", "高级Html5工程师", "15000-30000", "不限", "北京", "不限", "职位描述公司简介（关于 TalkingData）：TalkingData（北京腾云天下科技有限公司）成立于2011年9月，2013年完成千万美元A轮融资（北极光领投），2014年完成数千万美元的B轮融资（MileStone和软银领投），总部位于北京，在美国硅谷，日本东京，上海都设有分公司。经过近四年的高速发展，TalkingData逐步打造了由开发者服务平台、数据服务平台、数据商业化平台为中心的数据生态体系，覆盖超过13亿独立智能设备，服务8万多款移动应用和6万多应用开发者，每天处理超过10TB数据、数十亿次会话请求，拥有近千台服务器组成的大数据集群。公司服务的客户既有腾讯、百度、网易、搜狐、360、Google、Yahoo、Zynga、宝开、聚美、唯品会、嘀嘀打车等知名互联网企业，也有中国银联、招商银行、兴业银行、中信银行、平安保险、国信证券、海通证券、Orchirly、碧桂园、亨得利、全城热恋等传统行业巨头——我们在移动互联网发展过程中创造数据价值，并帮助传统行业积极拥抱未来。公司提供优厚的待遇以及期权，氛围积极开放，成长空间巨大。地处东直门，交通便利。职位描述：1、根据产品需求，分析并给出最优的页面前端结构解决方案；2、持续的优化前端体验和页面响应速度；3、和后台工程师合作完成技术方案设计和实现；4、不断寻求并实施各种改进的思路和方案。职位需求：1、有3年以上Webapp、Mobile Web程序开发经验；2、精通HTML5/CSS3/Javascript/nodejs等前端技术；3、熟悉Jquery、Vue、AngularJs等框架；3、熟悉响应式、前端性能优化，有一定原生JS开发经验。", "北京腾云天下科技有限公司", "150-500人", "成熟型(C轮)", "移动互联网", "4.0"
"拉勾", "html5", "HTML5（移动学习平台全站开发）", "8000-15000", "本科", "上海", "1-3年", "职位描述岗位职责利用JS或 PHP等相关技术开发移动平台的产品开发；负责公司产品微信端、微网页及推广页面设计；规划产品界面风格、视觉效果和交互体验，提升用户体验；持续的优化前端体验和页面响应速度，并保证兼容性和执行效率；配合设计师完成模块详细设计，配合产品经理一起研讨技术实现方案，进行应用及系统整合。任职资格计算机编程、、软件工程、电子信息等相关从业经验；熟悉JavaScript开发,JavaScript、AJAX，熟练应用至少一种JS框架，如jQuery、Bootstrap等；了解PHP、HTML5、CSS3的优先考虑。", "上海悠学信息科技有限公司", "15-50人", "初创型(不需要融资)", "企业服务,教育", "4.5"
"拉勾", "html5", "HTML5", "15000-30000", "大专", "北京", "3-5年", "职位描述岗位职责：1.能够独立负责移动网页端开发，并对HTML5移动应用、网站的开发、优化、维护等；2.对自己的项目有有效的时间管理和质量管理，能在限定的时间内保证质量完成开发3、配合后台开发工程师，完成页面的交互功能、联调等工作。任职要求：1、 熟悉HTML5 + CSS3，能编写扩展性、兼容性良好的页面结构；2、 精通 JavaScript，能熟练使用 jQuery,对JS的性能优化有一定了解；3、 熟练使用ionic、Angularjs、Bootstrap中至少一种常见的webapp框架;3、 有Java语言开发经验者优先；4、 对互联网产品有一定程度的理解，能够把控项目进度，攻克技术难点；5、 大学本科及以上学历，3-5年移动网页开发经验，计算机相关专业。", "北京良医联盟科技有限公司", "150-500人", "成长型(A轮)", "移动互联网,医疗健康", "3.9"
"拉勾", "html5", "html5前端开发工程师", "10000-20000", "本科", "深圳", "3-5年", "职位描述不论你是K歌达人还是萌萌哒吃货，每月一次的集体活动总能满足你！怕进步太慢，没事，CEO和CTO最喜欢捉人上课了，不管是追不到妹纸减不了肥，他们都会和你推心置腹地谈谈。每年一次的旅游怎么少的了，不管是要去游山玩水还是和菇凉海边谈谈人生和理想，我们都满足你！当然，你的小味蕾我们也考虑到了，甜的咸的辣的通通都有，小零食算什么，下午茶喝不完带回家有木有！我们为您提供：完善的薪酬、福利体系+专业的培训体系+公平公正的晋升体系=一个梦想的平台！职责描述：1、负责公司app及微信公众平台内html5页面应用的架构、开发和维护，公司产品管理后台的界面架构、开发和维护；2、开发基于HTML5技术的可灵活定制、可扩展的前端UI组件；3、跟踪研究前沿的前端技术，并应用到公司的产品开发当中。职位要求：1.精通HTML5/CSS3/JavaScript/JQuery/Ajax等Web开发技术，熟悉W3C标准、MVC框架，具有WebApp或混合App实际项目开发经验；2.熟练Web性能优化，熟练使用移动JS库和开发框架；3.理解HTTP协议，至少熟悉一种模板引擎，能很好的与后端开发人员配合；4.对主流浏览器兼容性了解，并有相关问题的解决经验；5.至少了解一种主流Web服务器，如Apache、Tomcat、IIS等；6.掌握Photoshop、Illustrator、CorelDraw等设计工具者优先；7.掌握AngularJs、Node、Java者，掌握Grunt自动化者优先；8.热爱前端技术、一年以上实际工作经验，高级工程师要求三年以上工作经验。", "深圳市爱康伟达智能医疗科技有限公司", "15-50人", "成长型(A轮)", "移动互联网,O2O", "-"
"拉勾", "html5", "html5，web前端（兼后台）工程师，技术合伙人", "13000-25000", "本科", "北京", "3-5年", "职位描述职位描述1，负责“合拍儿”共媒体产品的webapp，分享页面，官方品牌活动的业务前端研发。  2，为核心资源圈的申请业务提供可靠的技术保障和技术支持。3，与各端工程师探讨设计，给出能够落地的技术解决方案。任职资格：1、掌握HTML5、CSS、Javascript及相关开源库的原理和使用。2、熟悉各浏览器兼容性问题，能够进行前端页面性能优化，了解XSS防范技术。3、能够高还原度的完成设计师的设计图，希望能够对设计和产品提出自己的合理建议。加加分项：1），追求用户体验，并有相关作品2），掌握一门服务端语言，如node，php，java3），有异于常人的能力，如毅力，执行力，审美能力等4），有独立的个人作品 任职魅力：如果你有技术想法，如果你有创业欲望，如果你有开创性的姿态，请联系我们，在这里的每位“鹰雄”都匠心独运，情怀如初，共享至上；公司全面合伙人制，为有创业创新梦想的兄弟们，服务梦想和平台。如果你懂得后台操作以及环境搭建的兄弟（PHP等），能够加分哦，并提升成为我们的合伙人。期待您的加入", "北京合拍环讯科技有限公司", "15-50人", "初创型(天使轮)", "移动互联网,社交网络", "4.0"
"拉勾", "html5", "html5开发工程师", "15000-25000", "本科", "北京", "3-5年", "职位描述职位描述：1、负责PC端及移动端的应用架构设计；2、利用JS、CSS或HTML5等技术，完成页面开发制作及维护工作；3、设计及实现前后端的数据交互，对代码质量及进度负责；4、配合产品经理和UI设计师，研究并改善用户体验。任职要求：1、本科及以上学历，计算机相关专业，3年或以上前端开发工作经验；2、精通JavaScript、Ajax、HTML/XHTML、CSS等基础网页制作开发技术3、熟练掌握并使用符合W3C标准的Html5、JavaScript和CSS3等相关技术；4、可熟练运用移动端框架如：jQueryMobile、SenchaTouch、iWebkit、Zepto等；5、理解Web标准，对可用性、可访问性、页面兼容性等相关知识有实际的了解；6、对用户可用性，用户体验，用户研究等相关知识有深入的了解和实践经验；7、具备一定的美工设计经验。", "联通支付有限公司", "150-500人", "成长型(不需要融资)", "移动互联网", "4.1"
"拉勾", "html5", "HTML5移动端开发实习生", "5000-10000", "大专", "北京", "不限", "职位描述任职资格：1.应往届理工科相关专业（如计算机、机械、电子信息、通信、环境园林、土建等）；2.应届生有无经验均可，有经验者经考核合格直接上岗，无经验且符合条件者可申请实训后上岗，入职转正薪资5000~8000元；3.对IT/互联网行业不感兴趣者，请勿投简历(面试时请携带学历证书等相关证件)岗位职责：1、公司有完善的新人培训体系，新人在项目经理带领下掌握HTML、CSS、Linux、Mysql、JavaScript及HTML5等；2、由项目经理带领完成高并发量大型网站架构等项目；待遇：1、试用期1-3个月,转正后享有平均月薪范围5000-8000元；2、五险一金,年底双薪,超长带薪年假,公司组织聚餐、KTV、烧烤、季度旅游等；3、公司有广阔晋升空间，技术工程师 项目组长 项目/产品经理 技术总监；工作时间:09：00至17:00(双休)", "北京优才创智科技有限公司", "150-500人", "成长型(A轮)", "教育", "3.5"
"拉勾", "html5", "html5前端实习", "3000-6000", "本科", "苏州", "应届毕业生", "职位描述工作内容：1.开发手机端HTML5互动页面；2.开发手机端HTML5小游戏；3.设计开发手机端应用/小游戏的数据接口（PHP或Nodejs）。技能要求1.精通JavaScript；2.精通HTML/CSS/CSS3；3.能熟练使用Photoshop；4.具备至少一门后端语言编程能力（PHP或Nodejs)。满足以下条件之一可以优先考虑：1.有创意且有趣；2.会WebGL/Cocos-2D/、3D/Unity3D；3.为广告/公关公司开发过H5互动页面/小游戏并上线的；4.有手机游戏开发经验。", "北京蓝胖子科技有限公司", "50-150人", "成长型(不需要融资)", "移动互联网,其他", "-"
"拉勾", "html5", "HTML5", "8000-15000", "本科", "佛山", "1-3年", "职位描述2016国信证券金融矿工团队秋季社会招聘推荐奖：1000元，自荐奖：1000元国信证券金融矿工团队诚招合伙人！期待不吹牛、做实事、人品正的你加入！好平台：优秀的平台，公司重点项目，快速成长通道，优秀的队友好队友：项目成员有来自BAT、经验丰富的老腊肉，也有来自知名高校的小鲜肉好福利：五险一金，春节慰问金，企业年金，补充商业保险，带薪休假，健康体检，业余活动，该有的一样不少，别人没有的，我们也有！工作地点：佛山市禅城区季华六路九鼎国际金融中心保底收入，上不封顶，it’s up to youH5开发工程师（1人）岗位职责：1、负责Web/WebAPP等前端开发工作；2、独立完成功能模块编写、测试、维护；岗位要求：1、本科及以上学历，计算机或相关软件专业； 2、熟悉WEB前端技术，对符合WEB标准的网站重构有丰富经验，有成功作品；2、理解并掌握Javascript语言核心技术DOM、BOM、Ajax、JSON等，对Javascript框架应用（如jQuery/bootstrap等）有一定的经验； 3、掌握至少一门非前端开发语言（如PHP/Java/Python/Ruby/NodeJS等）优先；4、对CSS/Javascript性能优化、解决多浏览器兼容性问题有一定的经验；5、对用户体验、交互操作流程、及用户需求有一定了解；6、具备优秀的沟通和协调能力、较强的服务意识及团队合作能力，热爱技术，敬业。薪酬： 8～15K起，项目分红权加分项爱好运动，对互联网证券感兴趣，喜欢炒股", "国信证券股份有限公司佛山季华六路证券营业部", "150-500人", "上市公司", "金融", "3.6"
"拉勾", "html5", "HTML5", "10000-15000", "本科", "北京", "1-3年", "职位描述岗位职责：1.负责相关课程教学工作，按进度完成教学任务。2.根据教学安排完成教学视频，校园宣讲等工作。2.根据需要，改进教学方法，完善教学体系。3.参与学术交流与研讨，不断提升业务水平任职资格。任职要求：1.精通PHP核心语法、nodejs、MongoDB及PHPCMS模板开发和二次开发，对就业班上述某个阶段的课程内容做到深入浅出。2.表达能力强，声音清晰自然，个性开朗，乐于与人交流。3.三年以上PHP实际项目编程经验, 熟悉PHP模板技术及两种以上PHP框架者优先。4.了解W3C标准，熟练掌握HTML、CSS、JavaScript、XML、AJAX、jQuery等知识,有大型WEB开发经验者优先。5.必须有很强的动手编码能力，以编码驱动教学，拒绝对着ppt讲课。6.有过1年以上教学经验，并且是所在培训机构学生口碑最好的讲师，优先考虑。7.熟悉项目开发流程，熟练使用GIT/SVN等版本控制软件    ", "北京华清远见科技发展有限公司", "150-500人", "成熟型(D轮及以上)", "教育", "3.0"
"拉勾", "html5", "html5", "15000-25000", "不限", "深圳", "1-3年", "职位描述岗位职责：1、 负责网站前端开发、已有页面的代码重构；2、 配合后台开发人员实现前后台功能的衔接；3、 持续的优化前端体验和页面响应速度；4、 保证前台页面样式及交互效果在主流浏览器（包括但不限于IE8.0及以上、360安全浏览器、Safari、Chrome、Firefox）之间的兼容；任职要求：1、 有三年以上的前端开发经验，精通HTML5/CSS3/Javascript/Ajax等，熟练手写代码,擅长jQuery/ backbone.js/AngularJS等JS框架，并能熟练编写高性能的页面控件；2、 熟练掌握photoshop等软件，能够快速将效果图转变为html页面；3、 不限制任何专业，但要求有互联网产品经验，深刻理解以用户为中心的产品设计理念；4、 有移动Web前端开发、响应式网页开发、微信二次开发、Node.js建站等任一经验者优先；5、 工作态度认真、细心，能够踏踏实实地完成工作任务，具有良好的团队合作精神和沟通能力。", "上海信而富企业管理有限公司", "2000人以上", "成熟型(C轮)", "金融", "3.9"
"拉勾", "html5", "Html5工程师", "15000-30000", "不限", "北京", "不限", "职位描述公司简介（关于 TalkingData）：TalkingData（北京腾云天下科技有限公司）成立于2011年9月，2013年完成千万美元A轮融资（北极光领投），2014年完成数千万美元的B轮融资（MileStone和软银领投），总部位于北京，在美国硅谷，日本东京，上海都设有分公司。经过近四年的高速发展，TalkingData逐步打造了由开发者服务平台、数据服务平台、数据商业化平台为中心的数据生态体系，覆盖超过13亿独立智能设备，服务8万多款移动应用和6万多应用开发者，每天处理超过10TB数据、数十亿次会话请求，拥有近千台服务器组成的大数据集群。公司服务的客户既有腾讯、百度、网易、搜狐、360、Google、Yahoo、Zynga、宝开、聚美、唯品会、嘀嘀打车等知名互联网企业，也有中国银联、招商银行、兴业银行、中信银行、平安保险、国信证券、海通证券、Orchirly、碧桂园、亨得利、全城热恋等传统行业巨头——我们在移动互联网发展过程中创造数据价值，并帮助传统行业积极拥抱未来。公司提供优厚的待遇以及期权，氛围积极开放，成长空间巨大。地处东直门，交通便利。职位描述：1、负责web端和mobile端前端页面设计和开发；2、负责界面框架重构和易用性优化；3、负责跨浏览器兼容处理，多分辨率屏幕适配；4、配合开发工程师完成数据展示和程序的嵌套。职位要求：1. 熟练掌握html5、css3，熟悉jquery、zepto及其js框架；2. 熟悉移动端兼容性解决方案，能够解决多浏览器版本兼容问题；3. 熟练使用JS实现Json、XML格式的数据发送与数据解析；4. 了解Java等编程语言，对前后端合作开发有一定的认知。", "北京腾云天下科技有限公司", "150-500人", "成熟型(C轮)", "移动互联网", "4.0"
"拉勾", "html5", "html5", "15000-20000", "本科", "上海", "1-3年", "职位描述职责：1. 负责优酷VR H5页面的开发；2. 设计和研发基于WebGL的VR展示；3. 持续优化前端体验和页面响应速度，并保证兼容性和执行效率；4. 关注前沿技术；要求：1. 计算机相关专业本科及以上学历（985，211 大学优先），2年以上前端开发相关经验；2. 精通HTML, JS等前端开发技术，对前端开发框架有深入了解；3. 精通WebGL/OpenGL技术；4. 学习能力强，强烈的责任心，优秀的沟通能力及团队合作精神，喜欢研究新技术，乐于知识分享；", "上海全土豆文化传播有限公司", "2000人以上", "上市公司", "移动互联网", "3.8"
"拉勾", "html5", "html5开发工程师", "9000-18000", "大专", "广州", "1-3年", "职位描述1.负责APP、微信等平台中的Html5页面，优化代码并保持在各浏览器下、各个手机设备良好的兼容性；2.独立完成网站部署及Web前端开发工作；3.与设计、后台人员相互配合，收集用户反馈，分析用户行为及需求，对产品进行持续的优化和改进。岗位要求：1.2年以上前端开发工作经验；2.运用XHTML、CSS进行合理的网页制作，能手写HTML/CSS/JavaScript/ActionScript 代码 ；3.有兼容多浏览器（chrome/firefox/ie/Safari等）的Web应用的开发经验，深刻理解各主流浏览器之间的兼容性并能快速开发和调试；4.精通DIV+CSS和W3C标准(HTML5)优先，JavaScript/XML/HTML5/CSS3等Web前端技术，理解AJAX运作机制，有使用常见AJAX框架；能够熟练运用至少一款主流的JS（jQuery、Zepto）框架，具有良好的代码风格、接口设计与程序架构；5、积极进取，学习适应能力强，有责任心，善于沟通，具备良好的团队合作精神和抗压能力，分析问题和实际动手能力强；5.对新兴web标准和web发展趋势有良好洞察力。", "广州盛成网络科技股份有限公司", "150-500人", "上市公司", "移动互联网,社交网络", "3.9"
"拉勾", "html5", "html5", "10000-15000", "本科", "广州", "1-3年", "职位描述岗位职责：1、负责规划和讲授前端开发（HTML5）的课程2、负责实习实训、项目实战的教学工作3、负责制定教学计划、完善课程体系，即各类实训方案岗位要求：1.2年以上前端开发工作经验；2.熟悉html5、css3，javascript,jq等开发技术，熟悉jquery Mobil库；3.有html5项目开发经验，能运用HTML5开发Mobile APP界面和体验效果的应用；4.有Mobile Web的开发经验，能开发兼容移动版浏览器的应用，并且能实现各种交互效果；5.对新兴web标准和web发展趋势有良好洞察力；6.热爱教育事业，责任心强，沟通能力强。", "蓝鸥科技有限公司广州分公司", "150-500人", "初创型(未融资)", "教育", "-"
"拉勾", "html5", "html5前端开发", "7000-10000", "大专", "厦门", "1-3年", "职位描述岗位职责1、负责移动产品的页面制作、实现网站用户交互的效果；2、负责js相关组件和效果的改善与开发；3、网站页面在各主流浏览器中的兼容性调整,性能优化。4、配合UI设计师与后台开发人员共同完成项目。职位要求：1、有极强的责任感，并能够承担较强的工作压力，具有良好的沟通协作能力，富有团队精神.2、2 年以上的移动前端开发工作经验；有html5开发经验者优先；3、理解并掌握Javascript语言核心技术DOM/BOM/Ajax/JSON等,精通javascript框架应用（如prototype/jQuery/YUI/Ext等）,能独立开发常用组件；4、精通Html/Css/Javascript,熟悉W3C标准,对页面性能和浏览器兼容有丰富的实践经验；5、对不同设备及平台有一定了解,掌握浏览器的兼容性区别（Win/Mac,Chrome/safari/Mozilla/IE）；6、熟悉算法和数据结构,对JavaScript代码的执行效率有较强的优化能力；7、热爱前端技术,有高度的技术敏感度,广阔的技术视野. ", "上海齐家网信息科技股份有限公司", "2000人以上", "成熟型(D轮及以上)", "O2O ,生活服务", "4.3"
