"fromsite", "positionType", "positionName", "salary", "education", "city", "workYear", "jobDes", "company", "companySize", "financeStage", "industryField", "rate"
"拉勾", "web前端", "web前端", "8000-16000", "大专", "武汉", "3-5年", "职位描述岗位描述： 1、利用(X)HTML/CSS/JavaScript/AJAX等各种Web技术进行网页产品的界面开发,配合后台开发人员实现网站界面和功能； 2、协助平台策划设计页面交互流程，制作符合W3C标准的代码，致力于通过技术提高用户体验； 3、优化代码并保持良好的ie6 ie7 ie8 ff opear 谷歌等浏览器兼容性；岗位要求： 1.大学专科以上学历，3年以上WEB前端应用开发；（能力强者可忽略学历要求）2.精通HTML/XHTML、CSS，熟悉页面架构和布局，熟悉HTML的文档对象模型（DOM）,对Web标准和标签语义化有较深入的理解； 3.熟练使用Ajax、JavaScript等前端技术，掌握面向对象编程思想，能够熟练应用第三方的开源JavaScript库(如JQuery等)； 4.有良好的编程习惯，能够书写精练、可维护性高和易扩展的JS代码，能最简化JS CSS XHTML代码，对前端页面优化有一定了解；5.理解W3C规范，对页面交互流程、用户体验有自己的见解。 6.拥有良好的沟通能力和团队协作能力，有积极解决各种难题的能力。 7.熟悉Asp.net、flash actionscript语言者优先考虑。", "武汉金豆医疗数据科技有限公司", "50-150人", "成长型(A轮)", "医疗健康,数据服务", "4.3"
"拉勾", "web前端", "Web前端工程师(高级)", "8000-15000", "大专", "苏州", "3-5年", "职位描述岗位职责：1、参与Web产品线前端开发，负责项目核心代码的研发工作；2、精通Web前端技术，除(X)HTML/CSS/JavaScript、html5/css3等常规技术点外；3、需在在 JS框架（Jquery、Jquery Moblie、Extjs、YUI等）、PhoneGap、NodeJs等拥有一技之长；4、精通HTML5动效开发；5、有大型门户/电子商务站点开发经验、有Mobile App/Mobile Web 开发经验；6、自主开发过Js框架者优先；7、负责PC和移动端的前端页面开发；8、协同后端工程师和UI设计师完成兼容性良好的前端页面制作任职资格：1、2年以上Web前端开发经验，能够独立完成前端页面开发工作；2、有良好的JS、CSS以及HTML代码风格；3、熟练使用jQuery等主流库，会原生JavaScript优先考虑；4、精通HTML、CSS+Div布局，能熟练使用CSS3；5、熟悉移动端HTML5动效开发；6、如果有响应式及移动WEB开发经验者佳；7、了解至少一种后台开发语言（如：PHP），了解前后端配合的流程（通过接口和后端进行交互）；8、有创新思想，敢于挑战新事物，了解用户体验。9、责任心强，良好的对外沟通和团队协作能力，能承受工作压力", "苏州持创信息科技有限公司", "50-150人", "成长型(A轮)", "移动互联网", "3.8"
"拉勾", "web前端", "web前端开发工程师 [实习]", "2000-4000", "本科", "佛山", "不限", "职位描述岗位职责：1、负责网站或APP前端开发工作；2、根据需求和设计进行手机网站或webapp开发和维护；与项目相关人员配合共同完成手机应用软件的开发设计工作；3、配合服务器端开发人员进行应用及系统整合。任职资格：1、具备 HTML5、CSS3 开发技术，有响应式页面开发经验；2、精通DIV+CSS和W3C标准，熟练运用XHTML,CSS，深刻理解手机平台上各主流浏览器之间的兼容性；3、熟悉HTML5特性，了解HTML5最新规范，能够熟练运用HTML5特性构建移动端的WebApp；4、熟悉JS/CSS/ HTML 5在各种手机分辨率的兼容和性能优化；5、善于使用前段的基本调试工具，熟练手写代码，并熟练掌握HTML5、CSS3、JavaScript、Ajax、jQuery等Web前端技术；6、具备良好的服务意识、责任心、较强的学习能力、优秀的团队沟通与协作能力、能承受一定的工作压力。", "佛山市螺丝科技有限公司", "少于15人", "初创型(不需要融资)", "移动互联网,电子商务", "-"
"拉勾", "web前端", "web前端", "8000-16000", "不限", "杭州", "1-3年", "职位描述2年以上web前端工作经验，能够独立负责web端开发；精通HTML、CSS、Javascript、AJAX、JQuery等前端技术，熟悉Bootstrap、Lesscss等框架；理解浏览器的兼容性问题，能够根据要求提供兼容方案；有良好的沟通能力和团队协作能力，有团队管理经验者优先考虑；有NodeJS、AngularJS等经验者更佳。", "惠龙易通国际物流股份有限公司", "500-2000人", "成熟型(不需要融资)", "移动互联网,电子商务", "4.6"
"拉勾", "web前端", "Web前端工程师", "6000-10000", "大专", "广州", "1-3年", "职位描述【岗位职责】1.配合产品经理和设计师快速实现前端界面；2.持续改进当前产品的前端功能，优化性能，改善访问体验；3.参与产品的需求分析和功能设计过程，帮助最优化产品的设计。【任职要求】1.掌握HTML/XHTML，CSS，熟悉页面架构和布局；2.熟悉javascript和ajax的技术原理；3.熟练使用常见的Javascript类库，如jQuery等；4.优秀的沟通与表达能力及较强的自我驱动能⼒；5.对前端技术有持续的激情，追求最佳用户体验，责任心强，善于学习新事物；", "贵州格安科技有限公司广州分公司", "50-150人", "成长型(A轮)", "数据服务", "4.1"
"拉勾", "web前端", "web前端", "10000-15000", "不限", "上海", "1-3年", "职位描述职位职责：1. 负责产品前端页面代码编写；2. 负责网站用户界面交互效果的实现；3. 优化网站用户体验，通过前端的工作提高产品的用户体验。条件要求：1. 具有2年以上Web开发经验，了解网站开发的执行流程及规范，有大型门户网站开发经验者优先；2. 熟练掌握HTML、CSS、DIV布局技术，熟悉W3C网页标准；3. 熟悉各主流浏览器的兼容技术方案，熟练使用多种Web调试工具；4. 熟悉HTML5、AJAX或AS等前台相关技术者优先；5. 熟练掌握设计相关工具软件flash/PS/DW/FW/Illustrator等设计移动终端/无线业务者优先；6. 具备良好的沟通表达能力和团队合作精神，对待工作有强烈的责任心和积极性。", "上海天吕农业科技股份有限公司", "50-150人", "成长型(不需要融资)", "O2O,移动互联网", "-"
"拉勾", "web前端", "WEB前端工程师", "8000-15000", "不限", "上海", "3-5年", "职位描述任职要求：1、中专以上学历，具有2年以上相关工作经验；2、熟悉JavaScript，至少一种开发框架，制作页面常用动态效果；3、熟练掌握html/css语法，可手写html代码，熟悉HTML/XML/JSON前端技术，熟悉DIV CSS布局；4、对浏览器兼容性、代码可维护性、前端性能优化、SEO等有研究。岗位职责：1、根据网页设计图制作html,css,js （PC或移动端）；2、按照UE图及UI规范制作html页面（PC或移动端）；3、根据产品需求制作js动态效果；4、配合后端开发团队，确保有效对接，高效开发；5、制作的页面符合标准，兼容主流浏览器。", "上海久游网络科技有限公司", "150-500人", "成熟型(D轮及以上)", "移动互联网,游戏", "5.0"
"拉勾", "web前端", "web前端开发工程师", "6000-7000", "本科", "西安", "1-3年", "职位描述岗位职责：1、负责公司产品的前端页面制作，能高质量地完成页面上各种交互效果的实现；2、熟练将UI设计师的成果转化为静态的HTML页面，并配合后端开发人员完成接口的定义、开发和联调；岗位要求：1、2年以上前端开发相关经验；2、至少熟悉一门JS框架，熟练使用angularJS；3、熟悉HTML5/CSS3/JavaScript，熟悉页面架构和布局，能快速地手写符合W3C标准、兼容主流浏览器的代码；4、熟悉手机端网页开发，能对不同手机屏幕做适配 ,熟悉ionic；5、有使用grunt或gulp经验者优先；", "杭州联云汽车科技有限公司", "15-50人", "初创型(不需要融资)", "移动互联网,硬件", "-"
"拉勾", "web前端", "web前端", "2000-4000", "本科", "杭州", "不限", "职位描述任职要求：1、计算机或者相关专业，统招全日制本科及以上学历； 2、熟悉数据结构和算法，有扎实的计算机功底和编码能力；3、扎实的HTML/CSS基础，熟悉页面架构和布局，熟悉Bootstrap；4、熟悉使用常见的JavaScript类库, 如jQuery、AngularJS等；5、良好的问题理解能力，能够理解以及处理复杂逻辑；6、具备较强的自学能力，团队精神及抗压能力；7、较好的英语读写能力。公司福利：*带薪年假*社保*双休*餐补*年底双薪*高温补贴*团队旅游*节假日福利*弹性工作*人性化办公", "杭州朝辉电子信息科技有限公司", "15-50人", "初创型(未融资)", "移动互联网,O2O", "-"
"拉勾", "web前端", "web前端高级", "9000-12000", "不限", "成都", "5-10年", "职位描述岗位要求：1.掌握Web前端技术HTML5、XML、CSS、原生 JavaScript 及相关技术；2.具有3年及以上web前端开发工作经验，熟悉OOP，能独立承担和推进开发工作，对前端代码优化、代码规范及安全开发有一定的经验；3.熟悉Jquery、Bootstrap、AngularJS、EXT等扩展应用；4.对JavaScript性能、多浏览器兼容性、面向组件开发有自己的解决方案；5.理解Prototype/jQuery/YUI/Ext/DoJo框架的工作原理；6.熟悉至少一种第三方图表框架（如：highcharts、eCharts等），并理解其实现原理；7.责任心强，具备良好的沟通能力和团队合作精神8.了解Java开发语言岗位职责：1、主导或参与公司各个项目前端框架、组件设计、开发和编码；2、提取前端公共组件；3、配合后端实现功能前端交互；4、编写前端设计文档和技术文档等；", "成都中科合迅科技有限公司", "150-500人", "初创型(未融资)", "移动互联网,企业服务", "3.7"
"拉勾", "web前端", "web前端", "6000-8000", "大专", "昆明", "1年以下", "职位描述岗位要求：1. 具备较强的逻辑思维能力、学习能力和沟通能力；富有责任心和团队协作精神；做事严谨、执行力强；2. 达到计算机软件专业本科以上水平；3. 一年以上运用HTML5特性构建移动端的WebApp开发经验；4. 熟悉HTML5、css3、javascript、jQuery等前端技能。5. 了解sass、compass优先、了解React优先、有过微信端开发优先岗位职责：1． 维护并优化公司产品，及新产品的研发；2． 使用html5构建webApp；3． 与设计师、产品合作实现产品前端和交互方面的开发需求；4． 研究HTML5跨平台的应用，重点在移动端；", "深圳市艾可思信息技术有限公司昆明分公司", "50-150人", "成长型(A轮)", "移动互联网,电子商务", "-"
"拉勾", "web前端", "web前端（js）", "10000-15000", "本科", "上海", "1-3年", "职位描述任职要求：1、熟练掌握 web 相关技术（HTML、CSS、JavaScript 等）；2、熟悉常见跨浏览器问题，具备良好的前端性能优化经验；3、熟悉了解 HTTP 相关网络协议；4、熟悉主流 JavaScript 库或框架并了解基本框架设计原理（如 Angular.js、React、Vue 等）；5、对前端技术具有持续的热情，热衷研究并跟进当下相关概念（如 Web Component，Virtual DOM，Scoped Style 等）；6、具备完整的前端构建脚本编写经验（如 grunt / gulp/ webpack）；7、具备完整的产品前端开发经验（需提供线上地址）；8、具有一定的创新精神，良好的审美及语言表达能力；9、具备高度的责任心和良好的团队合作精神；", "上海图聚智能科技股份有限公司", "150-500人", "成熟型(C轮)", "移动互联网,O2O", "4.1"
"拉勾", "web前端", "web前端", "12000-24000", "本科", "深圳", "1-3年", "职位描述工作职责：负责Prism可视化系统平台的WEB端开发与优化。用html5开发和管理公司主页。参与项目产品研发，及时配合团队实现产品界面和功能。岗位要求：有2年以上Web设计和开发经验。精通HTML5, CSS3,Javascript等基本技术，熟悉W3C标准，有较强的页面制作功底。熟悉主流前端框架，如Jquery, bootStrap,AngularJS等。熟悉各大浏览器的兼容性，并有相关的处理经验。熟练使用Git代码管理工具及其管理方法 (如Pull Request，git flow)。", "深圳市前海源伞科技有限公司", "少于15人", "初创型(天使轮)", "其他,信息安全", "4.7"
"拉勾", "web前端", "web前端", "12000-22000", "不限", "北京", "3-5年", "职位描述岗位职责：1、参与设计产品后台重构方案，并带领团队完成产品后台重构。2、参与现有前端组件库进行维护和升级。3、配合产品后端开发人员完成产品标准版前端功能。4、过程经验积累，组织过程资产沉淀，文档编写等。5、进行新技术调研，持续对产品前端进行维护和升级。岗位要求：1、2年以上web开发经验；2、精通Web及前端技术（包括 HTML，CSS，JavaScript，AJAX，JSON）；3、精通前端面向对象开发，具有主流前端框架开发经验，如AngularJS，React，Vue.js等；4、了解前端架构设计理念，熟练使用前端构建体系，有实际前端系统架构设计经验者优先；5、有良好的编码习惯，能够改善编码规范，降低软件维护成本；6、至少熟悉一种服务器端开发语言，具有较强的代码走读能力，精通J2EE体系结构者优先；7、有过电子商务相关项目开发经验者优先，能够参与需求评审检查需求缺陷并提出合理设计方案；8、能够承担较强的工作压力，保证所负责相关领域工作进度及业务支持；9、具备较强的沟通交流、团队合作能力。", "北京科码先锋软件技术有限公司", "150-500人", "成长型(不需要融资)", "电子商务", "3.5"
"拉勾", "web前端", "web前端", "18000-30000", "大专", "深圳", "3-5年", "职位描述岗位职责：1、Web前端工程师，负责PC端云服务平台开发2、参与技术预研和技术重构，参与团队交流，协助产品开发；任职要求：1、熟悉JavaScript/HTML5/CSS3等前端开发技术，有响应式页面开发经验；2、熟练使用jQuery、Zepto、Bootstrap，熟悉Reacts、Vuejs，能与后台开发人员一起编写高性能程序；3、熟悉JavaScript/HTML5/CSS3在各种手机分辨率上的兼容和性能优化；4、熟悉HTML5特性，了解HTML5最新规范，能够熟练运用HTML5特性构建移动端的WebApp；5、善于使用前端的调试工具和自动化工具，熟练手写代码；6、具备良好的服务意识、责任心、较强的学习能力、优秀的团队沟通与协作能力、能承受一定的工作压力。7、熟练使用Webpack、ES6、Reactjs或者Vuejs进行开发的优先考虑", "深圳市金凯林贸易有限公司", "500-2000人", "成熟型(不需要融资)", "金融,数据服务", "3.3"
"拉勾", "web前端", "web前端工程师", "12000-24000", "本科", "深圳", "3-5年", "职位描述岗位描述：1、参与公司网页端产品的需求分析、产品规划；2、制定Web端开发框架，负责前端Web开发、移动端HTML5开发；3、持续优化前端体验、响应速度，并保证较强的兼容性、安全性。岗位要求：1、本科以上学历，计算机或相关专业，3年以上Web前端开发工作经验；2、熟练运用Web前端技术，能熟练使用css预编译语言，具有nodejs项目开发经验，熟悉ES6标准加分；3、熟练掌握HTML5/CSS3移动端网页开发技术，有react，angluarjs开发经验者加分；4、对浏览器兼容性、前端安全防范、响应式布局有一定实践经验；5、有证券行情类软件前端研发经验者优先。", "深圳齐牛互联网金融服务有限公司", "15-50人", "初创型(天使轮)", "金融", "3.1"
"拉勾", "web前端", "web前端", "15000-30000", "不限", "北京", "3-5年", "职位描述岗位职责：1、负责公司移动端项目APP产品、HTML5活动的项目前端开发；2、根据UI组同事的输出物，实现交互设计并向开发人员交付HTML及相关文档；3、对于产品设计给出相应的UI方案并进行实施，持续改善用户交互体验；4、完成上级交办的其他工作任务；任职要求：1、精通JavaScript语言，具备开发原生JS程序能力2、熟悉HTML/HTML5/XML、CSS/CSS3等前端开发技术，2年以上开发经验3、精通基于JQuery等JavaScript库的AJAX开发4、熟悉NodeJS、AngularJS等框架或其他前端MVC（MVVM）框架5、精通响应式页面开发，并了解在手机端动画效果优化6、了解LESS或SASS、按需加载和模块化并能熟练 运用以及前端优化方法7、能够使用gulp或grunt自动化构建8、具有良好的编码风格和开发习惯，有上进心，责任感强，自我学习能力强，善于沟通；9、熟悉java语言优先，适应短期1周内出差优先；", "北京融贯电子商务有限公司", "150-500人", "成长型(B轮)", "移动互联网,电子商务", "3.4"
"拉勾", "web前端", "web前端开发工程师", "6000-10000", "大专", "武汉", "1-3年", "职位描述【我们的工作】1、根据设计出的PSD以及产品需求文档制作符合产品需求的静态页面；2、同后端工程师紧密合作，高效地完成前后台交互的开发工作；3、分析、优化网站前端性能，为用户提供更好的体验；4、完成前端JS优化和封装，承担前端JS核心组件的开发；5、研究前端新技术，不断优化、创新并运用于实际工作中；【我们的要求】1、计算机或相关专业大专及以上学历，1-3年工作经验，有手机WEB端页面开发经验者优先考虑；2、精通JavaScript、HTML(5)、CSS(3)，对W3C标准有一定的理解；3、熟悉主流的前端库和框架（jQuery/AngularJS/React/BootStrap等）；4、熟悉ajax、json、jsonp、DOM、BOM等前端开发技术，掌握面向对象编程思想；5、熟悉不同浏览器之间的兼容性、掌握在不同浏览器中的调试技巧；6、熟悉一种或一种以上后端开发语言(Java/PHP/Ruby等)优先。7、有良好的代码习惯，要求结构清晰，命名规范，逻辑性强，代码冗余率低。【我们的福利】1.高理想薪酬+五险一金+一年13-15薪2.双休法定+朝九晚六（7.5小时工作制）3.无需出差，极少加班，办公氛围幽默友好4.良好的双线职业晋升通道（管理线与专家线）5.丰富多彩的团队活动，生日礼物，节日福利等", "海南智联邦科技有限公司", "50-150人", "初创型(未融资)", "移动互联网,教育", "3.9"
"拉勾", "web前端", "web前端（Javascript研发）", "7000-9000", "本科", "重庆", "1-3年", "职位描述任职要求：1、精通 jQuery、Javascript；2、熟悉HTML、XHTML、CSS、CSS3， AMD、CMD模块开发规范；3、熟练掌握.Net、JSP或PHP页面开发，能够快速编辑出良好的代码；4、熟练掌握Ajax技术、切图技术、sprite技术，网站重构、页面架构和页面布局；5、能够独立完成网站页面设计制作、能够快速解决并完成浏览器兼容性问题；6、对用户体验有一定的理解；7、优秀的学习能力、沟通表达能力、逻辑分析能力，良好的团队协作精神，工作责任心强，工作态度严谨。岗位职责：1、负责软件系统前端架构设计与开发；2、负责解决公司网络产品在不同平台和设备上的兼容和统一；3、网站平台Web端功能设计、开发和实现；4、平台易用性改进和Web界面技术优化；5、Web前沿技术研究和新技术调研；6、负责协助开发人员做平台功能测试。", "重庆海外旅业（旅行社）集团有限公司", "500-2000人", "成长型(A轮)", "旅游", "4.4"
"拉勾", "web前端", "web前端", "15000-25000", "本科", "上海", "3-5年", "职位描述岗位职责:1、根据项目需求按时完成产相关产品界面的代码设计、开发工作；2、制作标准优化的代码，并增加交互动态功能；3、对已有项目，相关业务中的代码持续更新迭代优化和重构；4、JS交互效果的实现、前端代码优化；任职条件:1、对于HTML、CSS、JavaScript有较为深入的研究；2、精通Web前端技术，有符合web标准网站重构相关经验；3、对CSS/JavaScript性能优化、解决多浏览器兼容性的经验；4、有UI背景-对用户体验、交互操作流程、及用户需求有一定了解；5、专职从事3年及以上Web前端开发从业经验优先考虑；", "上海微知软件科技有限公司", "150-500人", "成长型(B轮)", "企业服务", "4.4"
"拉勾", "web前端", "web前端高级工程师", "15000-30000", "本科", "上海", "3-5年", "职位描述1、本科，工作三年及以上2、计算机相关专业毕业3、熟练掌握HTML5、CSS3、JavaScript等开发4、熟悉W3C标准与ES规范，熟悉Web语义化5、熟练掌握盒模型、常用布局以及浏览器和移动设备的兼容性6、熟练使用至少一种JS框架，掌握其原理，能独立开发常用组件7、熟练使用各种调试、抓包工具，能独立分析、解决和归纳问题8、具有性能优化经验9、熟悉各种常用设计模式和常用MV*框架10、熟练使用AngularJs优先", "上海海鼎信息工程股份有限公司", "150-500人", "初创型(未融资)", "企业服务", "4.2"
"拉勾", "web前端", "web前端开发工程师", "5000-10000", "大专", "福州", "1-3年", "职位描述工作职责：1、平台（网站）各业务模块前端代码开发，编写可复用的用户界面组件；2、平台（网站）现有功能模块的优化重构，页面性能的持续优化提升；3、根据UI设计师提供的设计图，实现Web界面，优化代码并保持在各浏览器下的良好兼容性；4、与后端人员配合，实现前后端数据交互;5、参与公司项目和产品的HTML5页面及移动互联网方面WebApp开发(主要偏向微信内置浏览器的webapp)；岗位要求：1、一年以上前端开发经验，精通Html/Css/Javascript，熟悉W3C标准，熟练页面性能优化和浏览器兼容（ie6~9 ff chrome）能熟练手写代码html,css,js；2、熟练使用ajax实现前后端异步数据交互；3、熟悉html5、css3，运用前端新技术开发mobile html5页面4、熟练运用js模块化编程，面向对象进行各个业务模块的开发；5、我们基于jquery，希望你自己对jquery有足够的自信6、有良好的沟通、团队协作意识，能够独立编写中等规模的web应用加分项：1、熟悉Javascript、OOP及主流js库，有框架开发经验者优先2、使用php mysql进行后端开发，并有一定项目经验；3、对Kissy，AngularJS, Backbone尽可能的熟悉或有实战项目经验4、有基于h5 css3的mobile SPA开发经验我们会更喜欢；5、有旅游电商网站开发经验优先；6、我们基于svn版本控制，希望你能熟练使用，此外，如果你使用git我们也很欢迎，随便留下您的github地址。", "福建票付通信息科技有限公司", "50-150人", "成长型(B轮)", "电子商务,生活服务", "4.6"
"拉勾", "web前端", "web前端", "8000-12000", "本科", "武汉", "1-3年", "职位描述1、较强的沟通、协调能力;2、熟悉各种Web前端技术，精通HTML/XHTML、Div+CSS等网页制作技术，熟悉页面架构和布局, 对表现与数据分离、Web语义化等有深刻理解；3、理解Web标准能够针对不同浏览器（IE/Chrome/Firefox）编写兼容代码；4、精通jQuery，能够编写jQuery插件；5、有团队协作精神。善于学习，乐于探索，不墨守陈规；6、良好的沟通与表达能力、思路清晰，较强的动手能力与逻辑分析能力。", "武汉安天信息技术有限责任公司", "50-150人", "成长型(A轮)", "移动互联网", "3.9"
"拉勾", "web前端", "web前端开发", "8000-15000", "本科", "杭州", "不限", "职位描述岗位职责：1、收集、分析产品需求，并形成需求文档；2、根据项目任务，进行金融设备/系统前端软件的设计和开发。岗位要求：1、本科以上学历，计算机相关专业，具有前端WEB开发工作经验；2、熟练掌握HTML5和CSS3等技术，熟悉页面架构和布局；3、精通Javascript，Ajax，熟练使用jQuery，熟悉ocx控件开发；4、有银行自助设备终端软件开发经验者优先。5、具有良好的沟通能力，为人诚信正直，吃苦耐劳，有团队合作精神。", "杭州维融金网科技有限公司", "500-2000人", "成熟型(不需要融资)", "金融,硬件", "3.8"
