"fromsite", "positionType", "positionName", "salary", "education", "city", "workYear", "jobDes", "company", "companySize", "financeStage", "industryField", "rate"
"拉勾", "web前端", "Web前端", "15000-30000", "本科", "成都", "不限", "职位描述岗位职责：1、负责公司产品WEB端、移动端前端界面的开发；2、参与前端框架技术选型、新技术讨论，参与公司前端通用组件的开发；3、配合后台开发人员完成交互功能的调试和开发；4、参与公司前端产品维护和性能优化。岗位要求：1、4年以上前端开发经验，能够独立完成前端开发；2、精通XHTML/XML、CSS，熟悉页面架构和布局，对表现与数据分离、Web语义化等有深刻理解，精通HTML5/CSS3技术，了解NodeJS者优先；3、精通JavaScript、Ajax、DOM等前端技术，掌握面向对象编程思想，对JS框架应用（如jQuery/Zepto/Requirejs/AngularJS等）有一定的经验，研读过jQuery源码，了解其工作运行原理；4、对CSS/JavaScript性能优化、解决多浏览器兼容性问题有一定的经验；5、熟悉一门非前端脚本语言（如PHP/Python等）；6、对用户体验、交互操作流程、及用户需求有深入理解；", "四川高旺科技有限公司", "150-500人", "成长型(不需要融资)", "移动互联网,游戏", "-"
"拉勾", "web前端", "web前端", "4000-6000", "本科", "贵阳", "1-3年", "职位描述岗位职责：1、负责在效果图或交互原型的基础上完成前端页面制作(DIV+CSS)； 2、负责编写js脚本； 3、用WEB标准规范开发代码，兼容多种浏览器； 4、根据产品发展需要，维护或优化已有网页前端代码； 5、与设计师、研发工程师配合工作，提出合理化建议，提升工作效率； 6、Web产品设计、开发和维护 7、Web前沿技术研究和新技术调研 8、Web产品改进、优化和用户体验提升9、负责前端简单的SEO优化 任职要求：本科以上学历，扎实的计算机基础，有至少2年的Web前端开发经验 。精通JavaScript、JQuery、ExtJS等页面效果框架精通css，html熟悉PSFireworksAI熟悉W3C标准，对表现与数据分离、Web语义化等有深刻理解有良好的技术视野和规划能力 良好的沟通与表达能力、思路清晰，较强的动手能力与逻辑分析能力 薪酬待遇8至15万元，执行公司福利制度（五险一金+增量补贴+交通补贴等），特殊岗位人才单独面议。联系咨询公司人力综合部 汤智钦 电话：0851-85282986、15519156111电商云公司网站：www.gogbuy.com公司地址：贵阳高新区长岭南路天一国际广场11栋11楼", "贵州电子商务云运营有限责任公司", "50-150人", "初创型(未融资)", "电子商务,数据服务", "-"
"拉勾", "web前端", "web前端", "15000-25000", "不限", "上海", "3-5年", "职位描述工作职责： -与设计师、后端研发等人员一起实现产品功能，优化产品用户体验 -Web前沿技术研究和新技术调研职位要求： -计算机或相关专业本科以上学历 -精通JavaScript、Ajax等Web开发技术，有良好的程序设计和架构能力 -精通html/xhtml、css等网页制作技术，熟悉页面架构和布局 -熟悉web标准，对表现与数据分离，html语义化等有深刻理解 -对web技术钻研有强烈兴趣，有良好的学习能力和强烈的进取心 -思维缜密、思路清晰，较好的逻辑分析能力 -良好的沟通和口头、书面表达能力", "上海红星美凯龙科技有限公司", "50-150人", "成长型(不需要融资)", "移动互联网,O2O", "-"
"拉勾", "web前端", "WEB前端开发工程师", "15000-25000", "本科", "深圳", "3-5年", "职位描述岗位职责：1.负责公司产品前端开发与交互设计；2.负责与后端工程师配合，完成服务数据交互；3.持续优化相关产品的质量、性能及用户体验；4.参与公司重点项目的开发。任职要求：1、精通JavaScript、Ajax等Web开发技术,对原生JavaScript有较深的掌握；2、精通主流的JS框架, Angular,jquery或者其他类似框架；3、精通HTML/XHTML、CSS等网页制作技术，熟悉页面架构和布局；4、对网站前端性能优化有丰富的经验和深刻的理解；5、熟悉W3C标准，对表现与数据分离、Web语义化等有深刻理解；", "深圳艾诺伊电子商务有限公司", "50-150人", "成长型(不需要融资)", "移动互联网,电子商务", "-"
"拉勾", "web前端", "web前端", "6000-12000", "不限", "厦门", "1-3年", "职位描述1）卓越的沟通和感知力2）熟悉主流的前端样式框架，如Bootstrap、foundation3）熟悉Vue.js或者React.js等当前主流的前端开发框架4）持续的学习", "厦门同类聚合信息科技有限公司", "15-50人", "初创型(不需要融资)", "移动互联网,社交网络", "4.8"
"拉勾", "web前端", "有自我修养的web前端", "6K-10K", "不限", "宁波", "不限", "职位描述        1.能写出合理、简洁、语言到位的html的文档结构。不乱用div和class，css命名习惯良好。2.有自适应的设计经验（有成熟的关于页面元素宽度、高度的处理方案）3.能很好理解网页上的业务架构4.熟悉前端常用插件（熟悉基于jquery/zepto的插件扩展）5.熟悉前端构建相关的node.jsnpmgulp等6.熟悉css3动画设计，熟悉html5中的canvas和svg.最好有设计功底，会使用CreateJS    ", "宁波微动天下信息技术有限公司", "50-150人", "初创型(天使轮)", "移动互联网,电子商务", "-"
"拉勾", "web前端", "web前端", "10000-15000", "大专", "杭州", "1-3年", "职位描述职位描述：1.负责Web及M站前端框架及实现；2.参与产品需求讨论，能深入思考需求本质，提出专业性的优化建议；备注：动漫、端游相关类项目职位要求：1.大专以上学历，2年以上前端开发经验2.熟悉Html5，CSS3，JavaScript等前端通用技术，使用过Bootstrap等常见类库和框架，有能力设计和开发前端组件和前端基础架构3.熟悉jquery、Ajax、JSON等Web通信技术;4.开发过兼容多平台多浏览器的项目，丰富的项目经验、有前端代码组织、代码发布整合的相关经验，对当前成熟的前端构建工具（fis、glup、grunt等）有所了解，有所使用。5.关注前端新技术，自我驱动，学习能力强。", "杭州掌维科技股份有限公司", "50-150人", "初创型(未融资)", "移动互联网,文化娱乐", "3.8"
"拉勾", "web前端", "web前端", "6000-10000", "不限", "成都", "1-3年", "职位描述工作职责：负责设计公司网站、web前端系统和功能的开发、优化和维护；配合后台开发人员实现产品界面和功能；任职要求：1、熟悉 JavaScript、Ajax等web开发技术；熟悉Jquery等主流框架；2、熟悉 HTML/XHTML、CSS等网页制作技术，熟悉页面架构和布局；3、熟悉 HTML5和CSS3，了解各种主流浏览器之间CSS兼容性问题，以及解决方法；4、具备一定的Java能力优先；5、有开发过微信公众号经验优先；", "成都希恒科技有限公司", "少于15人", "初创型(天使轮)", "移动互联网,社交网络", "4.2"
"拉勾", "web前端", "高级web前端研发工程师", "14000-28000", "本科", "深圳", "3-5年", "职位描述岗位职责：1、4年及以上web前端开发经验，熟练掌握JavaScript、HTML、CSS等基础；2、熟练运用JavaScript语言，对其语言特性、内部机制等有一定的理解。3、熟悉移动端开发、页面架构和布局等，对前端工程化等有一点的见解。4、至少掌握一个主流的JS框架（angular\\vue\\react等）5、至少熟悉一种前端构建工具（grunt/gulp/fis等）6、熟悉chrome dev tool或者其他开源调试器工作原理或有相关经验者优先7、有大型互联网产品开发经验者优先", "深圳市新梦网络科技有限公司", "500-2000人", "成熟型(C轮)", "电子商务,企业服务", "5.0"
"拉勾", "web前端", "web前端", "10000-18000", "本科", "深圳", "1-3年", "职位描述1、2年以上web前端开发经验；2、精通JavaScript，深入理解web标准，对基于AJAX的应用在各种浏览器终端的实现由深入的了解；3、能够熟练运用至少一款主流的JS框架，具有良好的代码风格、接口设计与程序架构；4、有大型互联网产品开发经验者优先，HTML5+CSS3优先。5、熟悉移动端web开发或hybrid开发模式更佳；6、具备快速的学习和成长能力；", "深圳市金凯林贸易有限公司", "500-2000人", "成熟型(不需要融资)", "金融,数据服务", "3.3"
"拉勾", "web前端", "Web前端工程师", "12000-24000", "本科", "深圳", "1-3年", "职位描述岗位职责：1、利用各种Web技术实现Web产品的交互效果，参与项目开发；2、对产品、设计需求给出技术评估和解决方案；3、参与公司Web前端的架构设计、标准及规范制定；能力要求：1、全日制大学本科或以上学历，2年或以上相关工作经验2、精通HTML和CSS及Javascript、熟悉前端mvc/mvvm开发框架(AngularJS/React等)；3、熟悉Bootstrap/jQuery等常用框架；4、熟悉CSS、Javascript的浏览器兼容性问题及其解决方案；5、良好的英文文档阅读能力，良好的团队沟通和协作能力；加分项：1、熟悉WebSocket，LocalStorage相关API使用；2、熟悉现代前端开发常用工具链：如Gulp、BrowserSync等；", "深圳复临科技有限公司", "15-50人", "成长型(A轮)", "移动互联网,企业服务", "4.4"
"拉勾", "web前端", "web前端/react", "15000-25000", "大专", "深圳", "3-5年", "职位描述任职资格：1、3年至5年web前端或移动前端开发经验;2、熟练h5、css3、js等前端基础技术，熟悉es6、nodejs等;3、熟悉常见前端框架, 熟练react+redux+form+router（该框架候选人要熟悉，最起码做到了解）进行项目开发。有extjs开发经验尤佳；4、具备良好的学习能力和分析解决问题能力，责任心强，对技术有浓厚兴趣，能承担较大压力；", "深圳市中兴力维技术有限公司", "2000人以上", "成熟型(不需要融资)", "移动互联网,数据服务", "-"
"拉勾", "web前端", "高级web前端开发", "18000-36000", "本科", "北京", "1-3年", "职位描述FE-高级工程师职位职责：1、负责立马理财pc版、wap版以及部分推广活动页面的开发，改进工作；2、积极配合产品、视觉、后端、测试等相关职位工作，实现高效的团队开发；3、深入分析理解业务需求，承担复杂的任务，高质量的产出；4，提升页面的用户体验，优化网站性；5、整合通用解决方案，抽象化、模块化前端组件，让业务实现更简单；6、不断的提高项目的代码质量，参与指导组内人员，解决技术难题。职位要求：1、重点大学本科及以上学历，计算机、电子、自动化等理工科相关专业；2、优秀的团队意识，主动的学习态度，较强的逻辑思维能力；3、精通js/css/html等web前端开发技术，至少熟悉一种前端开发框架熟悉；4、良好的编程风格，扎实的编程基础，熟悉MVC等设计模式者优先考虑；", "网之易信息技术（北京）有限公司", "2000人以上", "上市公司", "数据服务,文化娱乐", "4.3"
"拉勾", "web前端", "高级Web前端开发", "25000-30000", "本科", "深圳", "5-10年", "职位描述岗位职责：1、负责web产品的前端开发、需求实现；2、使用合理的架构将设计产品转换为格式良好的html；3、与设计、后台开发人员等保持良好沟通，能快速理解、消化各方需求，并落实为具体的开发工作；4、web前端新技术的预研与开发。任职要求：1、计算机软件或相关专业，大专及以上学历；2、熟悉但不限于angular、seajs等前端框架的使用，对前端自动化解决方案有一定的了解，比如grunt、gulp等；3、熟练掌握HTML/HTML5、CSS/CSS3、javascript/jquery/seajs、ajax、DOM等前端技术；4、能轻松写出符合W3C标准、兼容主流浏览器的代码；5、具备强烈的责任心与进取心，能承受较大工作压力；6、具有良好的沟通与协调能力，具有团队合作精神，客户服务意识良好；7、具有以下经验者优先：前端架构、性能优化或移动端开发经验。", "深圳市中农网股份有限公司", "150-500人", "成长型(不需要融资)", "电子商务", "-"
"拉勾", "web前端", "Web前端", "15000-20000", "本科", "深圳", "3-5年", "职位描述工作内容：1、Web前端工程师，负责移动端 WebApp、 PC 端云服务管理后台开发2、服从部门经理任务安排，协助部门经理与用户沟通，控制需求，找到最优解决方案，评估开发工作量；3、熟练使用 jQuery、Zepto、requirejs，熟悉 React 或者 Angular 等前端库和框架，能与后台开发人员一起编写Ajax交互程序；4、参与技术预研和技术重构，参与团队交流，协助产品开发；任职资格：1、两年或以上 Web 前端开发经验；2、熟悉 JavaScript/HTML 5/CSS 3 等前端开发技术，有响应式页面开发经验；3、熟练使用 jQuery、Zepto、requirejs 等前端框架，能与后台开发人员一起编写Ajax交互程序；4、熟悉 JavaScript/HTML 5/CSS 3 在各种手机分辨率、PAD平台上的兼容和性能优化；5、熟悉 HTML 5 特性，了解 HTML 5 最新规范，能够熟练运用 HTML 5 特性构建移动端的 WebApp；6、善于使用前端的调试工具和自动化工具，熟练手写代码；7、具备良好的服务意识、责任心、较强的学习能力、优秀的团队沟通与协作能力、能承受一定的工作压力。", "深圳市小牛电子商务有限公司", "150-500人", "成长型(不需要融资)", "移动互联网,金融", "-"
"拉勾", "web前端", "web前端", "13000-18000", "本科", "深圳", "1-3年", "职位描述岗位职责：负责web前端功能设计与实现；参与产品及前端架构设计及实现。任职要求：1、2年以上web前端开发经验；2、精通JavaScript，深入理解web标准，对基于AJAX的应用在各种浏览器终端的实现由深入的了解；3、能够熟练运用至少一款主流的JS框架，具有良好的代码风格、接口设计与程序架构；4、有大型互联网产品开发经验者优先，HTML5+CSS3优先。5、熟悉移动端web开发或hybrid开发模式更佳；6、具备快速的学习和成长能力；", "深圳市金凯林贸易有限公司", "500-2000人", "成熟型(不需要融资)", "金融,数据服务", "3.3"
"拉勾", "web前端", "web前端开发工程师", "15000-25000", "大专", "上海", "3-5年", "职位描述工作职责1.使用HTML5、CSS3及JavaScript完成HTML界面布局开发；2.保证各平台的兼容可用性；3.与后台工程师配合，展示数据；4.特殊js交互效果的实现，ajax代码实现；  5.前端代码优化；任职要求:  1.2年以上移动端，web前端工程师相关工作经验；  2.熟悉web前端技术css、javascript，熟悉w3c标准；  3.精通js编程，精通ajax运作机制，能够熟练使用DIV+CSS模式，对页面代码进行优化，能熟练解决浏览器兼容问题，并能按要求适配多分辨率手机屏幕展示；4.熟悉前端构建工具，如：gulp、grunt5.熟悉node.js、react.js者优先；", "苏州华语兄弟企业管理有限工商", "50-150人", "成长型(B轮)", "移动互联网,电子商务", "-"
"拉勾", "web前端", "高级web前端开发", "15000-30000", "本科", "上海", "3-5年", "职位描述【职位职责】1、负责公司产品或项目的前端选型及架构，并配合后端的开发；2、根据需求实现页面交互效果。【任职要求】1、本科及以上学历，计算机软件相关专业，至少3年以上前端开发经验；2、精通HTML5/CSS3，JavaScript，Ajax等Web开发技术；3、至少掌握backbone.js/reacts/angular.js其中一种；4、熟悉各种浏览器的兼容性调试；5、对数据结构以及后台语言Python等有简单了解。", "上海爱福窝云技术有限公司", "150-500人", "成长型(A轮)", "电子商务", "3.9"
"拉勾", "web前端", "WEB前端", "4000-8000", "大专", "成都", "1-3年", "职位描述1、负责产品的HTML5页面架构设计和开发，根据产品需求，分析并给出最优的页面前端结构解决方案；2、协助后端工程师完成功能镶嵌和调试；3、持续研究HTML5技术并加以应用与创新；4、服从上级安排，按时保质保量完成所布置的任务。5、有上线的案例，APP/PC网站（独立或合作完成开发）职位要求：1、精通HTML、CSS，能脱离工具手写代码，熟悉HTML5/CSS3；2、熟悉JavaScript、CSS、AJAX等技术，熟悉jQuery，能够编写jQuery插件者优先；3、熟悉Photoshop、Dreamweaver等相关设计软件；有一定的美工基础及审美能力；4、要求能够熟练且高效与后台开发者配合，有独立思考并灵活解决问题的能力；5、根据业务需求完成页面设计稿并能够用DIV+CSS制作成静态页面，确保网页效果及优化各浏览器的兼容性；6、能够使用Web标准规范页面代码，优化页面运行速度，提高用户体验；7、良好的沟通协调能力及团队合作精神，能按时、高质量地完成工作任务，并整理规范自身开发文档；", "成都安意科技有限公司", "少于15人", "初创型(未融资)", "移动互联网,数据服务", "-"
"拉勾", "web前端", "Web前端", "7000-12000", "本科", "成都", "1-3年", "职位描述+负责卖家云前端UI页面开发制作；++希望你享受界面设计，充满好奇心，了解新技术，学习能力强；精通DHTML/CSS/Javascript等前端技术；熟悉网站Div+CSS标准化布局，处理兼容性；精通JavaScript，熟练使用原生js，以及jQuery；+++优先bootstrap框架二次开发工作经验；", "北京卖家云信息技术企业（有限合伙)", "15-50人", "成长型(A轮)", "电子商务", "4.0"
"拉勾", "web前端", "web前端研发实习生", "3000-4000", "本科", "北京", "应届毕业生", "职位描述岗位职责：对需求量化，输出相应的设计文档。负责后台数据实时处理以及获取，并完成前端页面展示。设计并提供高可靠专用功能的API接口，对外提供稳定的服务。任职要求：计算机相关专业本科及以上学历;熟悉Linux的基本命令操作。熟悉LNMP架构，能独立安装配置。熟练使用CSS、HTML、XML、JavaScript、Ajax、JSON等相关技术。熟悉Echarts/Highcharts等JavaScript常用图表库的使用方法。有浏览器兼容性问题处理的经验。熟悉PHP涉及的Mysql的常规用法，包括库表设计，索引使用。熟悉PHP涉及的Redis/Memcache的常规用法。了解Hbase/Hadoop等分布式系统的原理以及常规用法。有自己的作品优先考虑，面试可携带相应网站作品，或者于简历中提供相应的网址。", "微梦创科网络科技（中国）有限公司", "2000人以上", "上市公司", "移动互联网", "3.9"
"拉勾", "web前端", "web前端", "15000-30000", "本科", "北京", "3-5年", "职位描述岗位职责：1.依据产品需求负责Web前端及移动端的应用架构设计；2.优化Web前端性能，改善用户体验；3.研究前端技术，丰富Web交互方式；任职要求：1.本科以上学历，计算机相关专业，3年或以上前端开发工作经验；2.精通JavaScript、Ajax、HTML/XHTML、CSS等基础网页制作开发技术；3.熟悉常用移动端框架如：jQuery Mobile、Sencha Touch、iWebkit、Zepto等；4.注重前端代码可维护性以及性能，注重用户体验；5.理解Web产品工作方式，熟悉MVC、Restful、HTTP协议等；6.熟悉nodejs优先；", "北京盈泰财富云电子商务有限公司", "50-150人", "成长型(A轮)", "移动互联网,金融", "5.0"
"拉勾", "web前端", "web前端/HTML5", "10000-20000", "大专", "上海", "1-3年", "职位描述工作内容：1、使用Node.js+Express+开发后台RESTful服务；2、使用MySQL/Redis/MongoDB/Elasticsearch数据库和搜索引擎；3、使用react／angular参与hybrid app 的开发 ；4、为前端（H5、IOS、Android）同时提供RESTful接口。任职条件：1、大专及以上学历计算机或相关专业，2年以上相关工作经验；2、能看懂英文技术文档，有良好的沟通能力；3、熟悉HTML5/CSS3等前端开发语言、熟练react／angular ；4、熟悉至少一个sql（尤其mysql）、一个NoSQL（尤其是mongodb）；5、会使用Linux基本命令；6、熟悉RESTful的定义与规范；7、能主动思考、有较强学习能力。在美承集团移动解决方案本部，你将获得：1.集团大平台具有的完善运行体制，移动端的时尚科技，创新创意的公司文化，阳光朝气的研发团队；2.高大上的移动端项目开发和管理流程，与行业***极客合作，助你成为移动行业高手；3.移动解决方案本部业务快速发展，发展前景广大，现在的你必将成为核心人员；4.公司成熟人才培养体系，为你职业生涯发展提供保驾护航；5.优雅的智能家居办公环境，时尚的办公设施，灵活的办公体制为你量身而定；6.大集团提供的完善薪酬体系，集团即将上市带来的员工期权。", "上海美承电子商务有限公司", "2000人以上", "成熟型(不需要融资)", "企业服务,硬件", "-"
"拉勾", "web前端", "web前端", "10000-20000", "本科", "珠海", "5-10年", "职位描述1、主持产品UI和交互方面的开发需求；2、负责网页产品的前端展示效果开发，配合后台开发人员实现网站动态功能；3、负责优化代码并保持良好的ie6+、Chrome、firefox等浏览器兼容性；4、负责前端效果调优，前端体验优化；5、和服务器端开发人员进行应用及系统整合。1、计算机或相关专业专科及以上学历，三年以上Web前端开发经验，熟练掌握HTML5技术；2、熟悉HTML/XHTML、CSS等网页制作技术，熟悉页面架构和布局，能够解决各种浏览器兼容性问题；3、精通JavaScript、Ajax，精通jquery等前端框架；4、熟悉JAVA语言，熟悉J2EE开发；5、具备良好的团队合作精神、较好的沟通能力、高度的责任感，具有较强的抗压能力；6、工作认真细致，有独立分析问题和解决问题的能力,有自己的见解，能主动根据业务需要，提出合理的方案，有后端开发或者协同工作经验者优先。", "上海方付通商务服务有限公司", "500-2000人", "成熟型(不需要融资)", "移动互联网,金融", "3.8"
"拉勾", "web前端", "web前端", "10000-20000", "本科", "北京", "不限", "职位描述职位描述1、主要负责pc和移动平台的Web前端开发工作，配合后端，实现前后端开发分离。2、根据UI设计图开发前端代码，解决不同浏览器及不同版本的兼容性问题。3、研究Web前沿技术和新技术调研。专业技能要求1、1年及以上前端开发工作经验；2、熟悉常见页面布局方式，移动端响应式页面布局方式，多浏览器兼容及移动端机型适配方式，熟悉css性能优化方式；3、精通HTML5、CSS3和javascript，熟悉HTML5、CSS3新特性、精通一种前端js框架；4、熟悉angularJs开发者优先；5、熟悉NODE.JS的开发实践，如expressjs框架； 6、热爱技术研发工作，有良好的工作责任感和团队合作能力。7. 有移动端开发经验、移动端web性能优化经验者优先 8. 能熟练编写扩展性、兼容性、可读性良好的代码9. 有教育行业相关开发经验者优先；", "北京汉王教育科技有限公司", "150-500人", "上市公司", "移动互联网,教育", "-"
"拉勾", "web前端", "web前端", "10000-15000", "本科", "上海", "1年以下", "职位描述岗位描述：1、负责公司软件产品的页面功能的开发和优化；2、利用各种Web技术模拟开发产品原型；3、参与用户体验Demo工具的优化设计及实现；4、利用HTML5/CSS3/JavaScript/Flash等各种Web技术进行产品的界面开发；5、配合后台开发人员实现产品界面和功能与后台的交互；6、制作标准优化的代码，并增加交互动态功能。岗位要求：1.本科以上学历，计算机相关专业，2年以上前端开发工作经验；2.熟练掌握Web前端技术CSS/HTML/Javascript，有html5/css3开发经验；3.熟悉常用Web前端框架(jQuery,Bootstrap)；4.良好的编程习惯和较强的的学习能力；5.有责任感和良好的团队合作精神；6.有java开发经验者优先。薪酬福利：1、提供有竞争力的薪资，执行相对公平合理的绩效政策和薪酬结构；2、其他福利：美味三餐、各种补贴、生日和节日福利、年休、优秀员工出国旅游等；3、作息时间：每天八小时工作制（9:00-18:00，午休1小时），双休+国家法定节假日。", "上海泛微网络科技股份有限公司", "500-2000人", "成熟型(D轮及以上)", "移动互联网,企业服务", "4.0"
