"fromsite", "positionType", "positionName", "salary", "education", "city", "workYear", "jobDes", "company", "companySize", "financeStage", "industryField", "rate"
"拉勾", "web前端", "web前端", "15000-23000", "本科", "上海", "5-10年", "职位描述工作内容：1、负责消费金融核心业务系统界面以及相关外围系统的Web界面研发；2、负责设计前端系统架构，并配合后端工程师完成数据接口的开发和调试；4、负责解决产品在各种浏览器及webview下的兼容问题；5、负责产品性能和代码优化方案的设计及实施；工作要求：1、大学本科及以上学历，计算机、通信、电子、自动化、数学等相关专业5年以上开发经验；2、深刻理解web标准，精通各类Web前端开发技术，包括javascript、Ajax、Css等web开发领域相关技术；3、掌握至少一门非前端开发语言（如Nodejs/PHP/Java/Python/Ruby等），并有一定的实战经验；4、编程基础扎实，有能力理解主流前端框架的内部实现，而不仅仅停留在API调用上；5、逻辑分析能力及学习能力强，具有优秀的团队合作精神和沟通能力；6、积极主动，乐观开朗，能够适应成长期企业的工作压力。", "什马互联网金融信息服务（上海）有限公司", "50-150人", "成长型(A轮)", "移动互联网,金融", "3.8"
"拉勾", "web前端", "web前端经理", "8000-15000", "本科", "长沙", "3-5年", "职位描述产品前端框架的设计与实现，各业务模块前端代码开发；提升团队整体技术水平， 作为leader解决核心技术问题；Web前沿技术研究和新技术调研；日常代码审查和质量控制；整体产品质量控制，包括但不限于自动化测试。职位要求：学历不限，计算机、软件、电子通信类相关专业，深入理解web开发技术和软件开发流程者优先；具有良好的编程习惯，团队合作及管理能力；重视产品体验，细节癖；3年以上工作经验，有带队经验者优先；有实际项目的 AngularJS, NodeJS, Git经验的优先，了解Android/IOS相关技术的优先；希望你能了解创业，有理想，有态度，愿意和一群充满乐趣，创意的小伙伴做一件让人无比兴奋的事，这是创业公司的魅力，希望你可以成为我们早期员工，这一定是刺激无比的经历。", "湖南云畅网络科技有限公司", "15-50人", "初创型(不需要融资)", "O2O,企业服务", "-"
"拉勾", "web前端", "web前端（大数据）", "10000-20000", "本科", "北京", "3-5年", "职位描述1、3年以上的web前端页面和脚本开发经验，精通Web前端技术，包括HTML(5)/CSS(3)/JavaScript等,熟悉主流浏览器兼容性； 2、精通MVC框架，能够同时完成controller层和model层的开发工作；3、热爱前端，热爱编程，动手能力强，有一定的面向对象思想和结构化思维；4、至少熟练一种前端框架（backbone,react最佳），对前端工程化有一定了解，对前端过往将来有一些思考，对于各种技术有自己的见解；5、以下为加分项：强烈的学习欲望，有不断优化自己代码的习惯，清晰的职业规划，懂后端语言，热爱生活，能在工作学习生活之间找到平衡。", "北京北森云计算股份有限公司", "500-2000人", "上市公司", "企业服务,数据服务", "4.0"
"拉勾", "web前端", "web中级前端开发", "10000-15000", "大专", "北京", "3-5年", "职位描述工作职责： 1.能够与夸部门团队其他同事协同工作，创建高性能，高可用性的前端框架；  2.使用JS编写封装良好的前端交互组件，维护及优化网站前端页面性能；  3.提升产品的用户体验、前端性能以及团队的开发效率； 4.使用H5+CSS3开发高性能移动端站点和互动游戏。  任职要求：  1.精通各种Web前端技术（HTML5/CSS3/Javascript等)，熟练跨浏览器、跨终端的开发，了解不同操作系统及浏览器的兼容性区别； 2、精通DIV+CSS和W3C标准，能熟练运用XHTML、CSS进行合理的网页制作，深刻理解各主流手机浏览器之间的兼容性；3.有大型网站前端性能、可访问性、可维护性等方面的实践经验； 4.重视团队协作，愿意探寻和改进目前还不成熟的前端开发流程，了解各种常用工具； 5.熟练使用图形图像软件Photoshop,Illustrator等，对从设计转换为产品有一定的认识； 6.使用自动化构建工具（Gulp，Grunt，Webpack等）开发项目；7、了解源码管理工具，如：Git，SVN等； 8、有手机端HTML5开发经验优先，AngularJS开发经验者优先。", "上海汇招信息技术有限公司", "150-500人", "成长型(A轮)", "企业服务", "3.9"
"拉勾", "web前端", "web前端", "15000-20000", "本科", "深圳", "1-3年", "职位描述1、3年或以上前端开发经验;2、精通Javascript/CSS，熟练掌握AJAX、JSON、H5等web开发技术;3、熟练使用gulp/grunt/webpack任一种工程化框架;4、熟练使用各种前端调试工具，性能分析工具;5、熟悉seajs,nodejs,express等前端技术;6、有vue/react/angular任一种框架项目经验;7、深度了解用户体验，熟悉HTTP协议;8、精通面向对象分析、设计、开发及常用设计模式;9、有后台开发(java,php等)的经验;", "深圳市壹佰金融服务有限公司", "150-500人", "成长型(不需要融资)", "移动互联网,金融", "3.7"
"拉勾", "web前端", "web前端", "6000-8000", "大专", "南京", "1-3年", "职位描述任职要求：1、计算机或相关专业大专及以上学历，熟练掌握HTML/CSS/AJAX，熟练编写html与html5页面，至少2年以上前端开发经验；2、熟练JavaScript，jQuery等JS开发框架，能够熟练编写常用的应用；3、能很好地考虑JavaScript性能优化及浏览器兼容；4、有大型前端项目构建和开发经验，并有已实现的应用案例；5、学习能力强，善于沟通，踏实稳重，吃苦耐劳。岗位职责：1、依据产品需求完成高质量的Web前端开发和维护，致力于通过技术改善用户体验；2、利用HTML/CSS/JavaScript等各种Web技术进行产品的界面开发；3、设计开发公用的前端组件，改进前端框架；4、解决浏览器及版本的兼容性问题，保证页面支持多浏览器使用；5、为产品后期运营提供升级、维护等技术支持；6、帮助团队持续优化前端开发效率，促进前端知识沉淀和能力提升。", "南京百米需供应链管理有限公司", "50-150人", "成长型(A轮)", "电子商务", "2.8"
"拉勾", "web前端", "web前端", "6000-9000", "大专", "郑州", "3-5年", "职位描述1. 计算机相关专业专科以上学历，两年以上 Web 前端工作经验2. 熟悉HTML5+CSS3+JS编程，熟悉各种前端调试工具； 熟悉JS性能优化3. 熟悉jQuery等主流的JS库，了解其运行机制；熟悉前端MVC架构，backbone等4. 熟悉新的HTML5表现形式的制作及开发, 有响应式页面开发经验；5. 有Mobile Web的开发经验，能开发兼容移动版浏览器的应用，并且能实现各种交互效果", "上海惠为信息技术有限公司", "15-50人", "初创型(不需要融资)", "数据服务,移动互联网", "-"
"拉勾", "web前端", "web前端", "5000-10000", "大专", "厦门", "1-3年", "职位描述1、利用Javascript/HTML/CSS等各种前端技术编写web UI，优化产品页面的前端性能，保证产品页面的高质高速；2、独立完成网页的制作工作，包括各类JS功能与网页特效；3、维护及优化网站前端性能，优化前端开发模式和规范；4、配合技术团队、产品部、其他成员，进行网页模块的开发、制作、整合、部署等相关工作；任职条件：1、具有一定的Web前端开发经验，要求有较高的Javascript语言驾驭能力，能够进行面向对象/组件的前端设计和开发； 2、精通XHTML、CSS、JavaScript、jQuery、Canvas 、Svg、Json，悉W3C标准；3、能确保代码对各种浏览器的良好兼容性；4、熟练掌握photoshop/fireworks、dreamwaver等设计工具； 5、较强的美术功底，良好的创意思维和理解能力，对网站的美工、页面布局及色彩搭配有独到见解和体会。6、有 HTML5 与 CSS3 网页开发经验者优先；7、有响应式布局网页开发经验者优先；8、有移动端浏览器网页开发经验者优先；9、有 bootstrap框架经验者优先；10、面试请携带相关作品集工作地点:厦门市软件园二期观日路32号之二306室             ", "厦门浮点网络科技有限公司", "少于15人", "初创型(不需要融资)", "移动互联网,信息安全", "4.3"
"拉勾", "web前端", "web前端", "10000-15000", "本科", "上海", "1-3年", "职位描述岗位描述：1、负责公司软件产品的页面功能的开发和优化2、可以独立编写前端的页面，包括PC端和移动端3、有自己熟练掌握的比较好的技术框架，会设计方面优先4、利用HTML5/CSS3/JavaScript/Flash/React.js/angular.js等各种Web技术进行产品的界面开发5、配合后台开发人员实现产品界面和功能与后台的交互6、制作标准优化的代码，并增加交互动态功能。岗位要求：本科以上学历，计算机相关专业，技术优秀，大专学历也可考虑2年左右前端开发工作经验，有前端技术选型经验优先；3. 熟练掌握Web前端技术CSS/HTML/Javascript，有html5/css3开发经验4. 熟悉常用Web前端框架(jQuery,React.js，angular.js，Bootstrap等)；5. 良好的编程习惯和较强的的学习能力；6. 有责任感和良好的团队合作精神；7. 有java开发经验者优先", "上海泛微网络科技股份有限公司", "500-2000人", "成熟型(D轮及以上)", "移动互联网,企业服务", "4.0"
"拉勾", "web前端", "web前端", "6000-8000", "大专", "深圳", "1-3年", "职位描述岗位描述：1、负责公司软件产品的页面功能的开发和优化；2、利用各种Web技术模拟开发产品原型；3、利用HTML5/CSS3/JavaScript/Flash等各种Web技术进行产品的界面开发；4、熟悉微信端页面开发，掌握微信相关API接口。4、配合后台开发人员实现产品界面和功能与后台的交互，配合测试解决bug；5、制作标准优化的代码，并增加交互动态功能。6、根据UI设计图，利用html+css准确呈现符合逻辑、便于开发的Web页面，保证多浏览器的兼容（包括多种移动端浏览器）；7、负责页面重构标准制定推广及优化研究；岗位要求：1.专科以上学历，计算机相关专业，2年以上前端开发工作经验；2.熟练掌握Web前端技术CSS/HTML/Javascript，有html5/css3开发经验；3.熟悉常用Web前端框架(jQuery,Bootstrap)；4.良好的编程习惯和较强的的学习能力；5.有责任感和良好的团队合作精神。", "深圳市仁盟互动网络科技有限公司", "15-50人", "初创型(天使轮)", "移动互联网", "3.3"
"拉勾", "web前端", "Web前端工程师", "3000-5000", "本科", "沈阳", "不限", "职位描述岗位职责：1、根据产品需求，进行页面前端技术框架设计与开发；2、根据产品设计，利用HTML5相关技术开发网站、手机、平板电脑等多平台的前端应用；职位要求：1、两年以上前端开发工作经验；2、精通各类Web前端开发技术，包括Javascript、Ajax、CSS等WEB开发领域相关技术，有前端框架设计经验；3、熟练掌握Javascript/HTML5/CSS3相关技术，具有HTML5 App应用开发经验；4、熟悉编写能够自动适应HTML5界面，能让网页格式自动适应各款各大小的手机，熟悉交互设计，对可用性，可访问性等用户体验知识有相当的了解和实践经验；5、有很强的学习能力，清晰的思维，能独立分析和解决问题；", "沈阳森通广告传媒有限公司", "50-150人", "成长型(不需要融资)", "移动互联网,文化娱乐", "4.4"
"拉勾", "web前端", "web前端", "10000-20000", "本科", "北京", "1-3年", "职位描述岗位职责：1. 负责网站以及各个运营系统的前端实现、调优任职要求：1. 掌握Html/JS/CSS等基础前端技术，了解html5等优先2. 掌握JQuery等常用js库，了解Bootstrap等优秀前端库3. 掌握前端性能调优、资源优化能力4. 具有良好的前端架构能力，了解AngularJS等优先", "北京数联众创科技有限公司", "少于15人", "初创型(天使轮)", "移动互联网", "4.2"
"拉勾", "web前端", "web前端工程师", "15000-20000", "大专", "上海", "1-3年", "职位描述职位描述：1.负责社区网站前端开发；2.根据功能需求，独立负责相关模块的详细设计和编码任务；3.改进现有框架、基础构架，提高产品质量；4.针对业务场景的应用要求，不断优化设计和表现，提升性能和用户体验。职位要求：1.2年以上Web前端开发经验；2.熟练掌握JavaScript，HTML5/CSS3，Ajax等Web开发技术；（需要核心掌握并应用的的技术）3.了解各项技术的相关标准，并严格按照标准进行开发；4.熟练使用vue.js框架编写程序；5.熟悉各种主流浏览器的兼容性调试；6.了解数据结构以及后端语言PHP；7.能够主动跟进和应用新知识；8.良好的沟通与表达能力，思路清晰，有强烈的责任心和创新意识，业务逻辑理解与分析能力强。", "上海晨之科信息技术有限公司", "150-500人", "成长型(B轮)", "移动互联网,游戏", "4.2"
"拉勾", "web前端", "Angular Web前端", "6000-12000", "大专", "上海", "1-3年", "职位描述岗位职责：1.使用HTML/CSS/Javascript开发符合W3C标准的前端页面，实现高性能的交互效果；2.与后台开发人员协同实现产品界面和数据呈现及交互，专注通过技术改善用户体验；3.根据效果图进行开发，并针对主流的桌面及移动端浏览器进行兼容性适配；4.提供合理的前端架构，对页面整体结构及样式层结构进行设计和优化；5.开发可灵活定制、可扩展的前端UI组件。任职资格：1.乐于学习，不断提升前端技能；2.一年以上原生JavaScript开发能力，基础语法扎实；3.熟悉JavaScript模块化编程、面向对象编程，有良好的编码习惯；4.对AngularJS/ReactJS等常用框架具有实战经验者优先；5.熟悉后端语言者（如NodeJs/ASP）优先。", "英芝教育科技（上海）有限公司", "少于15人", "初创型(天使轮)", "教育,O2O", "4.8"
"拉勾", "web前端", "web前端", "10000-20000", "本科", "北京", "3-5年", "职位描述岗位职责：1、 参与需求评审，明确产品经理的需求；2、 根据需求完成相关的开发及自测；3、 可以独立开发前端产品任职要求：1、 本科以上学历，3年以上工作经验，有扎实的html、css、js技术功底；2、 熟练使用各种调试、抓包工具；3、 熟悉前后端交互的常用方式；4、 对grunk fis pure等构建工具有一定的了解；5、 对目前比较流行的框架库/工具库有一定了解；6、 头脑清晰，逻辑思维能力强，能独立快速分析问题，解决问题；7、 熟练使用svn等版本管理工具；8、 热爱工作，热爱生活，有激情，有责任心。", "会找房（北京）网络技术有限公司", "50-150人", "成长型(B轮)", "O2O", "3.8"
"拉勾", "web前端", "web前端工程师", "5000-10000", "本科", "杭州", "1-3年", "职位描述岗位职责：1.根据UE设计、UI效果完成Web前端开发工作，协助java开发工程师进行 后续开发；2.负责Html/CSS/Javascript等前台框架设计与搭建，制定Web开发中涉及 的各种书写规范；3.能快速处理常用（IE、firefox，chrome，opera，safari等）浏览器兼容 问题；4.协助产品经理完成相关工作。任职要求：1.有1-3年Web前端开发经验，精通各种Web前端技术，包括 jquery（mobile），nodejs等；2.熟练掌握HTML、CSS、JavaScript语言，精通DIV＋CSS页面布局，(X)HTML/CSS；3.对成熟前端框架，例如，bootstrap、angularjs等，有一定了解；4.能独立完成pc端和移动端的前端开发任务；5.深刻理解Web标准，对可用性、可访问性等相关知识有实际的了解和实践经验；6.对前端技术的发展趋势保持关注，热爱学习最新技术,喜欢创新，对算法有一定了解，能对核心代码进行优化能力者优先；7.有H5页面游戏开发经验者优先；8.对产品有一定理解或相关工作经历者优先。", "浙江日报新闻发展有限公司", "150-500人", "上市公司", "文化娱乐", "4.0"
"拉勾", "web前端", "web前端", "3000-6000", "大专", "长沙", "1-3年", "职位描述岗位职责：1、负责Web前端开发，制作符合W3C标准的Web页面，并保证浏览器兼容性；2、负责平台前端开发，后台工程师协作，完成数据交互、界面展示，并保证设备兼容性；3、研究和探索创新的开发思路和最新的前端技术，确保企业前端技术应用的先进性和创新性。任职要求：1、熟练掌握HTML5、CSS3、Javascript、JQuery、Ajax等技术；2、掌握W3C规范及浏览器内核差异；3、能够熟练使用javascript原生语言进行面向对象编程；4、熟悉常用JS框架（requireJs、jquery、ZeptoJs、AngularJs），能够对JS进行模块化开发；5、具有移动开发经验者优先；6、具有良好的分析和解决问题的能力，对攻关疑难问题具有浓厚兴趣；7、具有强烈的进取心和求知欲望，善于学习和运用新知识。", "湖南思洋信息技术有限公司", "150-500人", "初创型(未融资)", "移动互联网,电子商务", "4.2"
"拉勾", "web前端", "web前端开发", "15000-20000", "本科", "上海", "1-3年", "职位描述1. 负责公司产品或项目Web前端研发，并配合后端的开发。2. 根据需求实现页面交互效果。职位要求：1、计算机及相关专业统招全日制本科或以上学历；2、计算机软件或互联网行业，相关工作经验至少1年；3、精通HTML5/CSS3，JavaScript，Ajax等Web开发技术；（需要核心掌握并应用的的技术）4、熟练掌握前端开发技术(HTML5、JS、JSON、XHTML、CSS3)，了解各项技术的相关标准，并严格按照标准进行开发，熟练使用JQuery框架能与后台开发人员一起编写Ajax交互程序；5、熟悉各种浏览器的兼容性调试；6、对数据结构以及后台语言Java等有简单了解；7、良好的沟通与表达能力，思路清晰，有强烈的责任心和创新意识，业务逻辑理解与分析能力强。薪酬福利：1、提供有竞争力的薪资，执行相对公平合理的绩效政策和薪酬结构；2、其他福利：美味三餐、各种补贴、生日和节日福利、年休、优秀员工出国旅游等；3、作息时间：每天八小时工作制（9:00-18:00，午休1小时），双休+国家法定节假日。", "上海泛微网络科技股份有限公司", "500-2000人", "成熟型(D轮及以上)", "移动互联网,企业服务", "4.0"
"拉勾", "web前端", "web前端", "10000-20000", "大专", "北京", "3-5年", "职位描述岗位职责：1、根据产品设计文档，利用HTML5等技术开发web前端页面；2、实现产品Web前端与后台交互，获取、解析并展现数据等功能；3、负责前端设计，编写设计文档。技能要求：1. 本科以上学历，计算机科学、软件工程等相关专业，三年以上工作经验；2. 精通HTML、CSS页面设计，具备基本美术能力，精通原生JavaScript编程， 熟悉D3等常用JS框架，熟练掌握HTML5 Canvas动画开发，具备SVG技术开发矢量图形能力；3. 熟练掌握AJAX技术，熟悉WebSocket开发;4. 具有较强的钻研精神、学习能力及沟通能力，良好的职业道德，工作认真 踏实，责任心强，有团队协作及质量意识；5. 请在简历中提供个人近期作品。", "北京天行网安信息技术有限责任公司", "150-500人", "成长型(A轮)", "信息安全", "-"
"拉勾", "web前端", "web前端", "10000-20000", "大专", "杭州", "3-5年", "职位描述职位描述： 1. 负责主线产品App及Web系统、推广活动等前端页面的开发和优化  2. 与设计、产品及市场人员沟通，保证产品的质量和开发进度  3. 持续的优化相关的产品的质量、性能、用户体验 岗位要求：  1. 计算机相关专业本科以上学历，两年以上 Web 前端工作经验  2. 熟悉HTML5+CSS3+JS编程，熟悉各种前端开发调试工具，熟悉前端性能优化  3. 熟悉前端主流框架，并深入了解其运行机制，有Vue,React,Ng实战经验者优先  4. 熟悉新的HTML5表现形式的制作及开发, 有响应式页面开发经验优先  5. 有Hybrid App开发经验的优先", "杭州云书网络科技有限公司", "50-150人", "成长型(A轮)", "移动互联网,教育", "4.2"
"拉勾", "web前端", "web前端", "15000-25000", "大专", "北京", "3-5年", "职位描述岗位职责：1、与后台开发工程师配合，高效率高质量地完成网页的前端实现工作；2、负责公司WEB网页、移动端产品的前端性能优化和用户体验优化工作。任职资格：1、三年以上Web前端开发经验，能够进行面向对象/组件的前端设计和开发；要求有较强的页面制作功底（切图、DIV+CSS布局等）；2、掌握XHTML、CSS、JavaScript等前端相关技术，熟悉W3C标准，熟悉HTTP协议，会使用HTML5、CSS33、对用户交互、用户体验有较好的理解和研究；4、对各种浏览器的兼容性有一定了解，并有相关问题的解决经验；5、精通AJAX运作机制，掌握JQuery，angular等JS脚本，掌握angular优先考虑", "传神（中国）网络科技有限公司", "500-2000人", "上市公司", "电子商务", "3.9"
"拉勾", "web前端", "web前端", "5000-7000", "不限", "广州", "1-3年", "职位描述职责:  1. 负责制作页面效果做成标准的HTML网页原型；2. 负责开发平台前端静态页面JS交互效果编写及修改；3. 负责开发平台WEB前端（动态页面）最终交互效果的实现及修改；4. 负责协调技术开发人员进行页面与后台程序衔接。  任职条件:  1. 本科及以上学历，1年左右相关工作经验，计算机及相关专业优先；2. 精通HTML、JS等脚本语言，精通网页制作手法及软件，熟练使用AJAX实现前端效果，了解至少一门动态开发语言如（JSP、ASPX、PHP）等；3. 熟练掌握DIV+CSS制作静态页面手法（编码简练、规范、基本符合W3C标准）JS脚本编写前端效果，有一定AJAX前端脚本编写经历；4. 可以快速、简练的将网页设计图，使用DIV+CSS编写成静态页面，能够使用JS手工编写前端效果，能够使用AJAX方法实现前端效果；5. 有互联网产品开发经验者优先。  ", "广州奔步电脑有限公司", "150-500人", "成长型(不需要融资)", "移动互联网,电子商务", "3.6"
"拉勾", "web前端", "web前端", "7000-8000", "大专", "武汉", "3-5年", "职位描述职位描述:1、根据开发进度和任务分配，完成相应功能模块的代码编写、调试、测试和维护；2、辅助进行系统的功能定义,程序设计；3、能独立处理和解决开发过程中的问题；4、配合技术经理完成其它相关任务。岗位要求:1、4年以上.NET Web项目开发经验，熟练使用微软Visual Studio，熟悉C#语言;2、熟练掌握ASP.NET MVC、Web API、Dapper或EF、SignalR、Redis;3、熟练掌握HTML、DIV+CSS、XML、Json、JavaScript、Ajax、jQuery、Seajs等前端技术;4、熟悉APP接口开发; 熟悉SQL Server,熟练掌握SQL语句、存储过程的编写5、良好的沟通能力，理解并完成项目需求，有良好的创新精神和团队合作意识;6、工作细致认真，善于沟通、善于学习、有责任心;7、有智慧社区及电商类项目经验者优先.", "湖北乐投财富投资管理有限公司", "500-2000人", "成熟型(D轮及以上)", "金融", "5.0"
"拉勾", "web前端", "web前端", "6000-12000", "大专", "广州", "3-5年", "职位描述岗位职责1、负责公司官网、项目网站的开发与维护；2、负责网站整体的规划与设计，开发出符合公司和行业特点的网站产品3、负责移动商城前端的的开发与维护，配合APP产品部门协作进行移动网页的开发；3、理解微信微信公众号开发接口，能理解系统的业务需求，制定开发方案和策略，负责开发完整的集成系统4、会对开源系统进行二次开发；岗位要求1、3年以上Web前端开发经验，可以与UI设计师和后台开发人员熟练配合；2、熟悉WEB开发流程, 有和后台代码工程师合作开发的经验；3、善于使用前端基本调试工具，熟练手写代码，并熟练掌握HTML5、CSS3、JavaScript、Ajax、jQuery等Web技术，能独立编写；4、能够解决各主流浏览器兼容性问题，了解HTTP协议、Web后端技术（Java、PHP等）；5、 有手机端页面开发经验者优先；6、具备良好的服务意识、责任心、较强的学习能力、优秀的团队沟通与协作能力、能承受一定的工作压力。7、熟悉AngularJS前端框架。8、做过微信活动、页面对接，对微信接口熟悉。", "广州市玺诺王信息技术有限公司", "15-50人", "初创型(不需要融资)", "移动互联网,医疗健康", "4.0"
