"fromsite", "positionType", "positionName", "salary", "education", "city", "workYear", "jobDes", "company", "companySize", "financeStage", "industryField", "rate"
"拉勾", "web前端", "Web前端工程师", "6000-12000", "本科", "杭州", "1-3年", "职位描述  如果你觉得目前的工作重复而枯燥，缺乏学习机会，个人成长缓慢，请来我们这里，只有高手或者能快速成为高手者才能在这里生存；如果你觉得目前公司无法充分发挥你的能力并给予等同的回报，你还在靠低级的兼职外包补贴，请来我们这里，我们的待遇跟你的贡献能同步匹配，再也不用费劲去找兼职；如果你想要几年内买房买车，但目前的工作你看不到这个希望，请来我们这里，这里有充足的机会和空间；如果你想未来五年内成为某个创业团队的CTO，请来我们这里，我们不仅选拔培养CTO，还有大量的作为CTO外派到创业团队合作创业的机会。没错，在这里你可以在技术上深入专研，成为核心技术团队的技术专家；你也可以做拼命十三郎，一个人干两个人的活拿两份工资；你甚至可以拿着工资和股份加入我们的优质合作创业团队去创业，如果成功你将财物自由，即使失败，薪资还能随着你经验和能力的增长而增长。  如果你按1年来规划你的职业，关注短期的收益，这里未必是最佳选择。但如果你按3年、5年来规划你的职业，关注能力的成长和中长期的收益，这里就是你一直寻找的那个地方。【公司介绍】  巴卡斯科技（北京）有限公司正式成立于2014年8月，是由百度前高级架构师和美国Azimuth前中国区总经理联合创始的一家创业型公司。公司的创业思想是让互联网创业不再有技术壁垒。公司技术研发中心位于杭州市文三路478号华星时代广场A座。  公司自有的LAB（Light Apps Builder）框架平台，超越了Jquery Mobile、Sencha Touch等H5开发框架，Phonegap、AppCan等Hybrid开发框架，是一款高性能低开发成本的框架，快速App生成系统。可支持快速开发WebApp、HybridApp（IOS、Android）、微信轻应用的开发框架，处于行业领先水平。现有的LAB 2.0完善了高度可复用的闭包组件机制，并且通过框架简化了开发中常见的难点，开发效率大幅提升。巴卡斯科技是国内HTML5和Hybrid的技术的领先者。  主营业务是面向于互联创业或向互联网转型的创业型公司提供互联网技术服务，现主要面向P2P互联网金融和O2O领域。  我们欢迎同样有梦想，同样有追求，同样有激情，同样执着于技术的你加入！【岗位职责】- 开发可灵活定制、可扩展的前端UI组件- 开发、维护、扩展前端代码框架- 开发基于HTML5的WebApp- 开发Web网站【岗位要求】- 精通HTML/CSS/JAVASCRIPT，熟悉W3C标准，对页面性能和浏览器兼容有丰富的实践经验- 精通HTML5/CSS3相关技术，并有实际的开发经验- 熟悉至少一门后端语言者优先（如Java/PHP/python），PHP语言的优先- 熟练使用jquery框架，制作简单的交互效果，了解Ajax、DOM、XML、JSON等相关技术- 了解微信服务号及订阅号开放平台前端开发者优先考虑- 热爱前端技术、有高度的技术敏感度、广阔的技术视野- 请在简历中附上作品，如果是合作完成的请说明自己实际参与的部分", "巴卡斯科技（北京）有限公司杭州分公司", "15-50人", "初创型(未融资)", "移动互联网,金融", "-"
"拉勾", "web前端", "web前端", "8000-12000", "本科", "杭州", "1-3年", "职位描述岗位职责：主要负责网站WEB前端开发工作。职位描述：1、精通HTML、JavaScript、Ajax、CSS等Web开发技术； 2、对Web标准和兼容性有良好认识，能够高保真还原设计稿，具备良好的代码风格以及接口、架构设计能力； 3、能熟练使用主流的JavaScript框架（SeaJS、BackboneJS、GruntJS等），并精通其中的一种以上； 4、熟悉HTTP的基本工作原理以及常用WEB开发调试工具； 5、对Web前台的性能优化以及Web常见漏洞有一定的理解和相关实践 6、有HTML5、CSS3使用经验者优先； 7、有用户体验网页设计经验者优先；任职要求：1、计算机相关专业本科学历；2、有良好的沟通能力和团队合作能力，善于沟通，工作自主驱动，具备良好的问题定位分析能力。", "安吉阿母工业设备有限公司", "50-150人", "成长型(A轮)", "移动互联网,电子商务", "-"
"拉勾", "web前端", "web前端", "10000-20000", "大专", "上海", "1-3年", "职位描述职责方向：1、各产品线Web端功能设计、开发和实现；2、各产品线易用性改进和Web界面技术优化；3、前端框架设计及组件库开发。4、前端通用工具的开发实现。5、Web前沿技术研究和新技术调研。职位要求：1、掌握良好的前端技能，包括XHTML/XML/CSS/Javascript，了解WEB标准化、性能优化方法，了解可用性、可访问性和安全性。2、熟悉掌握一种常见JS框架，如Jquery，YUI，ExtJS等，并有一定的前端框架设计能力。3、热爱前端，热爱设计，对新鲜事物充满好奇心，有折腾的想法和精力，喜欢捣鼓各种互联网应用。4、自我管理能力强良好，崇尚团队合作，快速的学习能力，乐于分享与沟通。5、有Web后端脚本的语言（如Java/NodeJS/PHP/C#/C /Python）开发经验者优先。", "上海载和网络科技有限公司", "150-500人", "成熟型(C轮)", "移动互联网,电子商务", "3.4"
"拉勾", "web前端", "web前端", "20000-30000", "本科", "北京", "5-10年", "职位描述职位描述1，负责嘉芸汇webapp，pc端等业务前端研发。 2，为快速成长的业务提供可靠的技术保障。3，与各端工程师探讨设计，给出能够落地的技术方案。任职资格： 1、熟悉现代主流的前端开发技术(HTML, JavaScript, CSS)以及比较常用的开源库（jQuery，Backbone.js，Bootstrap.js, AngularJS）2、 熟悉各浏览器兼容性问题，能够进行前端页面性能优化，了解XSS防范技术。3、 能够高还原度的完成设计师的设计图，希望能够对设计和产品提出自己的合理建议。加分项：1，追求用户体验，并有相关作品2，掌握一门服务端语言，如node，php，java 3，有异于常人的能力，如毅力，执行力，审美能力等4，有独立的个人作品", "北京嘉芸汇科技股份有限公司", "50-150人", "成长型(不需要融资)", "移动互联网", "3.8"
"拉勾", "web前端", "Web前端", "15000-25000", "本科", "上海", "3-5年", "职位描述岗位职责：1、依据产品需求完成高质量的Web前端开发任务2、与后端开发人员配合，结合前端技术建立和优化流畅的Web的交互方式3、负责解决产品在不同浏览器、移动设备端及不同版本下的兼容问题岗位要求：1、计算机相关专业大专及以上学历，3年以上互联网前端开发工作经验。2、精通各种Web前端技术（HTML/CSS/Javascript/HTML5等）3、拥有2年AngularJS开发经验，或3个及以上采用该框架的互联网或综合内部系统4、熟悉浏览器兼容技术，响应式设计和前端性能优化5、熟悉Web页面制作、JQuery等技术者优化考虑。", "上海艾匀信息科技有限公司", "15-50人", "初创型(天使轮)", "移动互联网,数据服务", "3.8"
"拉勾", "web前端", "web前端", "10000-15000", "大专", "青岛", "1-3年", "职位描述工作职责1、负责北森产品的前端页面制作；2、优化代码并保持良好浏览器兼容性；3、负责使用css、js等技术实现前端交互效果；4、Web前端技术的跟踪和研究。任职资格1、本科以上学历，一年以上前端开发工作经验（优秀的应届生也可以） 2、热爱并执着前端工作，性格开朗，具有良好团队合作精神，有高度的责任心， 3、熟悉Web标准，能够熟练应用XHTML，HTML，CSS进行开发，熟悉页面架构和DIVCSS布局 4、掌握并理解JavaScript基础知识，对于Dom,Bom,和浏览器的事件机制有一定的的了解 5、有面向对象的开发经验，了解并能应用前端开发过程中的常用的封装继承的方法 6、应用或了解过前端开发框架中的一种或多种，比如backbonejs,angularjs,reactjs等 7、熟悉针对主流浏览器的代码兼容优化。 8、加分项：能够阅读英文文档，了解前端代码的优化方案，了解不可变数据集，单向数据流等员工福利1、七险一金，除了五险及住房公积金外，额外为员工上意外伤害险和补充医疗保险；2、弹性工作制，上班时间7-10点，下班时间4-7点均可；3、所有员工完全平等，直呼其名，包括管理层；4、国家规定的所有法定假日及年假、婚假、产育假等假期；5、用餐补助、各类年节礼品及每年的年度旅游，年度体检；6、完善的培训和多方位的职业发展通道及良好的内部激励机制7、用人理念是“不仅仅是土豆”精神（可去百度“不仅仅是土豆”的故事）", "北京北森云计算股份有限公司", "500-2000人", "上市公司", "企业服务,数据服务", "4.0"
"拉勾", "web前端", "web前端", "9000-18000", "本科", "杭州", "1-3年", "职位描述岗位职责：1. 参与公司web前端产品工作；2. 参与产品前端性能优化、兼容性优化、故障排查和解决、安全加固等维护工作；3. 注重用户体验，研发可灵活定制、可扩展的前端UI组件。任职要求：1. 计算机相关专业，本科及以上学历，2年以上互联网前端开发经验；2. 熟悉HTML5/CSS3、熟悉页面架构和布局；3. 至少精通一门前端技术框架或者类库，例如：jquery、bootstrap、angularjs等；4. 有移动开发案例经验者优先，熟悉基于phonegap apicloud hbuilder框架优先考虑；5. 熟悉常用通信协议http、tcp/ip以及json,soap等应用数据格式；6. 熟练使用Chrome DevTool、firebug、fiddle等工具，能够快速定位和解决线上问题；7. 熟练使用idea、webstrom等前端开发工具；8. 良好的沟通能力以及团队协作精神。", "杭州优橙科技有限公司", "15-50人", "初创型(天使轮)", "数据服务,其他", "-"
"拉勾", "web前端", "Web前端", "10000-20000", "本科", "成都", "5-10年", "职位描述岗位职责：*根据项目需求，分析并给出合理的页面前端结构解决方案；*团队配合，参与公司应用前端架构的设计和规范工作，优化代码提高产品性能；*配合产品经理和UI设计师，研究并改善产品的用户体验；*负责Web前端，PC端和移动端；*有审美观，能将设计师设计的效果图用最少的HTML语言将其完美的实现。能力要求：*4年以上前端开发经验，具备移动端WEB开发经验；*了解MVC模式，能独立使用前端框架AngularJS、React、NodeJS、Backbone一种以上；*熟悉样式框架方案Bootstrap、AngularMaterial进行标准化的前端开发；*追求极致的用户体验和快速迭代，对浏览器兼容性、代码可维护性、前端性能优化等有深入研究；*有团队协作精神、善于学习，乐于探索，能承受一定的工作压力。", "四川中视博瑞科技有限责任公司", "150-500人", "成长型(不需要融资)", "移动互联网,电子商务", "-"
"拉勾", "web前端", "web前端开发工程师", "8000-12000", "大专", "潍坊", "3-5年", "职位描述岗位职责： 1.负责web系统的前端开发工作。 2.负责web页面的性能优化，以保证系统功能的体验效果。 岗位要求： 1.3年以上前端开发经验。2.精通javascript、html、css原理，熟练使用ajax开发技术，熟悉jquery等多种开源技术。 3.熟悉各种web浏览器的技术特点，并能快速定位和解决各种功能和性能问题。 4.具备独立承担前端开发任务的能力。良好的编程习惯，具有面向对象思想。5.具备快速的学习能力，良好的团队合作能力。6.使用过bootstrap、express、vue、nodejs 优先考虑。一经录用提供具有竞争力的薪酬体系和福利保障制度。", "山东老刀网络科技有限公司", "15-50人", "成长型(A轮)", "电子商务", "4.0"
"拉勾", "web前端", "web前端开发", "8000-15000", "本科", "广州", "3-5年", "职位描述岗位职责：1、负责前端界面的前端构建，各类交互设计与实现；2、前端样式和脚本的模块设计及优化；3、配合后台开发人员完成项目。任职要求：1、计算机或相关专业 本科以上学历，3年以上前端页面与脚本开发经验；2、精通XHTML/XML、CSS，熟悉页面架构和布局，对表现与数据分离、Web语义化等有深刻理解，对HTML5/CSS3/nodejs等技术有一定了解；3、精通JavaScript、Ajax、DOM等前端技术，掌握面向对象编程思想，对js框架应用（如prototype/jQuery/YUI/Ext等）有一定的经验；4、有独立完成复杂前端模块的设计与实现的经验，优化代码并保持良好兼容性；5、至少熟悉一门非Web前端脚本的语言（如Java、PHP、.Net、Ruby）；6、对用户体验、交互操作流程、及用户需求有深入理解；7、有强烈的上进心和求知欲，善于学习和运用新知识，善于沟通和逻辑表达，有强烈的团队意识和执行力。", "广东省电信规划设计院有限公司", "2000人以上", "上市公司", "移动互联网,金融", "3.9"
"拉勾", "web前端", "web前端", "20000-40000", "本科", "北京", "3-5年", "职位描述我们是美团网的前端团队，负责美团外卖业务我们是有趣的年轻人，待人真诚，做事靠谱，创业团队氛围，简单可依赖工作职责？指导初级工程师持续优化，建设前端基础设施支持美团外卖各个业务线前端开发需求，为用户呈现最好的界面交互职位要求？作为一名前端攻城师的硬技能就不累赘描述了，你会懂得熟练的使用一门后台技术（node.js/python/PHP/java），因为我们觉得，行于前端，而不应止于此同时，我们坚信一点，闻道有先后，术业有专攻，上边的都可以无视我们欣赏的同学，需要有强大的自驱力；积极主动，有想法；并且知道如何不断持续的提升自己；精于问道，勤于实践对技术有一定的热忱和激情，发自内心的热爱这份职业我们提供了什么？一份绝对会令你满意的薪水，比较优秀的会有期权奖励一套程序猿的顶级梦幻装备，Retina屏幕的MBP，一把超舒适的人体工程学座椅，以及27寸外接大屏一群聪明的小伙伴们一个能够充分发挥你才能的轻松，愉快的工作环境一家满了极客氛围的公司公司介绍：美团外卖配送事业群是美团O2O战略的重要支柱之一，我们的使命是“把世界送到消费者手中”。美团外卖用了一年多的时间日单量突破230万，成为行业第一；美团早餐、美团商超、美团药店等新的品类也在飞速发展以及水果、超市、生鲜等业务的加入，技术团队扮演了一个至关重要的角色，同时，我们也在持续面临各种新的技术挑战，需要有更多的技术牛人加入！", "北京三快在线科技有限公司", "2000人以上", "成熟型(D轮及以上)", "移动互联网,O2O", "3.7"
"拉勾", "web前端", "web前端", "2000-3000", "大专", "成都", "不限", "职位描述任职资格：1.具有良好的js、css、html基础；2.会使用Photoshop；3.有过web前端开发工作经验的优先；4.能独立承担web前端代码开发者优先；5.有良好的软件编写习惯及良好的工作方式方法者优先；6.会html5者优先；7.接受北京出差，公司提供出差补贴；8.愿意同企业一起成长，有创业的心态来投入工作；9.投简历时请根据招聘要求投递您的简历；工作经验：工作经验不限，可接受实习生，有工作经验的优先", "成都执梦科技有限公司", "15-50人", "初创型(未融资)", "移动互联网,教育", "4.2"
"拉勾", "web前端", "WEB前端开发工程师", "18000-25000", "本科", "深圳", "3-5年", "职位描述岗位职责：1、负责前端系统架构，系统主要包括微信端和运营管理系统；2、负责运营管理系统开发工作，涉及到报表统计，数据可视化等。任职资格：1、要求全日制本科，3年以上工作经验；2、精通javascript模块化开发和前端组件开发；3、熟练使用requireJS、sass、zepto、reactjs等，熟悉grunt或者gulp等前端构建工具；4、对MySQL数据库和SQL语法有基本的认识和了解；", "深圳市光维通讯有限公司", "50-150人", "成长型(不需要融资)", "移动互联网,O2O", "-"
"拉勾", "web前端", "web前端开发工程师", "15000-25000", "本科", "苏州", "3-5年", "职位描述我们拒绝平庸，只为让世界WOSAI ！我们是一家专注于线下商户信息化服务的移动互联网创业公司，用移动互联网和云计算技术来变革线下商业的管理和营销模式。喔噻科技成立于2013年，2015年完成A轮、A+轮融资，由国内知名风投机构及战略投资人投资。喔噻总部设立在上海，在苏州设有研发中心，已经在北京、深圳、广州、杭州等全国十几个一、二线城市设有分公司。喔噻是一群追求酷和爽的人。我们希望你能和我们一起开心地工作和生活。喔噻不会在她的员工手册中要求你们“勤劳”、“正直”、“勇敢”，嘿，我们怎么可能相信我们的同事不是这样的。喔噻也是部小说，虽然不用上刀山下火海，但我们在通过互联网的方式引领传统行业的变革；虽然没有乔布斯，但有硅谷LinkedIN的技术大牛，各路金融数据公司的精英，江湖派的地推营销高手，也有一群阿里、百度、腾讯、新浪微博来的优秀屌丝以及各路江湖高手，我们的团队超级互补。过去一年中，我们经历了前所未有的快速增长，我们的“收钱吧”产品已经遍布在全国主要城市的大街小巷，为几十万线下商家提供移动支付服务，成为线下最大的移动支付服务商之一，并进一步转型为线下商家提供综合性信息化服务。所以，我们的故事，还刚刚开始……如果你热爱互联网，希望凭借自己的努力来一起改变世界，那我们诚邀你加入我们的团队。因为的确，我们在真真正正地改变世界。这里没有政治和官僚，没有一尘不变，没有懒散和懈怠，你身边的每一个人都会用行动向你诠释喔噻的价值和活力。移动前端开发工程师我们希望你是：1.具有3年以上前端开发经验2.熟悉 HTML / CSS / JS（或精通任一项）有良好的编码习惯3.有已发布的app4.有过Objective-C/Swift 和 Cocoa Touch 或 Java 和 Android SDK 开发经验我们需要你：5.负责销售CRM&APP的开发和优化6.配合后台开发人员实现产品界面和功能与后台的交互7.制作标准优化的代码，并增加交互动态功能加分项1.对 React Native 技术有兴趣2.有Hybrid App开发经验3.具有后端或前端开发经验4.开发过高度交互的移动端应用如果这些对你来说已经信手拈来，那么再看看我们的诚意吧。先来点实际的：- 弹性工作制，严禁打卡- 每月员工生日联欢Party，免费- 零食，水果，咖啡必须有- 独立的公司健身房（跑步机、动感单车、综合器械等）和瑜伽房- 高尔夫练习球道- 专业整套架子鼓- 休闲酒吧台 + 60寸乐视电视 + 众多小米电视 + 游戏机- 每年户外骑行，户外徒步，户外旅行动起来- 入职有年假，每年加薪机会，年终Bonus，那是必须的！当然，这些也会是你看中的：- 顶尖互联网公司的工作氛围和人际关系- 开放办公环境，再牛的大佬都坐在你周围- 迅速提升的学习机会和职业发展路径- 硅谷大拿和业界精英不定期开坛分享讲座- 各路全能的BOSS和最优秀的同事- 正常带薪休假及体检福利- 员工股权激励在喔噻，我们要让宅男腐女们能够在文明其精神之余，同时野蛮其体魄！", "上海喔噻互联网科技有限公司", "150-500人", "成长型(A轮)", "移动互联网", "4.1"
"拉勾", "web前端", "web前端", "10000-20000", "本科", "成都", "5-10年", "职位描述岗位职责：*根据项目需求，分析并给出合理的页面前端结构解决方案；*团队配合，参与公司应用前端架构的设计和规范工作，优化代码提高产品性能；*配合产品经理和UI设计师，研究并改善产品的用户体验；*负责Web前端，PC端和移动端；*有审美观，能将设计师设计的效果图用最少的HTML语言将其完美的实现。能力要求：*4年以上前端开发经验，具备移动端WEB开发经验；*了解MVC模式，能独立使用前端框架AngularJS、React、NodeJS、Backbone一种以上；*熟悉样式框架方案Bootstrap、AngularMaterial进行标准化的前端开发；*追求极致的用户体验和快速迭代，对浏览器兼容性、代码可维护性、前端性能优化等有深入研究；*有团队协作精神、善于学习，乐于探索，能承受一定的工作压力。", "成都海默科技有限责任公司", "150-500人", "成长型(不需要融资)", "移动互联网,O2O", "-"
"拉勾", "web前端", "UI/WEB前端", "8000-13000", "本科", "上海", "1-3年", "职位描述岗位职责：1.负责PC端和移动端网站整体界面设计；2.负责平台整体形象设计、风格及展示设计，首页广告图片制作及美化、整体布局、活动广告和相关图片的制作；3.实现部分前端页面和编码；4.完成其他相关的分配工作。任职要求：1.2年UI经验，有互联网或管理平台美工经验，微信平台运营美工设计经验；2.熟悉HTML、CSS，会一种前端框架，如：bootstrap，或者Vue.JS；3.熟练掌握photoshop、illustrator、dreamweaver等图片设计、网页制作软件；4.能快速进行网页样稿设计及切片化处理，良好的电子商务网站的配色和设计能力；5.投递简历时请放上附件，谢谢", "上海凯德数值信息科技有限公司", "15-50人", "初创型(未融资)", "企业服务", "4.3"
"拉勾", "web前端", "web前端", "4000-8000", "大专", "厦门", "3-5年", "职位描述1、负责PC商城网站、手机微信及移动端Web App开发。2、精通web前端技术，div+css，HTML5/CSS3/JS/jQuery,熟练应用Html5、css3的新功能,有一定的手写脚本能力，能够手写符合W3C标准的前端页面代码。3、能够很好的兼容网页各种浏览器以及各种移动端设备。4、了解响应式布局设计、前端性能优化优先考虑。5、对UI以及网页产品设计有了解的优先考虑。6、责任心强，具有良好的沟通、协作能力和团队合作意识，具有较强的上进心并能承担一定的工作压力。7、大专以上学历，3年以上工作经验。", "厦门果核教育科技有限公司", "15-50人", "成长型(B轮)", "移动互联网", "-"
"拉勾", "web前端", "web前端工程师", "10000-15000", "本科", "武汉", "1-3年", "职位描述岗位职责：1、深入理解web标准，关注前沿web技术，熟练解决浏览器兼容性问题2、精通jQuery、Javascript，熟练掌握Ajax和DOM编程3、熟悉常用的Javascript设计模式，具备模块化开发的能力4、熟悉html5和css3页面的构建和移动Web开发5、精通div+css的页面布局，具备一定的UI设计能力加分项：1.对前端可扩展性架构有深入研究2.具备jQuery插件开发经验3.有html5移动应用开发的经验4.熟悉至少一种后台语言，如nodejs、php、python任职要求：1、参与私有云Web前端开发工作", "北京中科云华科技股份有限公司", "50-150人", "初创型(未融资)", "企业服务,数据服务", "-"
"拉勾", "web前端", "web前端", "8000-15000", "大专", "东莞", "3-5年", "职位描述【岗位职责】1、负责公司Web前端系统设计、开发与实现；2、与设计师和后台程序配合，高效率高质量地完成页面展现工作；3、各产品线Web端功能设计、开发和实现；4、Web前沿技术研究和新技术调研。【任职要求】1、三年以上web前端开发经验,偏JS方向两年以上开发经验；2、熟悉流行前端MVC架构,熟悉流行框架（如Angular、React、Backbone、JQuery、Bootstrap等)；3、精通Web前端技术，包括HTML、CSS、Javascript、Ajax、DOM、JSON等前端技术；4、熟悉各种web标准，了解各种主流浏览器特性，使页面兼容主浏览器；5、熟悉各种前端调试工具； 熟悉JS性能优化；6、熟悉Ajax，能与后台开发人员良好的合作，进行协同开发；7、爱好新技术，乐于钻研新技术并吸收精华应用于产品开发。", "东莞市银众实业投资有限公司", "50-150人", "初创型(未融资)", "移动互联网,金融", "-"
